id	qid1	qid2	question1	question2	is_duplicate
208707	277214	168664	What is the difference between mirin and rice wine?	What is the difference between rice vinegar and rice wine vinegar?	0
9999	19412	19413	What are the most respected and informative textbooks for studying undergraduate-level organic chemistry?	What are Caltech's required and recommended textbooks for undergraduate organic chemistry courses?	0
379719	511256	511257	What are the suggestions on renewable grid integration?	What are the Suggestions for renewable energy grid integration?	1
82387	59327	139707	How are sea breezes and land breezes alike and different?	How are land and sea breezes different?	1
66333	114989	71014	Which is a suitable solar panel installation provider near Homeland, California CA?	Which is a suitable solar panel installation provider in Albany, California CA?	0
284829	405163	30782	Money or happiness?	How can you look at someone's private Instagram account without following them?	0
337941	155291	185624	What is GDP? And explain in simple terms?	What is GDP? How is it calculated?	0
270268	388130	102808	How long does it take to make a new language?	How long does it take to learn a new language?	0
391382	523976	523977	Why do registrars continually increase the price of top level domains?	How can I get a pseudo top-level domain?	0
106412	57951	63598	What are some ways to lose 30 pound in 1 month?	What is the fastest way to lose 30 pounds in 1 month?	1
101196	167695	167696	If Team India (Cricket) wins a match or a series, do they get paid more than their usual fixed salaries?	Do lawyers earn more if they win a case?	0
5421	10667	10668	Do I need to know about nutrition to become a football coach/manager?	Guitar player always looks at singer?	0
80853	42853	56149	How can i recover from failure?	How can we recover from failure?	1
203620	33438	270399	What is devolution? What are the benefits?	What are the advantages and disadvantages of devolution?	1
220088	327125	70621	Is Kindle a good buy? Why?	Is Kindle a Good buy?	1
355080	42091	3781	How do I learn the stock market?	What is the best way to learn about investing in the stock market and what stocks to buy?	1
286709	114938	407347	Since I can't hold a conversation with women, should I get a hot body to compensate for my poor social skills?	Should I accept a job offer to be a Business Analyst or improve my programming skills for a few months to work at a hot startup?	0
252921	367350	367351	Will Quora ever run out of money?	How sustainable is Quora before it runs out of money?	0
202292	304535	304536	In which cases, I can use copyrighted materials as fair use?	What happens if you come out worse after having back surgery?	0
268227	385733	161364	What can be read or learned to become more intelligent?	What are the ways to become extremely intelligent?	1
212147	317154	317155	Do Skullcandy ear phones work on a Lenovo K3 Note?	Which is the best rom for Lenovo k3 note ?	0
216033	322066	322067	Are amphetamines addictive?	Why is amphetamine so addictive?	0
147729	233085	233086	If not, what are their differences and their similarities?	What are their differences and similarities?	1
71420	122905	122906	Who are the best writers on Quora?	Who are the 2013 Top Writers?	0
27129	50421	25121	When and why do people commit suicide?	Why do you want to commit suicide?	1
276753	28633	395738	How does people in the deaf community feel about the tv show Switched At Birth portraying the deaf community?	I'm curious. How do French people feel about the LGBT+ community and their rights?	0
102687	169874	169875	Do the female egg and the male sperm contribute equally in the creation of new life in humans?	I'm a male. How different is the life of a female?	0
204046	306837	306838	Which song do you like best in your life，could you share it with us here？?	What's your favorite song? Why do you like it best? Share it with us	1
102544	10473	2581	Is it possible to time travel to past?	Is time travel still theorized as being possible?	1
206209	309563	309564	What sociological theory best explains bullying? Why?	Who is the best sociology tutor in Bangalore?	0
360105	489838	489839	Can I develope mobile apps with c++?	How can I develop mobile apps with C++?	1
272491	390783	390784	What is the disadvantage of option subject anthropology?	What are disadvantages of anthropology?	1
151225	22373	141304	Why the banning of 500 and 1000 rupees notes?	Why did GOI demobilise 500 and 1000 rupee notes?	1
170311	263353	263354	Why do Poles dislike Russians?	Why do the Poles dislike Russians more than they dislike Germans?	1
380216	375989	244570	Is SRCC GBO worth joining or is it a course with only a name and not any structure?	How is GBO course of SRCC in terms of placement and faculty?	1
165505	6676	29983	Who won the 2nd presidential Debate?	Who won the 2nd 2016 Presidential debate?	1
300712	423533	423534	What is the difference between B2B, b2c and marketplace?	What are the differences between B2B, B2C and marketplace?	1
120289	171158	92320	How much data can the human brain store? Is there any limit to it? Can humans keep storing information as much as they want? If so, how?	Is there a limit to how much knowledge a human brain can retain?	1
8907	2847	11287	Which was the best film of 2016?	What is the best latest movie?	1
347259	475716	475717	Why was baseball voted out of the 2012 Olympics?	Why was baseball taken out of the Olympics?	1
116344	25113	33397	How do I prepare for BITSAT-2017?	What should be the strategy to prepare for BITSAT 2017?	1
322446	201229	4905	Which are some good non fiction books I should read?	What are some good non-fiction books that I should read?	1
326307	450368	277421	Where are the origins of Ayurved?	Where are the origins of the Ayurveda?	1
56980	100206	100207	What is cultural relativism and what are some examples?	What are some examples of cultural relativism?	1
157672	7530	20472	How will the ban on 500 and 1000 rupee note stop black money?	How banning 500 and 1000 rs note will help fight corruption in India?	1
189254	2209	29700	Quora: How do you post a question on Quora?	How do I post a question in quora?	1
333602	180522	236646	What, according to you, is the best Disney film?	What is the best Disney movie?	1
402610	101916	47793	How do I stop masturbation and forget women?	How can I stop masturbating?	1
121293	66853	39890	How do I commit suicide with no pain?	What is the best way to commit suicide in India?	1
400214	533555	533556	What is your opinion on Israel?	What is your opinion of Israel?	1
231991	296823	41822	What does ISIS want? What is its objective?	What does ISIS want?	1
157966	246861	246862	What are some good science magazines I can get in India?	Which is the best science magazine in India?	1
379590	150682	284614	What are the best local/couch co-op games for PS4?	What are the best two player games for the PS4?	1
31522	58110	58111	What should I know about Quora?	I am new to Quora. What all should I know about it?	1
61346	2567	42620	Is there some painless way to suicide?	What is a sure way to commit suicide?	1
364685	191521	494752	What happens if you travel at the same speed as the earth rotates but in the opposite direction?	What hapens if all people walked on the opposite of the earth rotation at the same time?	1
93968	157005	157006	Where should I start looking for a software internship?	How do I find and apply for an internship?	1
98161	160398	109966	Where can I take an IQ test on the internet for free?	What are some free online test that I can take to measure my IQ correctly?	1
5253	10343	10344	How can I shoot a time-lapse of a withering flower?	How can I shoot a time lapse of a withering flower?	1
290061	17632	89884	What is the reason behind the sudden discontinuance of 500 and 1000 notes by PM Modi?	What is the reason behind PM Modi's decision to abolish Rs 500 and 1000 currency notes from today (8 November 2016) midnight?	1
177765	63452	108926	What will happen if Donald Trump gets elected?	What's going to happen to America if Donald Trump wins?	1
346803	1781	127638	What are the best interview questions ever asked?	What is the best interview question?	1
208712	90720	312780	How can I get a job in UK if I have a Tier 2 General Visa?	How do I find a job in UK if you already have a Tier 2 General visa?	1
214819	60274	39796	Would banning notes of denominations 500 and 1000 help to curb the black money in system?	Will the demonetization of the Rs 500/1000 notes in India actually help to curb black money? Or do the rich store their untaxed cash?	1
160073	88278	29548	How do I learn programming from scratch to start on my own?	What is the easy way to learn a programming language?	1
117667	191421	191422	How does it feel to be part of a music video where you see the singer but you can't act like a fan?	"Is it racist to say random Japanese words to a person who ""looks East Asian"" but is not? Is it ok for said person to get angry because of this?"	0
5765	11325	11326	How does Google Analytics on mobile know age and gender?	In Google Analytics, how can I plot an overtime line chart of the percentage of visitors from mobile devices out of total number of visitors?	0
131376	210654	101570	Where can I get Raki in Las Vegas?	"Why is a drink of liquor called a ""shot""?"	0
305437	48012	307636	What are the differences between SEAL Team Six and Delta Force?	What are the differences between Marines and SEALs?	0
231049	222467	70539	What is the meaning of Hindi word 'Danga Fasad'?	What is the meaning of Hindi word 'Gaddar'?	0
348117	476645	206124	Getting Published: Where can you submit a political magazine article and get a response from an editor one way or another?	A magazine asked if they can publish my blog article. What should I ask in return?	0
38551	37106	69993	What is the square root of 40 in radical form?	What is the square root of 7?	0
134356	214755	214756	I am an electrical student. I'm interested in app designing and start a new Android app. But I don't have a basic idea of programming languages. What should I do?	I am tech savy but I have no knowledge of programming. Where should I start for the basics? What are the languages with web links?	0
170324	263370	263371	What are the similarities between ethical egoism and utilitarianism?	I want to prepare for KVPY in class 10th can you give me some advice how to prepare?	0
49197	87585	87586	"I would like to make a business website that has the ""pay N amount per month"" feature. How or where do I get started if I do not have any experience in coding?"	If I made a website that contains only videos how much would I make per month with Google AdSense?	0
158310	247342	247343	Is it high time that Bengaluru is declared as union territory?	Can Bengaluru be created as Union Territory?	0
226031	334544	334545	What are construction drones use for?	Can we use drones for construction?	0
212013	316985	239182	Is electromotive force a force?	What is electromotive force?	0
46068	46892	82443	How can I smile more?	How can I smile well?	0
122775	198640	2856	What is the difference between a Ford Fiesta ST and a ST150?	What is the difference between an UberX, Uber Black and Uber Taxi?	0
254770	369566	80922	Is there any way to access app sandbox in iOS 9 without Jailbreaking?	How do I jailbreak iOS 9.3.4?	0
135903	216951	216952	If a girl finds me attractive, does that mean they find me good looking?	Where I should take admission Vidya Mandir Pitampura RCC or Dwarka extreme X or?	0
259190	374931	122571	How do I complete and balance an equation for reaction of hydrochloric acid (HCl) with sodium hydroxide (NaOH)?	How does HCl and sodium hydroxide react?	0
267865	385321	385322	How do I use Android studio 2.2.2?	How do I use Android Studio 2.1.1?	0
263140	379641	379642	What is the probability of drawing a red or even in a deck of cards? (if Ace, Jack, and King are considered odd and Queen is considered even)	A poker hand consists of 5 cards. It will come from a well-shuffled deck of cards. What is the probability of having 4 Queens and any face card?	0
322078	447847	447848	How safe is Georgia?	What is your review of Georgia (country)?	0
285928	406424	406425	What is the approx. subsciption cost of Lucid's Artificial Intelligence Platform - Cyc?	What will AI's conclusion of the human race be? Would there be any reason at all that they would need or want to have us around?	0
395685	528676	528677	Which are the must see see places in India?	What are the top 20 tourist places in India you must visit before you die?	0
238236	349556	349557	What are some good, new rock bands?	Are there any good rock bands in Leicester?	0
165879	257494	257495	My jiofi device is navy able to make calls, jio4gvoice app shows only SMS, but when I put the sim in phone it works well.. Why this is happening?	Why does the US Army use terrain analysis?	0
322620	212107	448467	How can I become friends again with an ex-friend?	How do I become friends with myself?	0
12440	23969	23970	What are the adaptations of koala bears?	Can I use GitHub to create user manuals and online help guides?	0
248905	362405	136258	Who would you save your loved dog or a strange human?	Why do some people love dogs so much?	0
305704	429143	429144	Why can’t IITANs become leaders?	Why can’t the IITANs and IIM become leaders?	0
390567	523088	234641	What are some things new employees should know going into their first day at Vascular Solutions?	What are some things new employees should know going into their first day at PDF Solutions?	0
182924	279845	279846	What are the symptoms ruptured sinus cavity?	Can one reverse tooth decay or a cavity?	0
140745	223611	20864	What programming skills can be learned in one year for somebody aspiring for GSoC 2017?	How do I prepare for the Google Summer of Code (GSoC)?	0
256260	371326	371327	How do I find out the DOS attack?	How do I DoS attack a website?	0
376916	36495	469460	With what diet can I lose a lot of weight fast?	What are the most important habits for eating healthy and losing weight?	0
351129	264014	479945	Is there an app for iPhone with which you can download free music with lyrics?	Which apps are there to download free offline music for iPhone?	0
