index	sentence1	sentence2	label
1019	Security preparations kept protestors at bay at the recent G8 Summit on Sea Island (USA).	Demonstrations against G8 Summit took place at Sea Island bay.	not_entailment
2021	Sirhan Sirhan, a Jordanian immigrant, was convicted of murdering Kennedy and is serving a life term at Soledad Prison.	Sirhan Sirhan killed Kennedy.	entailment
852	The disappearance of York University chef Claudia Lawrence is now being treated as suspected murder, North Yorkshire Police said. However detectives said they had not found any proof that the 35-year-old, who went missing on 18 March, was dead. Her father Peter Lawrence made a direct appeal to his daughter to contact him five weeks after she disappeared. His plea came at a news conference held shortly after a £10,000 reward was offered to help find Miss Lawrence. Crimestoppers said the sum they were offering was "significantly higher" than usual because of public interest in the case.	Claudia Lawrence is 35 years old.	entailment
1783	The Commission's Deputy Chairman, Charles Duelfer, said, "We will keep the inspectors there in the hope that Iraq may back down from its decision."	The Vice-Chairman of the Committee Charles Duelfer said, "we hope to end Iraq's resolution."	not_entailment
2214	The son of Italy's last king returned to his homeland Monday, ending more than a half-century of exile. Victor Emmanuel and his family landed at a military airport in Rome in a private plane and headed immediately for an audience with Pope John Paul II.	Italian royal family returns home.	entailment
1904	A number of marine plants are harvested commercially in Nova Scotia.	Marine vegetation is harvested.	entailment
2182	US Secretary of State Hillary Clinton has urged all 70 nations attending a conference on Afghanistan's future to help the country succeed. She told delegates at the one-day event in The Hague that the international effort there had been "undermanned and underfunded" over recent years. Among the countries to offer help has been US foe Iran. The conference comes after the US announced a major policy rethink on its approach towards Afghanistan. The meeting, called by the UN, comes amid widespread concern that not enough progress has been made since the US-led invasion in 2001. Support for Afghan reconstruction is being sought beyond the mainly-Western countries which have troops there.	Hillary Clinton is the US Secretary of State.	entailment
1640	The Sudanese government reiterated on Saturday that it would not retreat from its decision to expel more than a dozen of international nongovernmental organizations (NGOs) operating relief work in its western region of Darfur. Sudanese Vice President Ali Osman Mohammed Taha made the remarks at the opening session of the conference of Arab civil society institutions. "The government's decision to expel some of the organizations is a sovereign decision which was dictated by the national interest. We will not back down from this decision whatever the pressures," Taha said.	Mohammed Taha works for an NGO.	not_entailment
741	In an interview this week, the president said that Vice President Dick Cheney and Defense Secretary Donald Rumsfeld will be a valued part of his administration until his presidency comes to an end.	Dick Cheney is Vice President of the Defense Secretary Donald Rumsfeld.	not_entailment
2073	A.C. Milan is in second place with 13 points, after two first-half goals from captain Paolo Maldini earned them a 2-1 victory over Reggina.	Paolo Maldini plays for Reggina.	not_entailment
2024	IT must rate as the literary snub of the 20th century. T S Eliot, one of Britain's greatest poets, rejected George Orwell's Animal Farm for publication on the grounds of its unconvincing Trotskyite politics. Eliot, a former director of Faber and Faber, the publisher, wrote his rejection in a highly critical letter in 1944, one of many private papers made available for the first time by his widow Valerie for a BBC documentary. When Orwell submitted his novel, an allegory on Stalin's dictatorship, Eliot praised its "good writing" and "fundamental integrity".	T.S. Eliot wrote "Animal Farm".	not_entailment
78	The Norwegian Nobel Committee is responsible for the selection of the candidates and the choice of Prize Winners for the Peace Prize. The Committee is composed of five members appointed by the Storting (Norwegian parliament). The Peace Prize is awarded in Oslo, Norway and not in Stockholm, Sweden like the other Nobel Prizes.	Nobel Peace Prize candidates have been chosen.	not_entailment
175	"I will not seek your votes for a new mandate." With these words, the President of France, Jacques Chirac (74) announced during a radio and television broadcast at 20:00 UTC that it's time for him to serve his country in a different way. The announcement was widely speculated about and did not come as a surprise. The official announcement gives the candidate from the majority party UMP, Nicolas Sarkozy, more freedom during the next six weeks that remain before the Presidential elections in France. Although Sarkozy is from the same party as Chirac and hopes to receive an endorsement from him, the President has not yet expressed his support for a particular candidate to succeed him, and he did not refer to Sarkozy during any moment of his speech.	Chirac doesn't want to be re-elected.	entailment
1868	CVS will stop selling its own brand of 500-milligram acetaminophen caplets and pull bottles from store shelves nation wide, spokesman Mike DeAngelis said.	CVS will not sell its own brand of 500-milligram acetaminophen caplets any longer.	entailment
2072	California Gov. Arnold Schwarzenegger (R) on Friday signed five bills into law that allow California to receive more than $17.5 billion in federal economic stimulus aid, but the funding will not be enough for the state to avoid $3 billion in tax increases and cuts to services to balance its budget, the San Francisco Chronicle reports. The legislation changes eligibility reporting requirements for children enrolled in Medi-Cal and allows more people to qualify for unemployment insurance and extends the benefit by 20 weeks. Medi-Cal is the state's Medicaid program.	Arnold Schwarzenegger is Austrian.	not_entailment
2065	The news comes as the owners of Kilroot announced plans to install clean-up equipment at the plant near Carrickfergus at a cost of Â£35 million.	Owners announced plans to sell clean-up equipment.	not_entailment
947	State Police issued bulletins via teletype requesting patrols to be on the lookout for Robert Senacal, 35, of Cortlandt Manor.	Senacal resides in Cortland Manor.	entailment
829	G & H Restaurant Specialties has not released a statement regarding the violations, but the corporate offices in Louisville, Kentucky for KFC said, "our franchisee has finalized a plan for some structural repairs... The units will be temporarily closed while these building maintenance issues are addressed. [They will be] re-opened as soon as the repairs are complete." The health department also gave violations out to the East Delevan store for failing to maintain a clean floor throughout the restaurant and for not stopping food from becoming contaminated. Several rat traps were also found inside the storage cooler and around the kitchen area, but the establishment was "not free of rodents," said Commissioner of the Erie County Health Department, Dr. Anthony Billittier.	Louisville is in Kentucky.	entailment
1876	The commission's order on the proposed hydroelectric development shall describe the Energy Facility Siting Council's recommendations on the need for the power.	A hydroelectric project is proposed or is under construction.	entailment
1673	Mufti Latifullah Hakimi, the spokesman for the Taliban rebels, claimed responsibility for the blast, but said that the insurgents had planted the bomb to target the Afghan police.	The Taliban is the rebels' employer.	not_entailment
2096	Evans Paul, the pro-Aristide mayor of Port-au-Prince, said he had been told that the money will go to American lobbyists, politicians and journalists to campaign against the return of Aristide, Haiti's first democratically elected president	Aristide is the mayor of Port-au-Prince.	not_entailment
301	The U.S. Senate has scheduled debate and a vote in June on a bill that would allegedly initiate a process for Native Hawaiians to achieve the same level of self-governance and autonomy over their own affairs that many Native American tribes currently have. Critics of the bill characterize it as going much further than any existing tribal recognition, creating a governing entity based solely on race, without the same requirements as needed for Native American tribal recognition, such as having existed predominantly as a distinct community, having exercised political influence over its members as an autonomous entity, and have continuously been identified as a tribal entity since 1900.	The Shoshones fight for their rights against the U.S. government.	not_entailment
2291	Mayor Michael Bloomberg seemed ambivalent to the change, saying "I would like to see it stay the Freedom Tower, but it's their building, and they don't need me dumping on it. If they could rent the whole thing by changing the name, I guess they're going to do that, and they probably, from a responsible point of view, should. From a patriotic point of view, is it going to make any difference?".	The Freedom Tower belongs to Michael Bloomberg.	not_entailment
392	The drug, along with aspirin and ibuprofen, is one of the most widely used pain relievers available without a doctor's note.	Aspirin is one of the most widely used pain relievers available without a doctor's note.	entailment
376	The directive for the Border Patrol to stop arresting illegal aliens, as described in a previous post, has been rescinded by Robert C. Bonner, commissioner of the new Bureau of Customs and Border Protection.	Steps are being taken to stop the smuggling of aliens.	not_entailment
1171	The Federal Bureau of Investigation started an independent probe of the circumstances shortly after the White House made plain that President Bill Clinton considered industrial espionage a particular threat to US economic interests.	President Clinton thinks that industrial espionage is a threat to America's well being.	entailment
1967	Bosch was found innocent in Venezuela of the bombing charges for a third time Aug. 7.	Bosch lives in Venezuela.	not_entailment
1207	Sultan Al-Shawi, a.k.a the Attorney, said during a funeral held for the victims, "They were all children of Iraq killed during the savage bombing."	The Attorney, said at the funeral, "They were all Iraqis killed during the brutal shelling."	entailment
821	According to Professor Matthias Egger, from the University of Berne, and Swiss colleagues from Zurich University and a UK team at the University of Bristol, homeopathy has no such evidence.	Matthias Egger, MD, director of the department of social and preventive medicine (ISPM) at the University of Berne, Switzerland, led the study.	not_entailment
1768	The Hubble is a scientific workhorse in the prime of its life. It is also the privileged photographer of the universe. Whether the images are of solar systems at birth, galaxies colliding, or the death throes of a star in supernova, Hubble's photos reveal both the ferocity and tranquillity of our universe.	Hubble is a Space telescope.	not_entailment
379	Termini purchased and developed several buildings and areas including the Ellicott Lofts on Ellicott Street in Buffalo, which opened in 2003, The Oak School Lofts which used to be a Buffalo Alternative School, and 'IS' Lofts on Oak Street in Buffalo. Eva Hassett, Vice President of Savarino Construction, and Karl Frizlen an architect from The Frizlen Group and designer of the hotel commented on the development proposal. Hassett said, "We've been thinking about it and trying to put it together for the last few months, and it was made public a couple of weeks ago."	Termini is the owner of Ellicott Lofts.	entailment
468	Movil Access, a Grupo Salinas company, announced today that Gustavo Guzman will appoint Jose Luis Riera as company CFO of Grupo Iusacell.	Movil Access appoints Gustavo Guzman as CFO.	not_entailment
436	The D-Day was the largest seaborne invasion force ever assembled headed for France on June 6th 1944.	The Normandy landings took place in June 1944.	not_entailment
2354	The brother-in-law of Mohammad Oreibi al-Khalifa, the new chief judge in the genocide trial of Saddam Hussein, has been shot dead, police sources say.	Mohammad Khalifa's father-in-law is Osama Bin Laden.	not_entailment
1437	In 1869 Sumner resigned his see, but continued to live at the official residence at Farnham until his death on the 15th of August 1874.	Sumner died at Farnham.	entailment
1377	The Egyptian Health Ministry reported on Sunday that a six-year-old Egyptian boy contracted bird flu, the sixth such incident in a month. The child was hospitalised on March 28, reported to be in critical condition after treatment, and is breathing with an artificial respirator. The state news agency MENA revealed that the boy's name was Ali Mahmoud Ali Somaa, and that he was from Qalyubia, a province located along the Nile Delta, located about forty kilometres north of Egypt's capital of Cairo. The death toll of the cases of the bird flu virus in humans in Egypt is 23, with the first incident reported in March 2006.	Ali Mahmoud Ali Somaa is a resident of Egypt.	entailment
682	The privately owned spacecraft only got about 400 feet into space, according to radar measurements, but it was enough to confirm that it no longer takes a well-heeled government project to organize space travel.	private spaceship launches	entailment
518	Meanwhile, in an exclusive interview with a TIME journalist, the first one-on-one session given to a Western print publication since his election as president of Iran earlier this year, Ahmadinejad attacked the "threat" to bring the issue of Iran's nuclear activity to the UN Security Council by the US, France, Britain and Germany.	Ahmadinejab threatens Iran nuclear activity.	not_entailment
172	A former employee of the company, David Vance of South Portland, said Hooper spent a lot of time on the road, often meeting with customers between Portland and Kittery.	David Vance lives in South Portland.	entailment
1164	NUCOR, the leading US steel mini-mill group is to greatly expand production capacity at a plant in Crawfordsville, Indiana which has shaken up the industry by its use of a radical, new technology.	The new thin-casting process shook up the steel industry.	not_entailment
1761	Argentina remains one of 17 countries still banning British cattle for breeding because of the outbreak of mad cow disease in 1980s.	Refusal of Argentina to buy cattle created new tensions between the two countries.	not_entailment
1235	Feith, 63, started his career at age 25 at the ministry of Foreign Affairs. He worked at the Dutch embassies of Syria, Germany and Sudan, at the United Nations headquarters in New York and at NATO in Brussels. In 2004 he represented E.U. in Darfur and prepared an E.U.-mission in Iraq that trained police-officials and judges. A year later Feith was in charge of the E.U. operation in Aceh and supervised the peace negotiations between the Indonesian government and the rebels.	Feith works in Brussels.	not_entailment
590	Congress leader Sonia Gandhi and BJP prime ministerial candidate LK Advani are among candidates whose seats are holding voting in the third phase. Results are due on 16 May and no party is expected to win a clear majority.  Voters in the states of Bihar, Gujarat, Jammu and Kashmir, Karnataka, Madhya Pradesh, Maharashtra, Sikkim, Uttar Pradesh and West Bengal are casting ballots on Thursday. Voting is also being held in the federally-administered territories of Dadra and Nagar Haveli, and Daman and Diu.	Sonia Gandhi is winning in the Uttar Pradesh state.	not_entailment
317	Fears were growing last night for the safety of a 'distressed' mother who has disappeared with her disabled nine-year-old daughter. Florist Jude Richmond, whose customers include the Royal Family, was last seen carrying cerebral palsy sufferer Millie Whitehead-Richmond as they left home on Sunday night. Mrs Richmond, 41, was said to have been devastated after splitting from her husband and business partner, Nicholas Richmond, earlier this year.  Police believe she became increasingly depressed after the split. She is said to be in a 'very vulnerable state of mind' at the time of her disappearance.	Jude Richmond works with the police.	not_entailment
756	Anglo/Dutch Royal Dutch Shell, Total, of France, and Spain's Repsol were all named as examples of established oil companies involved in the oil-for-food programme before surcharges began in 2001.	Total participated in the oil-for-food programme.	entailment
640	A young gunman known as Scarface has been jailed for life for the murder of a promising teenage footballer. Richard Harrison-Allen, 20, shot Etem Celebi dead in November 2007 as he tried to flee the scene in the Smalley Close estate, Stoke Newington, north London. Gang member Harrison-Allen, from Hackney, east London, who was convicted of the teenager's murder earlier this month, was sentenced to a minimum of 26 years at St Albans Crown Court. He sat motionless as sentence was passed.	"Scarface" is the nickname of Richard Harrison-Allen.	entailment
431	Police in Rio de Janeiro arrested five men and recovered millions of dollars worth of art stolen earlier this month, including works by Salvador Dali and Henri Matisse. Police recovered all the stolen art except two Chinese ceramic sculptures from the 7th Century and a collection of silverware.	Millions of dollars of art were recovered, including works by Dali.	entailment
69	The Tempe Hometown Premiere will have all the trappings of a mega-Hollywood  event including red carpet arrivals, klieg lights, screaming fans, paparazzi and  media coverage of the film`s stars headed by Wolverine himself, Hugh Jackman and  including Liev Schreiber, Ryan Reynolds, Taylor Kitsch, Lynn Collins, will.i.am  and director Gavin Hood.  Following a hard-fought contest stretching over thousands of cities and towns  across the United States, Tempe emerged triumphant in a far-reaching, citywide  bid to nab the gala event. Mayor Hugh Hallman himself rallied the community,  which stepped up with dozens of videos that were posted on YouTube.	Hugh Jackman plays the role of Wolverine in the movie.	entailment
2343	By 1979, the literacy rate in Cuba was higher than 90%, comparable to the rates in the United States and other developed countries.	The literacy rate in Cuba is 90%.	not_entailment
1317	Alan Mulally, Boeing's head of the unit, said at the start of the strike that it may cause delivery delays that would give Airbus SAS an advantage in what is the strongest commercial aircraft market in five years.	Boeing is a subsidiary of Airbus SAS.	not_entailment
966	In announcing plans today to prepare the nation for combating a future worldwide wave of bird flu, President Bush used vocabulary and tactics that are familiar from his confrontation with global terrorism.	Bush supports global terrorism.	not_entailment
1249	The sale was made to pay Yukos' US$ 27.5 billion tax bill, Yuganskneftegaz was originally sold for US$ 9.4 billion to a little known company Baikalfinansgroup which was later bought by the Russian state-owned oil company Rosneft .	Baikalfinansgroup was sold to Rosneft.	entailment
433	The British government has indicated its readiness to allow Argentine companies to take part in the development of oilfields in the Falkland islands' territorial waters- provided they acknowledge that any oil extracted belongs to Britain.	The British indicated readiness to allow Argentine companies to take part in the development of oilfields.	entailment
1055	Earlier this year, 78 local, state and federal agencies took part in a chemical attack drill, called Rotunda Thunda, at the Las Vegas Convention Center and the Strip.	A chemical attack took place at the Las Vegas Convention Center and the Strip.	not_entailment
2303	Military ties between the two countries have been governed officially by an arms embargo imposed by Britain on Argentina.	Britain has maintained an arm embargo.	entailment
2122	Jennifer Hawkins is the 21-year-old beauty queen from Australia.	Jennifer Hawkins is Australia's 21-year-old  beauty queen.	entailment
497	The high-speed train, scheduled for a trial run on Tuesday, is able to reach a maximum speed of up to 430 kilometers per hour, or 119 meters per second.	The train accelerates to 430 kilometers per hour.	entailment
964	Political leaders pledged that construction of the so-called Freedom Tower -- which will rise 1,776 feet into the air and be the world's tallest building -- will be finished on schedule by the end of 2008.	The Freedom Tower will be the world's tallest building.	entailment
248	"Having for years enjoyed greater rights than other women in the Middle East, women in Iraq are now losing even their basic freedoms. The right to choose their clothes, the right to love or marry whom they want. Of course women suffered under Saddam. I fled his cruel regime. I personally witnessed much brutality, but the subjugation of women was never a goal of the Baath party."	Women in Iraq have lost their freedom.	entailment
1651	After the service, Lennon left the cathedral, made his way through a crush of reporters and television cameras and talked briefly with protesters, some of whom say they are victims of abusive priests.	After the service, Lennon attempted to speak to victims and protesters.	entailment
1423	Take consumer products giant Procter and Gamble. Even with a $1.8 billion Research and Development budget, it still manages 500 active partnerships each year, many of them with small companies.	500 small companies are partners of Procter and Gamble.	not_entailment
261	The demands on Italy's 53rd postwar government are apparent, as are the resentment and uncertainties Berlusconi has roused at the head of a new party with the catchy name Forza Italia (Go, Italy).	Silvio Berlusconi is in Forza Italia.	entailment
1654	Sunshine Coast, Queensland, Australia - The Sunshine Coast Regional Council has formally ratified the rejection of the 24 hour McDonald's in Minyama. The decision comes after council rejected the proposal earlier this week at a general committee meeting. McDonald's forwarded an 11th hour compromise to deputy mayor Tim Dwyer in order to overturn the decision. The compromised had included reducing the opening hours to 6am to 10pm Sunday to Thursday and until 12am Friday and Saturday.	Sunshine Coast Regional Council accepted McDonald's Australia development plans.	not_entailment
1898	The two presidents, Bush and Chirac, were honored with a 21-gun salute.	The two presidents, Bush and Chirac, were honoured with a 21-gun salute.	entailment
2001	Definitely do not lift the ban on ivory, it will drive the species to near extinction again. Elephant numbers should be controlled but what has ivory got to do with it? It is a barbaric trade and should be banned permanently.	The ban on ivory trade has been effective in protecting the elephant from extinction.	entailment
694	RJ Reynolds Tobacco announced yesterday that it plans to build a factory in Turkey to produce cigarettes by late 1993.	RJR built factories in Turkey.	not_entailment
1817	Philip Morris the US food and tobacco group that makes Marlboro, the world's best-selling cigarette, shrugged off strong anti-smoking sentiment in the US.	Philip Morris owns the Marlboro brand.	entailment
1255	The Golden Flyers set a school record this year with 16 victories.	The Golden Flyers set a school record with 16 victories.	entailment
2004	Mohamed al-Sumaidaie, Iraq's ambassador to the United Nations, accused U.S. marines of murdering his cousin's 21-year-old son, Mohammed Sumaidaie, who was studying engineering at the University of Technology in Baghdad. "All indications point to a killing of an unarmed innocent civilian - a cold-blooded murder," said Sumaidaie. "The Marines were smiling at each other as they were leaving.".	Mohamed al-Sumaidaie is related by blood to the United Nations.	not_entailment
550	In any case, the fact that this week Michael Melvill, a 63-year-old civilian pilot, guided a tiny rocket-ship more than 100 kilometres above the Earth and then glided it safely back to Earth, is a cause for celebration.	Michael Melvill guided more than 100 rocket-ships above the Earth.	not_entailment
236	Gabriel Garcia Marquez was a liberal thinker whose left-wing politics angered many conservative politicians and heads of state. His job as a reporter for the Cuban news agency Prensa Latina, in 1960, and and friendship with Fidel Castro resulted in his being ultimately denied entry to the United States for political reasons.	Gabriel Garcia Marquez was a conservative politician.	not_entailment
487	Democrat Culbert L. Olson, elected governor of California in 1938, was a loyal supporter of Roosevelt's New Deal.	Democrat Culbert L. Olson was elected governor of California.	entailment
991	The ceasefire declaration by the Liberation Tigers of Tamil Eelam (LTTE) and its immediate rejection by the government have emphasised the starkness of the situation in which the guerrilla group finds itself, 37 years after first taking up arms for the cause of a Tamil homeland and 26 years after the start of all-out war. Masters of communication, the Tigers were quick to disseminate their message to journalists all over Colombo and overseas, too. But to many it seemed like a cry of desperation from the losing side.	The Liberation Tigers of Tamil Eelam is a guerrilla group.	entailment
