index	sentence1	sentence2	label
1885	"This is a major milestone on our road to recovery, and I want to thank the members of Congress who came together in common purpose to make it happen," Obama said in his weekly address. "I will sign this legislation into law shortly, and we'll begin making the immediate investments necessary to put people back to work doing the work America needs done. This historic step won't be the end of what we do to turn our economy around, but the beginning."	The Congress wants to boost the economy.	entailment
1313	Muslim fundamentalists such as the Islamic Resistance Movement, also known as Hamas, and the smaller Islamic Jihad are determined to torpedo the peace process.	The Islamic Resistance Movement is also known as Hamas.	entailment
1205	Israeli scientists predict the world's coral reefs could begin to collapse in as little as 30 years from now. Studies show the oceans are becoming increasingly acidic as they soak up manmade emissions of carbon dioxide. The Hebrew University of Jerusalem researchers say this will make it difficult for many coral organisms to produce skeletal and other hard parts. The team's work on corals in the Red Sea suggests a tipping point will be reached in between 30 and 70 years.  Then the forces of erosion eating away at corals will outstrip the organisms' ability to make the reefs.	The acidification of oceans affects tourism.	not_entailment
2434	In February of 1995, one man single-handedly bankrupted the bank that financed the Napoleonic Wars. Founded in 1762, Barings Bank was Britain's oldest merchant bank and Queen Elizabeth's personal bank.	Barings was Britain's oldest merchant bank.	entailment
2299	Canadian MP Belinda Stronach, 40, has reportedly cheated with Canadian hockey star Tie Domi. Domi and his wife were in court today getting divorced and both have now reached a temporary settlement in their divorce proceedings, less than an hour before the case was to be heard before Toronto's Superior Court. Stronach is refusing to comment on the divorce or say if she "wrecked" Domi's marriage. "If it wasn't for my husband's affair with Belinda, we wouldn't be getting a divorce," Leanne told the Toronto Star in an interview last night. Domi's wife claimed that the former Toronto Maple Leaf player told her if she did not hire a lawyer he would give her $1 million in cash and a $1.5-million house if she kept quiet about his affair with Stronach. If she contacted a lawyer, however, she "would get nothing."	Leanne was married to Tie Domi.	entailment
762	Vodafone's share of net new subscribers in Japan has dwindled in recent months.	There have been many new subscribers to Vodafone in Japan in the past few months.	not_entailment
531	Mitsubishi Motors Corp.'s new vehicle sales in the US fell 46 percent in June	Mitsubishi sales rose 46 percent	not_entailment
2331	France is the only country with two fully governmental elections. Parliamentary elections in France, when they create a new parliamentary majority, lead to a new government.	Parliamentary elections may lead to a new government in France.	entailment
2307	Despite Chinese assertions of control, tensions over the South China Sea's waters have continued to rise.	There is a territorial waters dispute.	entailment
493	Just one week before the elections, Antwerp was the scene of the 0110 concerts, organised against racism, extremism and gratuitous violence. The event was spurred by a series of acts of "pointless violence" during the last year (the murder of Joe Van Holsbeeck, the case Hans Van Themsche and the events surrounding Guido Demoor. However, Vlaams Belang asked many musicians to boycott the event, because it "only targets Vlaams Belang". The party considered the concerts as a direct attack by the political establishment. Since 1989, the other parties have instituted a cordon sanitaire against Vlaams Belang, forcing them into the opposition, notwithstanding their increasing electorial success.	Guido Demoor was assassinated by Joe Van Holsbeeck.	not_entailment
2066	The increased amounts of carbon dioxide (CO2) and other greenhouse gases (GHGs) are the primary causes of the human-induced component of global warming.	Greenhouse effect changes global climate.	entailment
722	In a game ripe with controversy, Manchester United walked away with a crucial away win after a Ryan Giggs free kick gave them the lead. Lille protested the goal, saying the team was setting up its wall at the time Giggs took the kick, and the team nearly left the pitch. After goading by officials, the game was resumed, but Lille said it would be making a stake for a replay with UEFA. UEFA has rejected the claim and declared the goal valid, as well as deciding to "instigate proceedings against Lille for the improper behaviour of their players immediately after the goal."	Lille has defeated Manchester United.	not_entailment
1311	The 26-member International Energy Agency said, Friday, that member countries would release oil to help relieve the U.S. fuel crisis caused by Hurricane Katrina.	The United States has asked member states of the International Energy Agency to provide oil.	not_entailment
330	The petrol price reductions seen across most of Australia have been short-lived for those living in the regional New South Wales city of Bathurst. An investigation by Wikinews has discovered retailers in Bathurst were late to lower petrol pricing and have been amongst the first to increase them. Following a threat by the Australian Competition and Consumer Commission (ACCC) to publically shame fuel retailers and oil companies, most fuel outlets across Australia reduced prices by 5 to 10 cents per litre. The ACCC argued that the wholesale cost of petrol was around 10 cents per litre higher than the Singapore market, which Australia benchmarks itself against. On January 24, the price of Unleaded fuel in Bathurst dropped only 2 cents from 119.9 cents to 117.9 cents. Today, Coles Express on Durham Street has increased the price of their unleaded fuel to the previous level of 119.9 cents.	New South Wales is found in Australia.	entailment
2257	Women are poorly represented in transactions financed by mortgage bonds.	Women are poorly represented in parliament.	not_entailment
2175	By buying local companies, Philip Morris and its subsidiary inherit informal trade contacts cultivated under Soviet rule that may help to smooth any future moves east.	American tobacco companies used state tobacco monopoly liberalization.	not_entailment
434	"A force majeure is an act of God," said attorney Phil Wittmann, who represents the New Orleans Saints and owner Tom Benson's local interests.	Phil Wittmann works for Tom Benson.	entailment
1434	Oil prices, notoriously vulnerable to political events, spiked as high as $40 a barrel during the Gulf War in 1991.	The Gulf War was fought in 1991.	entailment
1225	Eleven years after 852 people, mostly Swedes, perished when the ferry Estonia sank on a stormy Baltic night, an exhibition in the National Maritime Museum in Stockholm brings back the pain and controversy which have haunted Sweden since the disaster.	100 or more people lost their lives in a ferry sinking.	entailment
1443	The policy focused on coca eradication from the territories of Peru and Bolivia. During the years of 1996 and 2000, much of the resources of "Andean Initiative" where utilized in intense aerial fumigation in coca producing areas.	Peru debates border region with Ecuador.	not_entailment
162	There are four identified subtypes of Ebola virus. Three of the four have caused disease in humans: Ebola-Zaire, Ebola-Sudan, and Ebola-Ivory Coast. The fourth, Ebola-Reston, has caused disease in non-human primates, but not in humans.	The Ebola epidemic breaks out in Zaire.	not_entailment
736	Michael Jordan, coach Phil Jackson and the star cast, including Scottie Pippen, took the Chicago Bulls to six National Basketball Association championships.	The Bulls basketball team is based in Chicago.	entailment
1458	The scientific community now generally agrees that between 5 and 8 million years ago, there lived in Africa a hominid which would ultimately give rise to the first hominids and later the members of the genus Homo.	Humans existed 10,000 years ago.	not_entailment
630	Carmen was only slightly put out to find that women are as poorly represented among Australian political scientists as they are in parliament (Leonie was asking, 'where are all the women?').	Women are poorly represented in parliament.	entailment
111	As late as 1799, priests were still being imprisoned or deported to penal colonies and persecution only worsened after the French army led by General Louis Alexandre Berthier captured Rome and imprisoned Pope Pius VI, who would die in captivity in Valence, Drôme, France in August of 1799.	Alexandre Berthier died in 1799.	not_entailment
1989	"No, we don't get any business from beach traffic," said Butler, whose Men's Shop is located in a small strip mall behind Krispy Kreme on Palmetto.	Men's Shop is owned by Butler.	entailment
422	Prosecutors were still expected to unseal an 11-count manslaughter indictment against the ferry's captain, Michael Gansas.	Gansas' attorneys have said that rule was not communicated to ferry staff.	not_entailment
517	Qin Shi Huang, personal name Zheng, was king of the Chinese State of Qin from 247 BCE to 221 BCE, and then the first emperor of a unified China from 221 BCE to 210 BCE, ruling under the name First Emperor.	Qin Shi Huang was the first China Emperor.	entailment
698	The Dow Jones Industrial Average (DJIA), one of the main stock indices in the United States, has broken an all-time closing record, to close at 14,000.41 points which is up 82.19 points (0.59%) from its last close. Just 59 days before, the Dow hit an all-time high when it passed 13,000. This is the first time the DJIA has ever closed above 14,000 since its debut on May 26, 1896.	The Dow Jones has gained points.	entailment
2266	Fourteen guests and five crew remained ill and in isolation when the ship arrived at Port Everglades, Fla., according to a statement from Carnival Cruise Lines, a brand of Carnival Corp.	The Carnival Cruise Lines is a brand of Carnival Corp.	entailment
275	Humic acids are complex organic molecules formed by the breakdown of organic matter in the soil. They are not considered to be fertilizers, but soil enhancers and improvers.	Organic fertilizers are used as soil enhancers.	not_entailment
511	John Lennon's widow, Yoko Ono, has topped the US dance chart at the age of 71 with a song supporting gay marriage.	Yoko Ono is John Lennon's widow.	entailment
2350	The Arak plant, along with the discovery of a secret Iranian enrichment program in 2003, Tehran's refusal to cease uranium enrichment and findings by IAEA inspectors have increased suspicions about Iran s program.	Iran's program is under suspicion because of the findings by IAEA inspectors.	entailment
753	The American Defense Department reported today, that the bombing runs against Iraq are being especially carried out via cruise missiles launched from American aircraft carriers and B52 bombers.	The Pentagon reported today, that the bombing runs against Iraq are being especially carried out via cruise missiles launched from American aircrafts.	entailment
2194	Anna Politkovskaya was found shot dead on Saturday in a lift at her block of flats in the Russian capital, Moscow.	Anna Politkovskaya was murdered.	entailment
652	A male rabbit is called a buck and a female rabbit is called a doe, just like deer.	A female rabbit is called a doe.	entailment
2293	Clint Brown, sports presenter for 3 News on TV3 in New Zealand has resigned amid the allegations that he had verbally attacked a taxi driver which resulted in him being admitted to hospital with a concussion and a broken eye socket. TV3 has confirmed that they have accepted the resignation of Brown. Rick Friesen, Chief Operating Officer of the TV Works division of CanWest MediaWorks NZ, that runs TV3, said: "We wish to acknowledge Clint's significant skills as a sports broadcaster, and thank him for his 17 years of very loyal service to TV3. Clint Brown is a passionate New Zealand sports fan, and he has been at the forefront of some of New Zealand's biggest sporting moments."	Rick Friesen is employed at CanWest MediaWorks NZ.	entailment
1014	The most recent figures from UNAids show a continent divided in two. In north Africa, up to 0.5% of the population has been infected with HIV. In sub-Saharan Africa, that figure is 8.8% but rising to almost 40% in some countries. In four countries - Botswana, Lesotho, Swaziland and Zimbabwe - at least one in three of the population is HIV positive.	AIDS spreads in Africa.	entailment
314	On Tuesday morning police in Bangladesh have blamed Islamic militants for what's believed to be the country's first suicide bombings. Up to ten people were killed and dozens of others injured in the two attacks. The attacks left at least 50 people wounded with many of them said to be in critical condition. The government has accused the hardline Jamayetul Mujahideen, which wants to introduce strict Islamic law in the Muslim-majority democracy, of staging the attacks targeting the legal system. Bangladesh police have arrested six men, including a suicide squad member in different parts of the country, in the last two days.	Two people were killed in Bangladesh.	not_entailment
68	Israeli Prime Minister Ariel Sharon has said that Mahmoud Abbas is a man that Israel can do business with.	Palestinian leader, Mahmoud Abbas, may be someone Israel can talk with.	entailment
1986	The slender tower is the second tallest building in Japan.	The slender tower is the tallest building in Japan.	not_entailment
604	Tourists pay millions of dollars a year to come and see Africa 's wildlife and smugglers pay millions more in strictly illegal purchases of ivory and rhino horn from poachers.	African countries encourage keeping animals alive to attract tourists.	not_entailment
1219	BAGHDAD, Iraq (CNN) - Australian Prime Minister, John Howard, has made an unannounced visit to Iraq, according to the office of Iraqi transitional Prime Minister Ibrahim al-Jaafari.	Howard is a political representative of Australia.	entailment
1814	Security forces gunned down six Maoists; while the rebels killed a policeman and an abducted civilian drowned escaping from the Maoists, say latest insurgency related reports.	A civilian policeman was killed.	not_entailment
2089	"There is 'no indication of any security related event' that brought the plane down," said FBI spokesman Richard Kolko. Conditions of freezing drizzle, known as hard rime, were the most likely cause of the tragedy. The National Transportation Safety Board (NTSB) has announced that they would send a team to the crash site on Friday to begin the investigation. Lorenda Ward will serve as chief investigator with the assistance of NTSB Commissioner Steven Chealander and public affairs officer Keith Holloway. Ward has investigated several other plane crashes ―including the 2006 New York City plane crash that claimed the life of New York Yankees pitcher Corey Lidle.	Corey Lidle was a resident of New York City.	not_entailment
430	A mercenary group, faithful to the warmongering policy of former Somozist colonel Enrique Bermudez, attacked an IFA truck belonging to the interior ministry at 0900 on 26 March in El Jicote, wounded and killed an interior ministry worker and wounded five others.	A mercenary group was injured in El Jicote.	not_entailment
1284	To further assist Mexico, the White House on April 15 named a former U.S. Justice Department official to lead efforts to crack down on drug-related violence along the U.S. side of its southwest border with Mexico.  Homeland Security Secretary Janet Napolitano announced the appointment of Alan Bersin, a former federal prosecutor, during a visit to El Paso, Texas.  Bersin held the same post - dubbed "border czar" - during the Clinton administration. And three Mexican drug gangs — the Sinaloa cartel, Los Zetas and La Familia Michoacana - have been placed on a list of significant foreign narcotics traffickers targeted for special sanctions, the White House said April 15.  This action allows the United States to freeze all cartel assets in U.S. jurisdiction and bars Americans from dealing with organizations that may be linked or associated with these groups and their operatives.	La Familia Michoacana are drug traffickers.	entailment
1997	WASHINGTON - The world's governments raced to avoid both a pandemic and global hysteria Sunday as more possible swine flu cases surfaced from Canada to New Zealand and the United States declared a public health emergency. "It's not a time to panic," the White House said. Mexico, the outbreak's epicenter with up to 103 suspected deaths, canceled some church services and closed markets and restaurants. Few people ventured onto the streets, and some wore face masks. Canada became the third country to confirm cases, in six people, including some students who — like some New York City spring-breakers — got mildly ill in Mexico. Countries across Asia promised to quarantine feverish travelers returning from flu-affected areas.	As many as 103 people in Mexico have died of swine flu.	entailment
2358	In one case five workers at a plating company were asphyxiated by hydrogen cyanide while trying to clean a sludge tank.	Cyanide fumes killed five workers cleaning one tank.	entailment
127	Swiss police confirmed Thursday that cult leader Luc Jouret was among the dead found in the Order of the Solar Temple's fire-gutted chalet in the alpine village of Granges-sur-Salvan.	Luc Jouret was the leader of the Order of the Solar Temple.	not_entailment
2059	The results of numerous epidemiological studies and recent clinical trials provide consistent evidence that diets rich in fruits and vegetables can reduce the risk of chronic disease.	Fruits and vegetables prevent osteoporosis.	not_entailment
2244	A recently created Danish clothing company is selling on the internet T-shirts in order to support the clandestine radio station of the Colombian guerrilla group Revolutionary Armed Forces of Colombia (FARC) and the graphical workshop of the Popular Front for the Liberation of Palestine (PFLP). In fact the money will be used by these groups to carry on their terrorist activities. FARC activities include kidnappings, masacres, bombs, extortions and the drug trade. Fighters and Lovers is selling the T-shirts at 170 DKK (US$27.6), from which 35 DKK (US$5.7) are to be destinated to support both armed groups.	Revolutionary Armed Forces of Colombia teamed up with Fighters and Lovers.	entailment
57	Workers at the Lufthansa Technik Automotive plant in Co Dublin are due to vote today on changes to work practices being sought by the company's management. The aircraft engine maintenace firm has warned that rejection of the proposals would threaten a planned €17230m investment in the Rathcoole plant and put jobs at risk. LTA says it is not seeking any lay-offs or pay cuts and the planned investment would guarantee the future of the plant for the next 15 years. The work-practice changes are being sought following the collapse of Labour Relations Commission talks on the matter.	Lufthansa Technik Automotive fires 30 workers.	not_entailment
1334	Italy's highest court has upheld a court verdict that partially cleared former Prime Minister Giulio Andreotti of having colluded with the Mafia.	Andreotti is accused of Mafia collusion.	entailment
2375	The Israeli army forces carried out, on Saturday, a widespread military operation into the West Bank town of Jenin and its refugee camp, local Palestinian sources said.	The Israeli army carried out a widespread operation in Jenin.	entailment
2110	Next year is the 50th anniversary of the Normandy invasion, an event that wouldn't have been possible without the Liberty ships. The volunteers hope to raise enough money to sail the O'Brien to France for the big D-Day celebration.	50th Anniversary of Normandy Landings lasts a year.	not_entailment
137	The SEC's new rule to beef up the independence of mutual fund boards represents an industry defeat.	Industries were defeated by the SEC.	not_entailment
58	It rewrites the rules of global trade, established by the General Agreement on Tariffs and Trade, or GATT, in 1947, and modified in multiple rounds of negotiations since then.	GATT was formed in 1947.	not_entailment
691	The Yankees split Hollywood with something to feel OK about after last night's 5-4 loss to the Dodgers.	Dodgers lose first game ever at Fenway	not_entailment
216	Experts say that Mr. Abbas will need that big win to show that he has the support of most Palestinian people in order to push through his aims of peace talks with Israel.	Analysts had said that Mr. Abbas needed a large margin of victory in order to push his agenda of peace talks with Israel.	entailment
1991	Rabies is a viral disease of mammals and is transmitted primarily through bites. Annually, 7,000 to 8,000 rabid animals are detected in the United States, with more than 90 percent of the cases in wild animals.	Rabies is fatal in humans.	not_entailment
615	The London Eye in London, England sits 443ft over the River Thames. It has attracted more than 27 million visitors since its formal opening on December 31, 1999. Each compartment is set to be air-conditioned and hold up to 30 people. Three possible locations for the wheel to sit have been selected. This is not the first attempt by the Iraqi Tourism Board to bring tourists into the capital. The board are seeking investors for a resort island. The island would include a six star hotel and a 18 hole golf course.	The River Thames flows through London.	entailment
233	Drug development is an enormously complex and expensive process.	The Research and Development phase of creating a new drug is complicated.	entailment
637	In the 1970s, she was one of the most popular female vocalists in France, and became well-known internationally. Anne Marie David, from Arles in the south of France, parlayed her initial success from playing Mary Magdalene in the French production of Jesus Christ Superstar into taking home the "grand prix" at the Eurovision Song Contest in 1973. Her winning song, "Tu te reconnaîtras" (You will recognize yourself), became a Europe-wide hit that spring.	Anne Marie David won the Eurovision Song Contest.	entailment
863	A jet, carrying French Caribbean islanders home from a Panama vacation, crashed in rural Venezuela early Tuesday, after the pilot reported trouble with the engines.	A plane carrying vacationers home to the French Caribbean island of Martinique crashed, Tuesday, in western Venezuela after reporting engine problems, killing all 160 people on board, officials said.	not_entailment
664	"The rapidly mixed brigades of former enemies have been sent to the front lines with no salaries, rations, or any formal training, increasing the likelihood of future human rights violations," Human Rights Watch said in a statement. Among the former rebels integrated into the regular army are Bosco Ntaganda, who was recently promoted to the position of general. He is wanted on an arrest warrant by the International Criminal Court for enlisting child soldiers and is accused of commanding the rebel troops that massacred 150 villagers in the town of Kiwanja last November.	Bosco Ntaganda is a general.	entailment
2413	Approximately a dozen individuals have reported becoming sick after eating raw oysters consumed in a restaurant in Chattanooga, Tennessee. The Chattanooga-Hamilton County Health Department and Tennessee Department of Health confirmed that the patients were infected with norovirus.  Norovirus is a foodborne pathogen that can cause acute gastroenteritis in humans. The symptoms of norovirus illness begin suddenly, most often in 24 to 48 hours after ingestion of the virus, but they can appear as early as 12 hours after exposure. The gastrointestinal symptoms include nausea, vomiting, diarrhea, and some stomach cramping.	Oysters have been linked to gastrointestinal diseases caused by a virus.	entailment
147	The new study refutes earlier findings by researchers at the University of California, Los Angeles, who concluded that the odds of getting head and neck cancers rose in tandem with the frequency and duration of marijuana use.	The latest findings contradict a California study that implicated regular pot smoking as having markedly higher risks for head and neck cancers.	entailment
554	Deng Haihua, Ministry of Health spokesperson, expects the disease to reach its height between May and July. Yang Weizhong Deputy Director for the Chinese Center for Disease Control and Prevention said researchers are increasing research efforts to find a vaccine for EV71. Families are being instructed to embark on week-long disinfections with free medical supplies from local health authorities.	Deng Haihua is an employee of the Chinese Center for Disease Control and Prevention.	not_entailment
2124	Chicago-based Boeing has already scrubbed three delivery slots in 2006 that had been booked by Air Canada.	Boeing's headquarters is in Canada.	not_entailment
751	The Sea-Viewing wide Field-of-View Sensor, SeaWiFS, has brought to oceanographers a welcomed and improved renewal of the ocean color remote sensing data.	Ocean remote sensing is developed.	entailment
1407	A joint venture led by Australia's Global Petroleum Ltd. said, yesterday, it had won the right to explore for oil and gas in the inhospitable waters south and east of the Falkland Islands.	Petroleum will be explored in the South Atlantic.	entailment
