index	sentence1	sentence2	label
1800	Typhoon Xangsane lashed the Philippine capital on Thursday, grounding flights, halting vessels and closing schools and markets after triggering fatal flash floods in the centre of the country.	A typhoon batters the Philippines.	entailment
377	The stupendous power of the Tevatron made possible the 1995 discovery of the top quark - the last of six flavors of quarks predicted by the standard model theory of particle physics.	The top quark is the last of six flavors of quarks predicted by the standard model theory of particle physics.	entailment
1827	The Health Department has been made aware that property located at Bear Creek is under investigation by the NC Division of Waste Management for the illegal discharge of hazardous chemical materials.	Hazardous chemical materials have been discovered at Bear Creek.	entailment
378	A second man, aged 24, technically freed yesterday was bailed after being questioned over alleged forged identity documents, but has been further detained on immigration matters, a spokesman for Scotland Yard said.	A spokesman for Scotland Yard was freed yesterday.	not_entailment
2358	In one case five workers at a plating company were asphyxiated by hydrogen cyanide while trying to clean a sludge tank.	Cyanide fumes killed five workers cleaning one tank.	entailment
1154	The American television network "CNN" reported that officials at the American Defense Department (The Pentagon) will recommend halting the bombing on Iraq to President Bill Clinton this evening, Saturday.	CNN reported that officials at the Pentagon said that President Clinton is obligated to stop the shelling on Iraq .	not_entailment
1781	On Aug. 6, 1945, an atomic bomb was exploded on Hiroshima with an estimated equivalent explosive force of 12,500 tons of TNT, followed three days later by a second, more powerful, bomb on Nagasaki.	In 1945, an atomic bomb was dropped on Hiroshima.	entailment
631	Canadian wireless technology licensing company Wi-LAN has begun legal action against Cisco, alleging the networking giant's Linksys and Aironet products are making use of its intellectual property without permission.	Linksys and Aironet begin legal action against a Canadian company.	not_entailment
2104	Morton's book was published January 15, and hit number one on Amazon.com's Top Sellers list on January 18. Yesterday, the book hit the number one spot on The New York Times Best Sellers list. The book is not for sale in Britain or Ireland, and the New York Post has reported that British tourists to the United States are buying copies of the book to bring back home. Morton makes some controversial assertions in the book, including that Cruise is second in command at the Church of Scientology, and that Scientology was the cause of Cruise and Nicole Kidman's separation.	Tom Cruise is married to Katie Holmes.	not_entailment
1195	The President George Bush administration, on Friday, ordered the sale of 30 million barrels of crude oil from the government's emergency stockpile to halt runaway oil prices triggered by Hurricane Katrina.	European nations were considering releasing oil reserves to help the United States after Hurricane Katrina.	not_entailment
932	Jill Pilgrim, general counsel of USA Track and Field, brought up the issue during a panel on women's sports at the sports lawyers conference. Pilgrim said the law regarding who is legally considered a woman is changing as sex-change operations become more common.	Sex-change operations become more common.	entailment
764	However, witnesses said some of the black-clad gunmen who attacked a police station and government buildings in Baquba, 60 km (40 miles) northwest of Baghdad, proclaimed loyalty to Zarqawi and wore yellow headbands linking them to his group.	Some of the gunmen showed loyalty to Baquba's group.	not_entailment
1351	The American State Department announced that Russia recalled her ambassador to the United States "for consultation" due to the bombing operations on Iraq.	The American Ministry of Foreign Affairs announced that Russia called the United States about the bombings on Iraq.	not_entailment
1367	The memorandum noted the United Nations estimated that 2.5 million to 3.5 million people died of AIDS last year.	Over 2 million people died of AIDS last year.	entailment
478	India's steelmaker Tata Steel, of the Tata Group, buys Anglo-Dutch steel giant Corus Group for £6.7 billion ($12 billion), making it the world's fifth largest steel manufacturer. 70-year-old Tata group Chairman Ratan Tata, from one of India's best-known business families, won the race against Benjamin Steinbruch, 52, a famous Brazilian executive who is the chief and main owner of Companhia Siderurgica Nacional (CSN). Tata paid investors 608 pence a share, whereas the Brazilians final offer in an auction by the U.K.'s Takeover Panel was 603 pence. The deal triples Tata Steel's capacity to almost 28 million tons a year. Tata: "This is the first step in showing that Indian industry can step outside its shores into an international market place as a global player." Corus, which was created from the merger of British Steel and Hoogovens, currently employs 47,300 people worldwide. Last year the company was the ninth-largest steel maker worldwide. The takeover may start a round of consolidation in the fragmented steel sector.	Tata group was founded 70 years ago.	not_entailment
164	Israel plans to increase the share of gas in its energy balance to 25 percent by 2025 from the current 1 percent.	Currently the share of natural gas in Israel's energy system amounts to no more than one percent.	entailment
82	Alex Da Silva, a salsa dance instructor and choreographer for Fox's "So You Think You Can Dance," was arrested Saturday on suspicion of sexually assaulting four of his students, according to a statement from the Los Angeles Police Department. Da Silva, 41, is accused of assaulting the students in his two homes in the San Fernando Valley over the last six years, police said. He is being held in lieu of $3.8 million bail. Authorities said the four victims were all students of Da Silva at the time of the assaults.	Alex Da Silva is a student of salsa dance.	not_entailment
1643	These problems can be avoided by legalization, under which cannabis could be legally sold, taxed and regulated like alcohol or tobacco.	Drug legalization has benefits.	entailment
28	Initially the Bundesbank opposed the introduction of the euro but was compelled to accept it in light of the political pressure of the capitalist politicians who supported its introduction.	The introduction of the euro has been opposed.	entailment
1183	The substances that our company uses do not leave stains, do not have an unpleasant smell and are not toxic.	Our substances remove stains.	not_entailment
407	Everest Grand Circle Expedition, Nepal and Tibet. First circumambulation of Everest; trekking, skiing, and mountaineering. First American winter ascent of Pumori (elev. 23,422'). Immortalized in the book Everest Grand Circle. Ned Gillette, Jan Reynolds, Jim Bridwell, Steve McKinney, Craig Calonica and Rick Barker.	A woman succeeds in climbing Everest solo.	not_entailment
586	Animals are permitted to enter the UK 6 months later without quarantine as long as they have been treated for ticks, fleas and tapeworms between 24 and 48 hours before boarding the transport that will return the pets to the UK.	Quarantine is compulsory for animals to enter the UK.	not_entailment
1869	Larry Estrada, whose father served in the Marine Corps in Vietnam, said he has always had a great appreciation for the military and wanted to do his part to help.	Larry Estrada's father belonged to the Marine Corps.	entailment
568	The World Trade Organization, the International Monetary Fund and the World Bank have all been criticized for their role in catalyzing the harmful impacts of corporate globalization on people, the environment and sustainable development.	The World Bank is criticized for its activities.	entailment
1813	Fake prehistoric rock art of a caveman with a shopping trolley has been hung on the walls of the British Museum.	Prehistoric art discovered in South Africa.	not_entailment
1275	No stockpiles of weapons of mass destruction have been found in Iraq since Saddam's regime was toppled in a US-led invasion last year.	Weapons of mass destruction found in Iraq.	not_entailment
1070	Suncreams designed for children could offer less protection than they claim on the bottle.	Suncreams designed for children protect at the level they advertise.	not_entailment
2442	The Prime Minister of Spain Zapatero visited Brazil, Argentina, Chile and Uruguay recently, in a effort to build a left axis in South America. The cited countries' South American Presidents agreed to collaborate at international level, particularly in the United Nations , European Union and with Paris, Berlin and Madrid.	Brazil is part of the United Nations.	entailment
1353	Over 400 tents were submerged, after a storm hit the Somerset site on Friday, the festival's opening day.	Many tents were overwhelmed after a storm hit the Somerset site on the festival's first day.	entailment
1449	Loraine besides participating in Broadway's Dreamgirls, also participated in the Off-Broadway production of "Does A Tiger Have A Necktie". In 1999, Loraine went to London, United Kingdom. There she participated in the production of "RENT" where she was cast as "Mimi" the understudy.	"Does A Tiger Have A Necktie" was produced in London.	not_entailment
1437	In 1869 Sumner resigned his see, but continued to live at the official residence at Farnham until his death on the 15th of August 1874.	Sumner died at Farnham.	entailment
1327	Hoping to loosen Microsoft's ironclad grip on the personal computer desktop, a tiny Seattle company will unveil an onscreen menu bar Monday that bypasses Windows with direct links to programs and the Internet.	Microsoft Windows is an operating system.	not_entailment
792	Every year, about a quarter of all children sustain an injury serious enough to require medical attention, school absences, and/or bed rest.	Fireworks may cause serious injuries.	not_entailment
1431	Her husband, political novice Juan Carlos Lecompte, scrambles to preserve Betancourt's dream and sustain the Oxygen Green Party, the political party she founded.	Juan Carlos Lecompte is the founder of the Green Oxygen Party.	not_entailment
615	The London Eye in London, England sits 443ft over the River Thames. It has attracted more than 27 million visitors since its formal opening on December 31, 1999. Each compartment is set to be air-conditioned and hold up to 30 people. Three possible locations for the wheel to sit have been selected. This is not the first attempt by the Iraqi Tourism Board to bring tourists into the capital. The board are seeking investors for a resort island. The island would include a six star hotel and a 18 hole golf course.	The River Thames flows through London.	entailment
1259	The Chicago White Sox are a major league baseball team based in Chicago, Illinois.	The Bulls basketball team is based in Chicago, Illinois.	not_entailment
703	The Marriott is a popular place for foreigners to stay and a prominent enterprise in the city, despite a wave of violence the country suffers. The hotel had been victim of another attack in January 2007 where a security guard was killed and several people injured after the guard blocked a bomber from getting at the hotel, forcing him to detonate his explosives where he was.	There is a Marriott Hotel in London.	not_entailment
1477	World health officials warned yesterday that West Africa and Central Africa were on the verge of the worst polio outbreak in years, stemming from the refusal of a single state in northern Nigeria to vaccinate children against the disease.	African polio outbreak feared	entailment
1378	This document declares the 'irrevocable determination' of Edward VIII to abdicate. By signing this document on December 10th, 1936, he gave up his right to the British throne.	King Edward VIII abdicated on the 10th of December, 1936.	entailment
859	Mars is considered the red planet because of its bright red color.	Mars is called 'the red planet'.	entailment
269	According to NC Articles of Organization, the members of LLC company are H. Nelson Beavers, III, H. Chester Beavers and Jennie Beavers Stewart.	Jennie Beavers Stewart is a share-holder of Carolina Analytical Laboratory.	not_entailment
355	Miles of Australia's most pristine coastline have been declared a disaster zone following a large oil spill from a storm-damaged cargo ship. At least 60 kilometres of Queensland's southeastern shore were contaminated when at least 42 tonnes of oil spilled into the ocean from MV Pacific Adventurer on Wednesday night.  The ship, which had sailed into cyclonic weather, lost 31 containers aboard, one of which pierced the ship's hull and a fuel tank.  Anna Bligh, the Queensland premier, has declared Moreton Island, Bribie Island and southern parts of the Sunshine Coast disaster zones.	MV Pacific Adventurer has lost oil in the area of Moreton Island, Bribie Island and southern parts of the Sunshine Coast.	entailment
112	The 10-men team is expected to arrive at the foot of the mountain in the end of April and began their journey to the 8,586-meter peak in early May.	Kanchenjunga is 8586 meters high.	not_entailment
2400	Budapest is Europe's largest spa town; there are more than 100 hot springs that spout from Buda's limestone bedrock.	There are numerous underground hot springs that contain radium and other minerals, and, since Roman times, bathers have sought them out for their supposed healing properties.	not_entailment
454	Farabundo Marti National Liberation Front's [FMLN] urban commandos have denied reports they participated in an attack on vice president-elect Francisco Merino's home.	Farabundo Marti National Liberation Front is accused of an attack on Merino's home.	entailment
2023	Slavkov, accused in the Salt Lake scandal but later cleared, said he had been approached by Takatch.	Slavkov, defendant in the scandal of Salt Lake but that later was exculpated, in fact said that Takatch.	not_entailment
160	A memorial service has taken place for Australian actor Heath Ledger, who died January 22 in New York. Hollywood celebrities and many other loyal fans bid farewell to the well known actor. His death has been deemed accidental by the New York City Medical Examiner and was attributed to a toxic mixture of prescription drugs and pain killers. The star died in his Manhattan apartment last month. The service was held at Penrhos College in Perth, Australia and was attended by over 100 people, although the actual funeral was only attended by Ledger's close family. Before the funeral, Heath's father, Kim Ledger, said that "the funeral will be very, very private and there will only be 10 people there, immediate family and nobody else."	Kim Ledger was Heath's son.	not_entailment
410	From 1016 to 1030 the Normans were pure mercenaries, serving either Byzantines or Lombards, and then Sergius of Naples, by installing their leader Rainulf in the fortress of Aversa in 1030, gave them their first pied-à-terre and they began an organized conquest of the land.	Rainulf was the leader of the Normans.	entailment
1913	Thanks to a global ban on the ivory trade that was passed in 1989 by the Convention on International Trade in Endangered Species of Wild Fauna and Flora (CITES), the African elephant population may be reversing its spiral toward extinction	The ban on ivory trade has been effective in protecting the elephant from extinction.	entailment
1743	Parviz Davudi was representing Iran at a meeting of the Shanghai Co-operation Organisation (SCO), the fledgling association that binds Russia, China and four former Soviet republics of central Asia together to fight terrorism.	China is a member of SCO.	entailment
1218	The hullabaloo is over a glacial period dating to about 750 million to 600 million years ago.	A glacial period occurred about 750 million to 600 million years ago.	entailment
1067	Medieval Christians said the rosary as Catholics still do today: by praying five decades of Ave Marias (Hail Marys), each introduced by a Pater Noster (Our Father), while meditating on three series of five mysteries each.	Christians pray the rosary.	entailment
2423	Women form half the population and 54% of the voters in the country, yet are very poorly represented in parliament.	Women are poorly represented in parliament.	entailment
2320	The father of a British soldier who was killed in Iraq yesterday has paid tribute to his son. 29 year-old Corporal Matthew Cornish, who was married with two young children, sustained injuries after a mortar attack on a base in Basra. He was rushed to hospital, but he later died. He was the first soldier to be killed in an attack on a UK military compound in Iraq. "I'm proud of him as a soldier and as a son. He did the Army proud," 60 year-old Robin Cornish said of his son, the one hundred and fifteenth British soldier to be killed in Iraq since operations began in 2003.	Matthew Cornish was killed in Iraq.	entailment
510	Earlier this year reporter Judith Miller was jailed for refusing to name the US-government source who identified a member of the US Central Intelligence Agency (CIA), Valerie Plame.	Judith Miller is a member of CIA.	not_entailment
2062	Scientists and engineers in the APL Space Department have contributed to ocean remote sensing science and technology for more than a quarter century.	Ocean remote sensing is developed.	entailment
1831	Paralysis was followed by aphasia, and after acute pain, followed by a long period of apathy, from which death relieved Swift in October 1745.	Swift died in 1745.	entailment
730	Eddeh reasserted his opinion that President Al-Hrawi ought to be reinstated for another 3 years, claiming that the he "has considerable experience in the running of the state, but his resignation would be appropriate after the withdrawal of Israeli and Syrian forces."	Eddeh calls for an extension to Al-Hrawi's presidency, saying that he should resign after the withdrawal of the Israeli and Syrian forces."	entailment
2086	The extraditables today claimed responsibility for the murder of Antioquia police commander colonel Waldemar Franklin Quintero, which occurred this morning in Medellin.	police officer killed	entailment
1732	Health Minister Ben Bradshaw described the party's loss to the British National Party and to the Greens as a, "terrible loss" and blamed the economic conditions such as rising food and fuel costs as factors that dampens the Labour Party's appeal with the public. Conservative Party leader David Cameron countered Bradshaw's opinion by saying, Mr. Brown was to blame for the economic distress. Cameroon cited the Prime Minister's ten years of handling the economy as minister prior to assuming office when Tony Blair stepped down last year.	Blair was Prime Minister before Brown.	entailment
215	Four US cable companies, including industry leaders Comcast Corp and Time Warner Cable, have entered the fast-growing wireless arena through a joint venture with Sprint Nextel.	Time Warner Cable is a partner of Sprint Nextel.	entailment
1109	Nevertheless, 58 percent of Americans expressed their satisfaction with the President's job performance. 44 percent supported Nixon at the very beginning of the investigation into Watergate.	Although 58% of Americans are unsatisfied with Clinton's job performance, 44% found Nixon's work adequate at the start of the Watergate scandal.	not_entailment
1170	The 42-year-old actor was outside a movie theater in central London's Leicester Square, doing press interviews, Sunday, when a man squirted Cruise with a water pistol disguised as a microphone, London's Metropolitan Police said.	Cruise was in Leicester Square when he was squirted with water.	entailment
1814	Security forces gunned down six Maoists; while the rebels killed a policeman and an abducted civilian drowned escaping from the Maoists, say latest insurgency related reports.	A civilian policeman was killed.	not_entailment
2312	"Privacy lawyers are waiting with bated breath to see what the privacy commissioner has to say about this, because it has implications far beyond Google Street View," Bowman said. "I think we're really at the beginning of this story, not the end." Canada's privacy laws require that a person being photographed give their consent to the pictures being published unless they are being taken for journalistic, literary or artistic purposes. However, in post-production, Google now subjects all photos to an automated process of blurring people's faces and licence plates. In addition, anyone can request specific images be removed from the site. "The privacy concerns could be pretty severe for some and people can still be identified, even with faces blurred out," Bowman said. "I'm not sure how Google is rationalizing compliance with Canadian law by service providers who are taking the pictures here."	Google is subjected to Canadian law.	not_entailment
719	Kuwait becomes the fourth Gulf country where women as well as men can vote in elections. Saudi Arabia holds strictly limited, male-only elections.	Women can vote in elections in Saudi Arabia.	not_entailment
532	An act signed into law by Afghan President Hamid Karzai last month dramatically rolled back the rights of women in that country, according to human rights groups and a United Nations report on the bill by the United Nations Development Fund for Women. The Afghan government has not provided a copy of the text of the Shia Family Law to the UN or to other outside groups requesting it, citing "technical problems", however, the UN and opposition politicians say that the bill contains numerous provisions restricting the rights of women, such as giving their husbands priority in court; requiring the husband's permission to leave the house, obtain education or employment, or to see a doctor; and reserving the custody of children to male relatives.	Hamid Karzai is an employee of the UN.	not_entailment
1938	Egon Eiermann (born September 29, 1904, Neuendorf; died July 20, 1970, Baden-Baden) was one of Germany's most prominent architects in the second half of the 20th century.	Egon Eiermann died on September 29, 1904.	not_entailment
293	September 26 - Trial against former Italian Prime Minister Giulio Andreotti, accused of Mafia connections, begins.	Andreotti is accused of Mafia collusion.	entailment
1192	Scott Stevens, the Idaho meteorologist who claimed that a weather manipulating conspiracy (possibly under the control of Japanese Yakuza mafia) caused Hurricane Katrina, has quit his job at KPVI-TV in Pocatello.	Scott Stevens has connections with the Yakuza.	not_entailment
2189	The 500,000 eligible, Muslim voters are likely to reward Chancellor Gerhard Schroeder's Social Democrats (SPD) in the September 18 parliamentary election, for its anti-Iraq war position and pro-Muslim policies.	Gerhard Schroeder belongs to the Social Democrats.	entailment
1805	Olson, 62, previously worked as a partner at Ernst & Young LLP, as a Minnesota bank president and as a congressional aide, before joining the Fed board in 2001, to serve a term ending in 2010.	Olson is a member of the Fed board.	entailment
440	The anti-terrorist court found two men guilty of murdering Shapour Bakhtiar and his secretary Sorush Katibeh, who were found with their throats cut in August 1991.	Shapour Bakhtiar died in 1991.	entailment
2150	One year after shareholders approved a massive expansion in its pool of stock options, eBay is asking for more.	Shareholders approved expansion for one year.	not_entailment
1664	In 1856 Manuel Ruiz Zorrilla was elected deputy, and soon attracted notice among the most advanced Progressists and Democrats. He took part in the revolutionary propaganda that led to the military movement in Madrid on June 22, 1866. He had to take refuge in France for two years, like his fellow-conspirators, and only returned to Spain when the revolution of 1868 took place.	Zorrilla started the revolution of 1868.	not_entailment
1770	In addition to data bases and publicity, stolen art is recovered when someone seeks appraisal or offers it for sale to dealers or auction houses, responds to a reward offer, attempts to remove it through customs, or requests a ransom for the art.	Centralized inventory records for museums aid in theft awareness.	not_entailment
823	Kevin Vincent, 44, of Arlington, Va., said his wife buys store brand acetaminophen and he wanted to find out more about the problem.	Kevin Vincent buys store brand acetaminophen.	not_entailment
1771	Personal computer maker, Gateway Inc., on Monday, lowered its 2005 revenue and earnings forecast, sending its shares plunging 11 percent, as pricing in the industry became increasingly cut-throat.	Gateway lowered its sales and earnings guidance for the year.	entailment
83	Ruth bounced back from his 1925 ailments and problems to lead the American League in home runs with 47, 28 home runs more than anyone else.	Ruth hit 47 runs in his lifetime.	not_entailment
1845	After the polio cases were identified, public health officials in the Dominican Republic and Haiti began giving the vaccines to large numbers of children. Public health officials now say the disease is under control and is not a public health threat.	Polio is under control in the world.	not_entailment
