index	sentence1	sentence2	label
2321	"A force majeure is an act of God," said attorney Phil Wittmann, who represents the New Orleans Saints and owner Tom Benson's local interests.	New Orleans Saints are property of Tom Benson.	entailment
439	Scientists at the Genome Institute of Singapore (GIS) have discovered the complete genetic sequence of a coronavirus isolated from a Singapore patient with SARS.	Singapore scientists reveal that SARS virus has undergone genetic changes.	not_entailment
1210	Frye says, that he (a homeopathy expert) and Iris Bell recently studied homeopathic treatment of fibromyalgia.  A new analysis - comparing published studies of homeopathic drugs to matched, randomly selected studies of medical drugs - suggests that these apparent homeopathic drug effects are merely placebo effects.	What really irks Frye and other doctors of homeopathy, however, is that homeopathic remedies are not supposed to be used like medical drugs.	not_entailment
2002	The Kalido Technical Advisory Board members include Boris Evelson, founder and managing partner, Textra Group, Inc., and Bill Inmon, president, Inmon Data Systems.	Boris Evelson founded the Kalido Technical Advisory Board.	not_entailment
2158	Hunting reef sharks is now banned throughout Maldivian waters. The government decision has made the Indian Ocean archipelago the first nation in the region to outlaw the practice. Shark numbers have plummeted in the Maldives in recent years because a significant minority of fishermen target sharks for their lucrative fins, which are used in shark-fin soup, a luxury Asian dish. Once its fins have been cut off, the shark is often returned to the sea where it suffocates over many painful hours.	Due to the decreasing number of sharks, Maldives have banned the hunt of reef sharks.	entailment
1817	Philip Morris the US food and tobacco group that makes Marlboro, the world's best-selling cigarette, shrugged off strong anti-smoking sentiment in the US.	Philip Morris owns the Marlboro brand.	entailment
301	The U.S. Senate has scheduled debate and a vote in June on a bill that would allegedly initiate a process for Native Hawaiians to achieve the same level of self-governance and autonomy over their own affairs that many Native American tribes currently have. Critics of the bill characterize it as going much further than any existing tribal recognition, creating a governing entity based solely on race, without the same requirements as needed for Native American tribal recognition, such as having existed predominantly as a distinct community, having exercised political influence over its members as an autonomous entity, and have continuously been identified as a tribal entity since 1900.	The Shoshones fight for their rights against the U.S. government.	not_entailment
565	Scott's execution led to outrage in Ontario, and was largely responsible for prompting the Wolseley Expedition which forced Louis Riel, now branded a murderer, to flee the settlement.	Louis Riel assassinated Scott.	not_entailment
1097	The mystery of Alexander the Great's tomb still has not unraveled, and locating the burial of Alexander seems to have become an impossible mission for archaeologists.	Alexander the Great's Tomb remains undiscovered.	entailment
2151	Sara Jane Moore, 77, who tried to assassinate Former United States President Gerald Ford in 1975 was paroled from prison in California this afternoon. Moore tried to assassinate Ford outside of the St. Francis Hotel in downtown San Francisco on January 15, by firing one shot, which missed because a bystander grabbed Moore's arms just seconds before she fired the gun. The bullet missed hitting Ford in the head by inches.	Sara Jane Moore is no longer in prison.	entailment
325	Female mosquitoes become infected with the malaria parasite when they draw blood from humans with malaria. The insects can then pass this on to other humans they bite, but do not get sick themselves.	Female mosquitoes spread malaria.	entailment
1336	Carmine Rocco, Health Director was contacted in June by Sue Robbins, Division of Waste Management, to advise him that she would be in the county to conduct a site visit to the former Woodson-Tenent Laboratory.	Sue Robbins visits the former Woodson-Tenent Laboratory.	entailment
1604	In other words, with its 2 million inhabitants, Slovenia has only 5.5 thousand professional soldiers.	Slovenia has 5.5 million inhabitants.	not_entailment
183	The New Zealand Rugby League team (Kiwis) have been docked two competition points and hooker Nathan Fien barred from playing in the Gilette Rugby League Tri-Nations series. It comes after allegations of Fien's availability to play for the Kiwi's were exposed by a documentation of his birth certificate. At a hearing the Rugby League International Federation ruled that Fien was unable to play for the kiwis as he was Australian born. Instead of his grandmother a resident of New Zealand, it was in fact his great-grandmother. According to Rugby League International Federation chairman Colin Love, the Kiwis thought great-grandparents were as good as grandparents.	Nathan Fien is a resident of Australia.	not_entailment
908	It could mean to leave in the street to thousands of workers.	It could lead to thousands of job losses.	not_entailment
1885	"This is a major milestone on our road to recovery, and I want to thank the members of Congress who came together in common purpose to make it happen," Obama said in his weekly address. "I will sign this legislation into law shortly, and we'll begin making the immediate investments necessary to put people back to work doing the work America needs done. This historic step won't be the end of what we do to turn our economy around, but the beginning."	The Congress wants to boost the economy.	entailment
356	Bout - who is generally believed to be a model for the arms dealer portrayed by Nicolas Cage in the 2005 movie 'Lord of War' - has repeatedly denied any involvement in illicit activities. At a hearing earlier this month, he angrily accused the United States of framing him and pressuring Thailand to extradite him. He has long been linked to some of the world's most notorious conflicts, allegedly supplying arms to former Liberian dictator Charles Taylor and Libyan leader Colonel Gaddafi.	Gaddafi is the leader of Thailand.	not_entailment
876	Kurdistan Regional Government Prime Minister Dr. Barham Salih was unharmed after an assassination attempt.	prime minister targeted for assassination	entailment
1647	The city's motto is Contemnit procellas, which means, "It defies the storms."	The city's motto is, appropriately, "Contemnit procellas" ( "It defies the storms").	entailment
916	A briefcase containing magnets, batteries and a cell phone sitting in the bushes outside a Charleston, South Carolina coffee shop drew the local bomb squad's attention, before it was determined that it contained no explosives. Police had earlier closed down Calhoun Street in downtown, where the coffee shop is located, but reopened the street and let local residents and business owners that the situation was over after performing an investigation.	A briefcase was found outside Starbucks in Charleston.	not_entailment
2391	Since the fear of death is virtually a universal phenomenon, the death penalty is an unparalleled deterrent for people considering a crime.	Capital punishment is a deterrent to crime.	entailment
2481	The community will include every state in South America with the exception of French Guiana, itself a territory of France. Bolivia, Colombia, Ecuador, Peru, and Venezuela join SACN from the Andean Community, a trade bloc established in 1969. From the more recent (1991) Mercosur comes Argentina, Brazil, Paraguay, and Uruguay. Guyana, Suriname, two small northeastern countries which had previously not participated in a South American trade bloc, will not immediately join the community. Chile will additionally join; it has, however, been cautious.	Ecuador is situated in South America.	entailment
2225	Sources in Tegucigalpa reported that many Latin American countries are gearing up to face Hurricane "Mitch".	South American countries are preparing for "Mitch"	entailment
1910	Even more than other economic activities, Mexico's financial services are concentrated in the capital.	Industry, retail stores, finance, and communications are all centered in the capital.	entailment
1884	The actor's publicists confirmed that Mr Willis, who celebrated his 54th birthday on Thursday, married 30-year-old Emma Heming in a private ceremony in his home in the Caribbean archipelago of Turks and Caicos Islands.  Ms Heming was born in Malta, but was raised in London. She has been a lingerie model for Victoria's Secret and La Senza.  The couple met through mutual friends around a year ago. The marriage is Ms Heming's first and Mr Willis' second. The actor's first wife, actress Demi Moore, was among the guests at the wedding.  Comments (0)  .	Mr. Willis' second wife is from Malta.	entailment
760	China's announcement of a rival Panchen Lama to the boy already recognized by the Dalai Lama are indications that its Communist regime is desperate in using any means possible to strengthen control over Tibet and Tibetan affairs.	Dalai Lama and the government of the People's Republic of China are in dispute over Panchen Lama's reincarnation.	entailment
1293	James Wilkinson, Ms. Rice's communications director, was shoved against a wall by guards as he tried to enter the meeting.	Condoleezza Rice is the U.S. Secretary of State.	not_entailment
312	Once you get a chance to talk to West Palm Beach, Florida native Whitney Cunningham, who placed seventh on the eighth cycle of the popular reality TV series America's Next Top Model, you begin to understand what host Tyra Banks meant when she described her as the "full package." First of all, she is confident and headstrong, which is a must on these kinds of shows, almost as much as it is to take a beautiful modelesque picture. Second, she turns that confidence into drive. She has been receiving steady work as a model since leaving the show, and still believes that her goal of being the first woman to wear a size ten dress on the cover of Vogue is in reach. Third, and probably most important to television viewers, she obliterates the age-old model stereotype that to be pretty and photograph well, one must also be vapid and without a thought.	Whitney Cunningham was born in Florida.	entailment
910	The so-called "grandmother hypothesis", based on studies of African hunter-gatherer groups, suggests that infertile women are vital for successful child-rearing despite being unable to produce children themselves.	Infertile women are vital for successful child-rearing, according to the "grandmother hypothesis".	entailment
1369	Foreign Ministers of the 16 NATO member countries met early this morning with their Russian counterpart, Yevgeny Primakov, in Berlin in a bid to improve NATO-Russia relations.	The NATO has 16 members.	entailment
2371	Some of these kinds of violence continue to be perpetrated by certain individuals and groups in the new Iraq.   Mahmoud continued, "In the last six months at least eight women have been killed in Mosul alone - all apparently by Islamic groups clamping down on female independence. Among these, a professor from the city's law school was shot and beheaded, a vet was killed on her way to work, and a pharmacist from the Alkhansah hospital was shot dead on her doorstep."	Women in Iraq have lost their freedom.	not_entailment
1328	RED VERSUS YELLOW In broad terms, Thailand's crisis is a battle between the "yellow shirts" -- royalists, the military and urban Thais, who back Prime Minister Abhisit Vejjajiva -- and the "red shirts" -- supporters of former premier Thaksin Shinawatra whose power base was mainly drawn from the country's millions of rural poor. Bureaucratic and military elites have run Thailand for decades, with the poor excluded except during elections when competing parties would try to buy their votes. When Thaksin swept to power in 2000, promising a raft of policies aimed at the poor, things changed.	The "yellow shirts" supports Vejjajiva.	entailment
1497	"From a research point of view, this is the first time we could identify what appears to be typical Parkinson's disease cases before people develop symptoms," says Mayo Clinic neuroscientist Matthew Farrer. "We know if someone inherits the mutation they are going to get Parkinson's disease." The mutation was discovered by sequencing the LRRK2 gene in families with Parkinson's from the US, Norway, Ireland and Poland.	A genetic mutation has been linked with Parkinson's disease.	entailment
1840	Anant Gupta who was kidnapped from the elite locality of Sector 14, Noida, India has returned home. He was kidnapped on November 13, 2006 and released by his abductors yesterday morning. The police have made an arrest in the city of New Delhi. The other two accused are absconding. The boy claimed that he was kept in a jungle and was treated nicely by the three men.	Anant Gupta was kidnapped in India.	entailment
1533	Drew Barrymore and Justin Long have been cast in a romantic comedy called Going the Distance. The New Line Cinema film is to be directed by documentary filmmaker Nanette Burstein, who made the films The Kid Stays in the Picture and American Teen. It will be Burstein's feature film debut. Going the Distance, written by New Line staffer Geoff LaTulippe, will focus on a couple dealing with challenges arising from a cross-country romance. Media reports did not indicate a release date had been determined.	Drew Barrymore is in a relationship with Justin Long.	not_entailment
1544	Jyestadeva (1500-1610), was an astronomer of the Kerala school founded by Madhava of Sangamagrama and a student of Damodara. He is most known for writing the first calculus text, the Yuktibhasa . He also authored the Drk-karana on astronomical observations.	Jyestadeva invented calculus.	not_entailment
1043	New research shows there has been a sharp increase in disfiguring skin cancers, particularly in women under the age of 40, providing more evidence that young people are not heeding warnings about the dangers of tanning.	Tanning may cause skin cancers.	entailment
1122	"Only his comrades see him; we exchange messages with each other to share plans. We also go to the battlefield together. We actually meet very rarely, just for important consultations. It's hard for anyone to meet Bin Laden himself now, but we know he's still alive," said Dadullah. Dadullah also claims that there are "hundreds" of suicide bombers that are prepared and ready to hit the NATO peacekeeping forces in Afghanistan and that Americans will "reap the crop for a long time" also saying that the Taliban and al-Qaeda will get "revenge" on the United States either inside or outside Afghanistan.	Dadullah is a Taliban.	not_entailment
1896	Solar Systems Pty Ltd, Hawthorn, Victoria, have announced an agreement with Boeing Australia Ltd for supply of Spectrolab solar cells. The agreement will result in the supply of 500,000 cells, capable of generating 11MW of electricity. Spectrolab produces multi-junction solar cells, originally designed for powering satellites. The solar cells are three times more efficient than the cells used in typical domestic solar panels, and are capable of converting light energy to electrical energy with up to 34% efficiency according to NREL's National Centre for Photovoltaics. Solar Systems utilise Spectrolab's multi-junction solar cells to increase the output of their dish systems.	Boeing Australia Ltd collaborates with Solar Systems Pty Ltd.	entailment
1599	Long-distance telephone company MCI Inc., on Friday, touted its $6.75 billion deal to be bought by Verizon Communications Inc., but said it would thoroughly analyze a revised $8 billion bid by Qwest Communications International Inc.	MCI made no mention of its planned $6.7 billion agreement to be acquired by Verizon Communications in its release, Friday.	not_entailment
1922	Meanwhile, in an exclusive interview with a TIME journalist, the first one-on-one session given to a Western print publication since his election as president of Iran earlier this year, Ahmadinejad attacked the "threat" to bring the issue of Iran's nuclear activity to the UN Security Council by the US, France, Britain and Germany.	Ahmadinejad is a TIME magazine journalist.	not_entailment
194	For hundreds of family members holed up in a hotel not far from the Stockholm ferry terminal, where the boat Estonia was to have docked Wednesday morning after an overnight trip from the Estonian capital of Tallinn, the suspended rescue effort was just the latest in a day of heartbreaking reports.	The Estonia set sail from Tallinn.	entailment
456	A computer system failure closed down share trading at the Tokyo Stock Exchange for most of yesterday, the worst disruption to date for Asia's largest bourse.	The Tokyo Stock Exchange was closed down by computer system failure.	entailment
1824	Francis Deng believes the government will be receptive to the plan to deploy 1,800 peacekeeping troops.	The AU said it may send a 2 000-strong peacekeeping force.	not_entailment
1487	Organic fertilizer slowly enriches and feeds the soil. Fast acting synthetic fertilizers harm soil life.	Organic fertilizers are used as soil enhancers.	entailment
1636	The report faults intelligence agencies for a "lack of imagination" in not anticipating that al Qaeda could attack the United States using hijacked aircraft.	The report blames intelligence agencies.	entailment
212	Moscow (USSR), 12 Jul 89 (PRAVDA)- Blood is flowing in Columbia, where last year, according to official statistics, there were 4,600 victims of political violence, including Jaime Pardo Leal (president of Colombia's national coordination committee), around 30 deputies and many municipal advisors and mayors.	Jaime Pardo Leal was killed in Moscow.	not_entailment
1060	He is the professor of theater and drama at Loyola University and the director of Wilson's "Two Trains Running," now onstage at Pegasus Players.	"Two Trains Running" was written by Wilson.	entailment
2082	"These new results from Cassini may be the first evidence of gases originating either from the surface or possibly from the interior of Enceladus," said Dr. Michele Dougherty, principal investigator for the Cassini magnetometer and professor at Imperial College in London. Scientists have suspected Enceladus as geologically active and a possible source of Saturn's icy E ring. Enceladus is the most reflective object in the solar system, reflecting about 90 percent of the sunlight that hits it.	Titan is the fifteenth of Saturn's known satellites.	not_entailment
166	The men, Dritan Duka, 30, Shain Duka, 28, and Eljvir Duka, 25, all illegal immigrants, were each sentenced to life without the possibility of parole. The three, who operated a roofing business in Cherry Hill, N.J., were among five foreign-born Muslims convicted in December of planning an attack at the base, about 40 miles east of Philadelphia. The attack was never carried out. The other two men who were convicted, Mohamad Shnewer, a Jordanian-born taxi driver from Philadelphia, and Serdar Tatar, a convenience-store clerk from Turkey, are to be sentenced on Wednesday.	Eljvir Duka comes from Turkey.	not_entailment
1943	Lima, Jan. 10, '90 - The national police reported that over 15,000 people have been arrested in Lima in a dragnet aimed at uncovering the assassins of former Defense Minister Enrique Lopez Albujar Trint, who was murdered in a terrorist attack, yesterday.	Enrique Lopez Albujar Trint was killed on Jan. 9 '90.	entailment
2244	A recently created Danish clothing company is selling on the internet T-shirts in order to support the clandestine radio station of the Colombian guerrilla group Revolutionary Armed Forces of Colombia (FARC) and the graphical workshop of the Popular Front for the Liberation of Palestine (PFLP). In fact the money will be used by these groups to carry on their terrorist activities. FARC activities include kidnappings, masacres, bombs, extortions and the drug trade. Fighters and Lovers is selling the T-shirts at 170 DKK (US$27.6), from which 35 DKK (US$5.7) are to be destinated to support both armed groups.	Revolutionary Armed Forces of Colombia teamed up with Fighters and Lovers.	entailment
997	The Sioux Ghost Shirt was a feature of Glasgow's Kelvingrove Museum for more than 100 years before being repatriated to its land of origin.	A Sioux ghost shirt was returned by a Scottish museum.	entailment
652	A male rabbit is called a buck and a female rabbit is called a doe, just like deer.	A female rabbit is called a doe.	entailment
1658	Local health department officials were quoted as saying that the bridge over the Santa Barbara river, in southern Peru's Ayacucho province, "broke in two" as students and teachers from four rural schools were crossing it while going home. Fernando Valencia, a surgeon with a local hospital confirmed in reports that the death toll had risen to nine. The accident also injured 53 others, most of whom were children between the ages of 10 and 13, Valencia said. Fourteen of the victims were in critical condition. Local police said the 120-meter bridge, made of wooden boards and slats held together by steel cables, collapsed because too many people were on it.	The Peruvian bridge in Ayachuco province broke because of the weight on it.	entailment
1779	Goosen shot a 69 on Saturday, one of only two sub-par rounds on the day, to grab a three-shot lead through 54 holes at Pinehurst No. 2.	Goosen shot a 69 and has a three-shot lead.	entailment
2172	John Lennon's widow, Yoko Ono, approved this museum as the world's first museum to honor John Lennon.	Yoko Ono is John Lennon's widow.	entailment
1413	Geithner criticized the report's findings on the World Bank, including a commission recommendation that the Bank stop lending to emerging market economies, concentrate its resources on the poorest countries and shift the IFI's concessional assistance from loans to grants.	The World Bank is criticized for activities.	not_entailment
472	The Sudanese President Omar Hassan al-Bashir has rejected an UN offer of up to 17,000 troops to stem the continuing crisis within the country. Bashir met with the UN Secretary-General Kofi Annan on Sunday at the 7th African Union Summit being held in the Gambian capital Banjul. In a speech to delegates from across the continent, Mr. Annan, who was born in Ghana, labeled the Darfur crisis as "one of the worst nightmares in recent history". But Mr. Bashir said he was concerned that a UN mandate would be seen as a "western invasion" that would attract militants and create a situation similar to Iraq.	The African Union summit was in Egypt.	not_entailment
330	The petrol price reductions seen across most of Australia have been short-lived for those living in the regional New South Wales city of Bathurst. An investigation by Wikinews has discovered retailers in Bathurst were late to lower petrol pricing and have been amongst the first to increase them. Following a threat by the Australian Competition and Consumer Commission (ACCC) to publically shame fuel retailers and oil companies, most fuel outlets across Australia reduced prices by 5 to 10 cents per litre. The ACCC argued that the wholesale cost of petrol was around 10 cents per litre higher than the Singapore market, which Australia benchmarks itself against. On January 24, the price of Unleaded fuel in Bathurst dropped only 2 cents from 119.9 cents to 117.9 cents. Today, Coles Express on Durham Street has increased the price of their unleaded fuel to the previous level of 119.9 cents.	New South Wales is found in Australia.	entailment
561	There are actually good grounds to believe that legalization would reduce the costs of respiratory damage from marijuana smoking by encouraging the development of better smoke filtration technology, the substitution of more potent, less smoke-producing varieties of marijuana, and the substitution of oral preparations for smoked marijuana.	Drug legalization has benefits.	entailment
2479	Anna Nobili is no ordinary nun. The 38-year-old used to be a lap-dancer, and spent many years working in Italian nightclubs. She is now using her talents in a rather different way - for what she calls "The Holy Dance" in a performance on Tuesday evening at the Holy Cross in Jerusalem Basilica in Rome, in front of senior Catholic clerics including Archbishop Gianfranco Ravasi, head of the Vatican's Cultural Department. Miss Nobili told the BBC World Service that the transformation from podium lap dancer to nun happened gradually.	Anna Nobili became a nun in 2002.	not_entailment
111	As late as 1799, priests were still being imprisoned or deported to penal colonies and persecution only worsened after the French army led by General Louis Alexandre Berthier captured Rome and imprisoned Pope Pius VI, who would die in captivity in Valence, Drôme, France in August of 1799.	Alexandre Berthier died in 1799.	not_entailment
1682	Iraq would have been an unsafe, unsecure country that did pose a threat to the world.	Iraq would have constituted a threat to the world.	entailment
1550	The galaxy, measuring just 2,000 light-years across, is a fraction of the size of our own Milky Way, which stretches 100,000 light-years in diameter.	The Milky Way measures 2,000 light-years across.	not_entailment
1882	The first kibbutz was founded at Degania near the Sea of Galilee in 1909 and there are now some 300 kibbutzim in Israel.	The first kibbutz was founded at Degania.	entailment
