index	sentence1	sentence2	label
1939	Guanshengyuan, a Chinese company that makes children's candy, has stopped selling its popular brand White Rabbit, which is sold nationally in China, after tests confirmed the presence of melamine. Bright foods owns the candy company. Earlier their powdered milk was found to contain melamine which sickened over 53,000 people and was responsible for the deaths of at least four infant children. Guanshengyuan has stopped exporting their goods to the nearly 50 companies overseas that buy them. Melamine has also been found in Hong Kong in baby cereal and vegetable formula made by Heinz. It has also been found in wasabi crackers which are manufactured by the Chinese company, Silang House. Another Chinese food company called Marudai Food Co. has also halted the sales of several items such as meat buns, cream buns and corn crepes made with cream over fears that melamine laced powered milk has contaminated their products. So far there have been no reports of any illnesses associated with Marudai Foods.	4 children died in Hong Kong because of melamine contained in milk.	not_entailment
1115	Australian cheerleaders have been told today to cover up their midriffs under calls by Gymnastics Australia, as they believe it encourages girls to be self-conscious. Nerine Cooper, head of Gymnastics Australia, told the Sunday Telegraph, "We don't want girls to feel under pressure to lose weight because of uniforms." Lisa Ince, head of Sydney Professional Dancers, disagreed. "It's ridiculous really, if the thinking is that a midriff is offensive, then every dance school and athletics club would face the same restrictions," she said. The ban will affect about 150 teams registered with Gymnastics Australia.	Lisa Ince is the chief of Sydney Professional Dancers.	entailment
933	One year on from the Indian Ocean tsunami, the world's grief and compassion returned to the tsunami-battered coastlines of the Indian Ocean, where at least 216,000 people lost their lives. Under a clear sky and before a gentle sea, the world commemorated those who lost their lives, in one of the worst natural disasters that the modern world has experienced.	Earthquakes have the potential to generate a tsunami.	not_entailment
1150	The credit card mobile phones now provided on some aircraft, do not interfere with aircraft systems because they are wired to a special "base station" that has been designed to safely receive and transmit radio signals in the aircraft.	Mobile phones can interfere with aircraft systems.	not_entailment
1392	The Mona Lisa, painted by Leonardo da Vinci from 1503-1506, hangs in Paris' Louvre Museum.	The Mona Lisa is in France.	entailment
264	Heemeyer cut portholes for his guns, then welded a tight enclosure around them so police bullets could not penetrate.	Out of an old bulldozer, Heemeyer built a concrete box that no police bullet could penetrate.	not_entailment
2186	Sunday Express, a tabloid newspaper from the UK reported an anonymous source claiming to be an insider to merger talks between Wells Fargo Bank and Barclays Bank. The rumoured merger would be a radical break in the kinds of mergers Wells Fargo has done and has said it will continue to do (it is assumed that Wells with the higher market capitalization would be the buyer). Wells Fargo has previously shown no desire to engage in retail banking outside the United States, and has only expanded internationally in its Consumer Finance business and with certain business services.	Barclays Bank is one of the UK tabloid newspapers.	not_entailment
1850	In 1867, Nobel obtained a patent on a special type of nitroglycerine, which he called "dynamite". The invention quickly proved its usefulness in building and construction in many countries.	Alfred Nobel is the inventor of dynamite.	entailment
603	The conference found that many Australians experience discrimination through the Governmental, penal, legal and health care systems because of their mental health, race, skin colour, sexuality, sexual formation or refugee status.	Mental health problems increase in the young.	not_entailment
1740	Environmental and social groups criticized the World Bank decision for shying from meaningful reform.	The World Bank is criticized for its policies.	entailment
2279	Nancy Vine, who sells tickets at the Big Sky drive-in, seven nights a week, is a daughter of Donald and Dorothy LeGros - part of the extended family that operates the drive-in.	Nancy Vine is in business with Donald and Dorothy LeGros.	entailment
2113	Saint John's Cathedral is the oldest church in Warsaw.	In the Old Town, the Gothic St . John's Cathedral and the red-brick fortifications known as the Barbican remain from the medieval period.	not_entailment
2346	Zakaria Maamar, associate professor at the College of Information Technology at Zayed University, UAE, told Science and Development Network (SciDev.Net) that, "This initiative is another boost to the research and development activities that are carried out in the UAE. It will definitely provide researchers with the appropriate funds to sustain such activities and promote best practices in the community." Said Elnaffar, assistant professor at the college of information technology at the United Arab Emirates University, told SciDev.Net that, with this initiative, the UAE is taking the lead and setting a good example by building a strong development infrastructure founded on knowledge discovery and research.	Said Elnaffar is an employee of the United Arab Emirates University.	entailment
1870	Within trillionths of a second after the Big Bang, they have reasoned, the primordial explosion - many billions of degrees hot - must have created a universe that contained equal quantities of matter and antimatter.	The Big Bang is the primordial explosion from which the universe was created.	entailment
573	Greece objects to the neighbouring Skopje government using the name Macedonia, saying it implies claims on a Greek province of the same name.	Greece and Macedonia are in dispute over name.	entailment
1032	Microsoft Corp. and Intel Corp., on Monday, threw their weight behind the next-generation, HD DVD format being promoted by Toshiba Corp., in a blow to Sony Corp.'s Blu-ray format.	Toshiba Corp. is a partner of Sony Corp.	not_entailment
805	The 500,000 eligible, Muslim voters are likely to reward Chancellor Gerhard Schroeder's Social Democrats (SPD) in the September 18 parliamentary election, for its anti-Iraq war position and pro-Muslim policies.	The parliamentary election takes place on September 18.	entailment
289	The ivory ban has been successful. Demand for ivory has dropped and elephant populations expanded dramatically in areas where they were virtually extinct.	The ban on ivory trade has been effective in protecting the elephant from extinction.	entailment
1730	Diets that provide recommended levels of magnesium are beneficial for bone health, but further investigation on the role of magnesium in bone metabolism and osteoporosis is needed.	Dietary intake of magnesium prevents osteoporosis.	not_entailment
2452	The decision by the British government to suspend flights to Kenya is regrettable, it plays into the hands of terrorists.	The British government banned flights to Kenya.	entailment
1828	Any taxpayer earning over £150,000 will no longer enjoy higher-rate tax relief, which is considered a substantial incentive to save for wealthy workers. From April 2011, anyone who earns £200,000 a year, for example, and pays the typical amount of 6 per cent of their salary into their company pension scheme will lose out on £200 a month or £2,400 a year.  Alistair Darling, when he announced the move in the Budget, insisted that just 1.5 per cent of taxpayers - the equivalent of about 450,000 people - would be hit, but experts argued that it would significantly damage the already beleaguered pensions industry, and cause many savers to think twice about investing in a pension.	Alistair Darling is chancellor of UK.	not_entailment
408	A teenager in Japan whose parents are being deported to the Philippines has decided to stay in Tokyo with her aunt. After the family lost a three-year battle to remain in Japan, Noriko Calderon, 13, had to choose whether to stay in Japan or go with her parents. She said an emotional goodbye to them at Tokyo's main airport. Filipinos Arlan and Sarah Calderon used fake passports to enter Japan in the early 1990s, and their daughter was born and raised in the country.	Arlan and Sarah Calderon are Japanese.	not_entailment
1046	Gen. Maza Marquez said that the fact that a payment is being offered for the capture of Pablo Escobar does not mean that other persons accused of being capos of the mafia are not being sought, and that if anyone being held in connection with the investigation of the killing of Luis Carlos Galan is released, that does not mean that the investigations are not proceeding well.	Luis was killed by the capos of the mafia.	not_entailment
713	Coal company stocks got a lift Monday morning after an article in Barron's said the industry was benefiting from soaring natural gas prices and the advent of new power plants that emit less pollution.	Coal stocks rise.	entailment
322	Three plays later, quarterback James Pinkney was sacked by Wake's Goryal Scales on third-and-one, forcing the team to punt.	James Pinkney was an employee of Goryal Scales.	not_entailment
2323	Shiite and Kurdish political leaders continued talks, on Monday, on forming a new government, saying they expected a full cabinet to be announced within a day or two.	Washington is pressing Iraq's leaders to end weeks of political deadlock and to form a new government as soon as possible, US officials say.	not_entailment
2399	A bus aide has been accused of molesting a 9-year-old boy who was on board a school bus headed for school in Queens on Monday morning, the police said. The aide, Darnell Washington, 20, was arrested Tuesday morning when the bus pulled in front of the victim's home in Queens to pick the child up for school, the police said. Mr. Washington, of Queens, was charged with three felony counts including sexual abuse and endangering the welfare of a child, the police said. The identity of the bus company and the school the child attended could not immediately be learned.	Darnell Washington is accused of molesting a boy.	entailment
824	Joe Friday wore badge No. 714-in honor of the number of home runs Ruth hit in his career.	Ruth hit 714 home runs in his lifetime.	entailment
131	Although they were born on different planets, Oscar-winning actor Nicolas Cage's new son and Superman have something in common - both were named Kal-el.	Nicolas Cage's son is called Kal-el.	entailment
2344	Anorexia in males accounted for approximately six percent of cases seen in an eating disorder clinic.	Anorexia becomes common in males.	not_entailment
1314	The use of aspirin (acetylsalicylic acid) in single doses should not pose any significant risks to the suckling infant.	People experienced adverse effects while taking aspirin.	not_entailment
210	Aeschylus is often called the father of Greek tragedy; he wrote the earliest complete plays which survive from ancient Greece. He is known to have written more than 90 plays, though only seven survive. The most famous of these are the trilogy known as Orestia. Also well-known are The Persians and Prometheus Bound.	"The Persians" was written by Aeschylus.	entailment
1868	CVS will stop selling its own brand of 500-milligram acetaminophen caplets and pull bottles from store shelves nation wide, spokesman Mike DeAngelis said.	CVS will not sell its own brand of 500-milligram acetaminophen caplets any longer.	entailment
2262	Thousands of troops are being deployed to secure the city of Bogor, where Bush is to hold talks with his Indonesian counterpart, Susilo Bambang Yudhoyono.	Bush is scheduled to visit the city of Bogor.	entailment
1428	Prior to that, Andy Sipowicz began to date Assistant District Attorney Sylvia Costas. They got married in 1995 and had a son Theo in 1996.	Sylvia Costas is the wife of Andy Sipowicz.	entailment
1258	Elsewhere, Mozambique took its first ever Olympic gold medal when Maria Mutola won the women's eight-hundred metres, while the men's ten-thousand-metres went to the Ethiopian Haile Gebrselassie.	The women's ten thousand metres champion is from Mozambique.	not_entailment
2286	Police sources stated that during the bomb attack involving the Shining Path, two people were injured.	Two people were wounded by a bomb.	entailment
1344	In Johannesburg, about 500 angry AIDS activists, many wearing red and white T-shirts that said "HIV Positive," criticized Bush, saying he had hurt the global fight against AIDS by spending billions of dollars on war.	In Johannesburg, activists complained that Bush spent billions of dollars on the global fight against AIDS instead of on war.	not_entailment
1849	The Commission, designated to shed light on crimes and human rights violations during the apartheid period, accuses the African National Congress of carrying out torture and executions without trials in concentration camps, and also of playing an active role in the political violence incidents that took place between 1990 and 1994.	The Commission accused the ANC of violence, executions and human rights violations.	entailment
750	The biopic of wannabe actor, Johnny Stompanato, may be directed by Adrian Lyne of "Fatal Attraction" and "Indecent Proposal" fame.	Johnny Stomponato starred in Fatal Attraction.	not_entailment
511	John Lennon's widow, Yoko Ono, has topped the US dance chart at the age of 71 with a song supporting gay marriage.	Yoko Ono is John Lennon's widow.	entailment
332	Epiphyte is the name applied to the class of plants which typically do not root in the soil but, rather, attach themselves to trees or other tall objects where they can obtain light and moisture.	Plants are grown in substances other than soil.	entailment
1174	The sale was made to pay Yukos' US$ 27.5 billion tax bill, Yuganskneftegaz was originally sold for US$9.4 billion to a little known company Baikalfinansgroup which was later bought by the Russian state-owned oil company Rosneft.	Rosneft belonged to the Russian State.	entailment
637	In the 1970s, she was one of the most popular female vocalists in France, and became well-known internationally. Anne Marie David, from Arles in the south of France, parlayed her initial success from playing Mary Magdalene in the French production of Jesus Christ Superstar into taking home the "grand prix" at the Eurovision Song Contest in 1973. Her winning song, "Tu te reconnaîtras" (You will recognize yourself), became a Europe-wide hit that spring.	Anne Marie David won the Eurovision Song Contest.	entailment
248	"Having for years enjoyed greater rights than other women in the Middle East, women in Iraq are now losing even their basic freedoms. The right to choose their clothes, the right to love or marry whom they want. Of course women suffered under Saddam. I fled his cruel regime. I personally witnessed much brutality, but the subjugation of women was never a goal of the Baath party."	Women in Iraq have lost their freedom.	entailment
1233	John Wilkes Booth assassinated Abraham Lincoln as he sat in the presidential box of Ford's Theater watching the light comedy, "Our American Cousin."	Lincoln was assassinated in the presidential box of Ford's Theater.	entailment
1674	In sub-Saharan Africa about one in every 30 people is infected with HIV.	30% of the people infected with HIV live in Africa.	not_entailment
448	The Fifth Golden Rooster and Hundred Flowers Festival, to be held in southeast city of Kunming from October 9 to 13, will feature award-giving ceremonies, film exhibitions, as well as business exchanges.	The Golden Palm has been awarded at the Cannes film Festival.	not_entailment
600	After graduating in 1977, Gallager chose to accept a full scholarship to play football for Temple University.	Gallager attended Temple University.	entailment
1914	Nigeria's Kano State and US drugs firm Pfizer have agreed to settle a multi-million dollar lawsuit out of court, lawyers for both sides say. Pfizer has been accused of killing 11 children and injuring 181 others when an antibiotic was tested on them during a meningitis epidemic in 1996. The company denies the claims, saying they were victims of the outbreak. The Kano State lawyer told the BBC compensation would be paid to victims, but figures could not yet be disclosed. Barrister Aliyu Umar said money would also be given to a local hospital.	Pfizer is accused of murdering 11 children.	entailment
404	Another French daily newspaper talks about PixVillage.	PixVillage is a French newspaper.	not_entailment
2337	Among Stellafane's most ardent partisans is David H. Levy, co-discoverer with Dr. Eugene Shoemaker of a comet named for the two that broke apart in 1994 as it was drawn toward Jupiter, creating fireworks visible from Earth.	The Shoemaker-Levy comet was discovered by Shoemaker, his wife, Carolyn, and an astronomer David H. Levy.	not_entailment
2291	Mayor Michael Bloomberg seemed ambivalent to the change, saying "I would like to see it stay the Freedom Tower, but it's their building, and they don't need me dumping on it. If they could rent the whole thing by changing the name, I guess they're going to do that, and they probably, from a responsible point of view, should. From a patriotic point of view, is it going to make any difference?".	The Freedom Tower belongs to Michael Bloomberg.	not_entailment
2157	González Márquez, Felipe is a Spanish political leader. After joining what was then the Spanish Socialist Workers' party, González became its secretary-general and revived it from the moribund position into which it had fallen under Franco.	Felipe González is the President of Spain.	not_entailment
1617	Scientists have made two major discoveries in the search for other Earth-like planets. British astronomers say they have discovered the smallest known Earth-like exoplanet orbiting a living star called Gliese 581 e and also discovered that a nearby planet called Gliese 581 d, discovered in 2007, is in the much sought after 'habitable zone'. Astronomers also believe there is a possibility that 581 d could have liquid oceans on its surface, calling the find "extraordinary."  "The Holy Grail of current exoplanet research is the detection of a rocky, Earth-like planet in the 'habitable zone'," said astrophysicist at Switzerland's Geneva University, Michel Mayor.  Astronomers say 581 e is 20.5 light years away from Earth and that it's roughly 1.9 times larger than Earth, making it the smallest exoplanet discovered to date. It was found using the High Accuracy Radial Velocity Planet Searcher (HARPS).	Michel Mayor is the discoverer of the High Accuracy Radial Velocity Planet Searcher.	not_entailment
1483	Local media reported on Tuesday that a gold mine collapsed in northwestern Tanzania on Sunday, killing at least twenty people. According to reports, the incident occurred at Geita region when the 100-metre-deep shaft the miners were working in collapsed after being flooded by heavy seasonal rains. Some media reports say that thirty people might have been killed by the accident.  "I know there is no hope of finding anybody alive," said Kelega Chacha, a miner who left the site soon before the mine's collapse. "We will just have to look for the bodies to give them a decent burial."	Kelega Chacha died in the Geita region.	not_entailment
2245	South African President Thabo Mbeki, the main mediator in Cote d'Ivoire's peace process, said, on Sunday, that Pretoria is heightening its intervention in the West African nation in order to pave the way for elections later this year.	Thabo Mbeki is a citizen of Cote d'Ivoire.	not_entailment
1655	A Russian Soyuz spacecraft docked with the International Space Station, after a two-day flight from the Baikonur Cosmodrome in Kazakhstan.	Soyuz spacecraft were built by Russia.	entailment
1678	If you have rheumatic heart disease, high blood pressure, or diabetes, or take digitalis drugs, vitamin E can be harmful.	Vitamin E can prevent heart disease.	not_entailment
1844	The new work went an extra step, suggesting that the connections that the stem cells form to help bridge the damaged spinal cord, are key to recovery.	The experiment, reported Monday, isn't the first to show that stem cells offer tantalizing hope for spinal cord injury.	not_entailment
1832	An Alzheimer's patient travelled 2,000 miles to commit suicide with the help of a doctor who built a device that gave her a lethal dose of chemicals.	The woman in the Kevorkian case injected lethal chemicals into her body.	not_entailment
124	Since the island also lacks wells, water has to be obtained from rain carefully collected in concrete cisterns.	The island gets water from collected rain.	entailment
2219	The mine would operate nonstop seven days a week and use tons of cyanide each day to leach the gold from crushed ore.	A weak cyanide solution is poured over it to pull the gold from the rock.	not_entailment
2440	Although the birth rate is the highest it has been for five years, there were still more deaths in Scotland than births last year.	Scotland is the European country with the highest birth rate.	not_entailment
2239	Bukowski attracted the attention of John Martin who founded Black Sparrow Press in 1965 specifically to publish him.	John Martin is the founder of Black Sparrow Press.	entailment
481	The Arabic-language television network Al-Jazeera reports it has received a statement and a videotape from militants.	Al-Jazeera is an Arabic-language television network.	entailment
175	"I will not seek your votes for a new mandate." With these words, the President of France, Jacques Chirac (74) announced during a radio and television broadcast at 20:00 UTC that it's time for him to serve his country in a different way. The announcement was widely speculated about and did not come as a surprise. The official announcement gives the candidate from the majority party UMP, Nicolas Sarkozy, more freedom during the next six weeks that remain before the Presidential elections in France. Although Sarkozy is from the same party as Chirac and hopes to receive an endorsement from him, the President has not yet expressed his support for a particular candidate to succeed him, and he did not refer to Sarkozy during any moment of his speech.	Chirac doesn't want to be re-elected.	entailment
1610	Arizona offers better mental-health care than most other states but still struggles to deliver services to people who are suffering, according to a national report card released Wednesday. The National Alliance on Mental Illness graded Arizona a C, marking a modest improvement over the D grade the state received three years ago, the last time the study was conducted. Arizona was one of 18 states to get a C. The national average was a D. Six states received a B; none received an A.	Arizona and 17 other states received a C in the field of mental-care health.	entailment
1736	Anastasia, in the village of Nagutskoye, had a neighbor who gave birth in 1914 to Yuri Andropov: KGB chief and persecutor of Anastasia's nephew, Alexander Solzhenitsyn.	Alexander Solzhenitsyn's wife's name is Anastasia.	not_entailment
11	November 9, 1989 , the day the Berlin Wall fell and the world changed forever . Not even the most astute saw it coming . As Hungary's foreign minister in the late summer of 1989 , Gyula Horn gave the order to let visiting East Germans use his country to do a 400-mile end run around the Berlin Wall , a move now seen as the beginning of the end for hard-line communism in Europe .	The Berlin Wall was torn down in 1989.	entailment
584	Edward VIII shocked the world in 1936 when he gave up his throne to marry an American divorcee, Wallis Simpson.	King Edward VIII abdictated in 1936.	entailment
517	Qin Shi Huang, personal name Zheng, was king of the Chinese State of Qin from 247 BCE to 221 BCE, and then the first emperor of a unified China from 221 BCE to 210 BCE, ruling under the name First Emperor.	Qin Shi Huang was the first China Emperor.	entailment
654	On Wednesday night people in the Bahçelievler district of Yenibosna in Istanbul, Turkey, claimed that they had seen a UFO flying in the sky, the Turkish newspaper Sabah reports. They said that the UFO was glowing with white lights and that it revolved around itself. Istanbul has had previous UFO incidents in the past, and in 2002, the Istanbul UFO Museum was opened to the public.	A UFO might have been seen in Turkey.	entailment
2152	Sweden-based airline Scandinavian Airlines System (SAS) said it will reduce payrolls by 8,600 jobs as part of its "Core SAS" restructuring plan. The airline will cut 3,000 staff directly and eliminate 5,600 by divesting business ventures, reducing the workforce by 40% to 14,000. The restructuring  comes after SAS posted losses of 6.32 billion Swedish krona in 2008. The company is also to sell airBaltic and Spanair and its stakes in Air Greenland,  BMI, Estonian Air, Skyways Express, Spirit Airlines and Trust. Spanair is to be sold for €1. The company intends to switch to concentrating on its core  Nordic market.	European Airlines are cutting jobs.	entailment
1536	Last week, saw the fall of the Dutch right wing coalition government, made up of the Christian-democrats (CDA) led by Prime Minister Jan Peter Balkenende, the right wing liberal party (VVD) and the so-called left-liberal D66.	Three parties form a Dutch coalition government.	entailment
1921	Meanwhile, the inquiries spearheaded by Milan magistrates Antonio di Pietro and Gherardo Colombo began to focus on Italy's private and public business sectors.	Antonio di Pietro is a magistrate.	entailment
1093	In June 2004, top Russian oil producer Lukoil signed a $1 billion 35-year production-sharing agreement to develop Uzbek natural gas deposits.	Lukoil earned $1 billion in 2004.	not_entailment
