index	sentence1	sentence2	label
1179	The development application for a McDonald's restaurant at Minyama, on Queensland's Sunshine Coast in Australia, has been rejected by the Sunshine Coast Regional Council. "We knocked back a Hungry Jack's on Nicklin Way because of the nuisance code," said divisional councilor Chris Thompson. "We already have a 24-hour McDonald's at Mooloolaba, only one kilometre away, and there are already [anti-social] issues at that site."	Sunshine Coast Regional Council accepted McDonald's Australia development plans.	not_entailment
1903	Swift was offered and accepted the post of secretary and chaplain to the Earl of Berkeley, one of the Lords Justices, but when he reached Ireland he found that the secretaryship had been given to another.	Swift worked for the Earl of Berkeley.	not_entailment
2227	According to the Spanish daily, this type of bacterium is prevalent in hospitals throughout the world, but the incidence of infection in Madrid hospitals is lower than the Spanish average. The head of the Neonatal Unit at 12 de Octubre Hospital, Carmen Pay's, explained that the bacterium is very adaptable "and keeps on learning". The father of the dead baby, an Ecuadorian named Angel Marcelo, was quoted as saying that the progress of the baby had at first been "tremendous", and that he had even been taken off the respirator, but that a few days later he began to cough up blood, dying soon afterwards.	The Spanish daily is set in Madrid.	not_entailment
893	As much as 200 mm of rain have been recorded in portions of British Columbia , on the west coast of Canada since Monday.	British Columbia is located in Canada.	entailment
1685	American Airlines began laying off hundreds of flight attendants on Tuesday, after a federal judge turned aside a union's bid to block the job losses.	American Airlines will recall hundreds of flight attendants.	entailment
610	Strong competition in industries such as shipping has resulted in waves of investment in labour saving technology such as steel and aluminium cutting tools, processing machine and welding robots.	The automotive industry has seen advances in robotic metal cutting.	not_entailment
290	The U.S. handed power on June 30 to Iraq's interim government chosen by the United Nations and Paul Bremer, former governor of Iraq.	The U.S. chose Paul Bremer as new governor of Iraq.	not_entailment
37	Mohandas Karamchand Gandhi never received the Nobel Peace Prize, though he was nominated for it five times between 1937 and 1948.	Mohandas received the Nobel Prize in 1989.	not_entailment
474	In the last few days of the war, Mussolini and his mistress, Clara Petacci, tried to escape to Switzerland.	Mussolini's mistress was Clara Petacci.	entailment
1203	Local Law enforcement officials acting on behalf of the European Commission raided offices of Intel and several computer makers this morning, a spokesman for the EU said. He did not specify which countries or which other firms were involved. However, a spokesman for Intel Germany, Hans-Jürgen Werner, said that Intel's offices in Munich and Swindon were among those searched. It emerged on Wednesday 13th, that raids also took place at Intel's facility in County Kildare, Ireland in relation to the firms anti-competitive business practices. Intel employs over 5,000 people at its Irish manufacturing facility.	Intel Germany engaged Hans-Jürgen Werner as spokesman.	entailment
1634	A total of 79 per cent of people questioned in a survey agreed that adults suffering incurable illness should receive 'medical help to a peaceful death'.	In a poll of the American public, most people approved laws that allow life-support to be removed from a terminally ill patient.	not_entailment
850	Public health and animal health officials from the Departments of Health and Community Services and Forest Resources and Agrifoods today confirmed a rabies case involving a red fox in western Newfoundland.	A case of rabies was confirmed.	entailment
1951	According to Naeye, the newfangled telescopes will be able to peer so far back in space and, thus, time that they "will see the first galaxies assembling a few hundred million years after the Big Bang."	The Big Bang is the primordial explosion from which the universe was created.	not_entailment
633	"If we could put a man on the moon within decades back in the 1960s, I think we can eliminate TB if we develop the will to do so" said O'Brien, who called for a significant investment for the research, particularly the large field trials necessary to demonstrate efficacy.	The moon was first touched by mankind in 1969.	not_entailment
144	The Counts of Holland and Geldern, between whose territories the lands of the Bishops of Utrecht lay, also sought to acquire influence over the filling of the episcopal see. This often led to disputes and consequently the Holy See frequently interfered in the election.	The Counts of Holland supported the Holy See.	not_entailment
1063	There is growing evidence that magnesium may be an important factor in the qualitative changes of the bone matrix that determine bone fragility.	Dietary intake of magnesium prevents osteoporosis.	not_entailment
2360	United States Senator Ted Stevens of Alaska was convicted Monday on seven counts of failing to report gifts. Stevens, a senior United States Senator from Alaska and the longest serving Republican in the Senate, had been accused of not reporting tens of thousands of dollars worth of gifts from the VECO Corporation including free house remodeling. The jury in the District of Columbia found Stevens guilty on all seven counts.	Ted Stevens is the longest serving Republican in the US Senate.	entailment
2173	At a low-key ceremony, Albanian and British officials agreed to bury all outstanding differences caused by the 'Corfu Channel incident'.	The dispute between Albania and the UK about the Corfu incident lasted a long time.	not_entailment
1256	US Catholic bishops are all but unanimous in believing that Cardinal Law must leave Boston for the good of the church.	Cardinal Law returns from Rome with plans to stay in Boston.	not_entailment
382	If the ruling is that these trade-secrets were stolen goods, I'd be willing to bet that these three guys could refuse to answer any questions, by invoking the 5th Amendment, since they would incriminate themselves by saying anything.	Trade secrets were stolen.	not_entailment
2478	Wal-Mart has received a lot of negative publicity recently, including allegations that it used illegal workers and made employees work without pay during lunch breaks, as well as complaints that it generally underpays employees.	Wal-Mart complains about negative publicity.	not_entailment
1301	U.S. Secretary of State Condoleezza Rice said Thursday that North Korea should return to nuclear disarmament talks and avoid a path toward further international isolation.	North Korea has a stockpile of nuclear weapons.	not_entailment
1489	The Hercules transporter plane which flew straight here from the first round of the trip in Pakistan, touched down and it was just a brisk 100m stroll to the handshakes.	The Hercules transporter plane made a flight to Pakistan.	entailment
938	Co-producing the film is Happy Madison, the company owned by Sandler, who has been a compatriot of Schneider's since they met early in their careers, as mutually struggling stand-up comedians in Los Angeles.	Happy Madison works for the company owned by Sandler.	not_entailment
2233	Two bombs planted near an Islamic school in Pakistan killed eight people and injured 42 others yesterday in the latest outbreak of violence gripping the southern port of Karachi.	42 people killed in Karachi bomb attack.	not_entailment
370	Vera Beers, of Olivet, recently was named employee of the month at Standard Printing in Marshall.	Vera Beers works for Olivet.	not_entailment
1123	Billy Werber, third baseman in Major League Baseball, has died at the age of 100. Werber died of natural causes on Thursday, January 22, 2009 at an assisted living center in Charlotte, North Carolina. He was moved there after his health deteriorated a month ago. His son said that when admitted, Werber refused to eat solid foods and would only drink liquids. "He just refused to eat and that was his plan," Bill Werber Jr. told the Associated Press. He added that his father was "sharp up until four weeks ago".	Werber died in North Carolina at the age of 100.	entailment
1955	Please note that Arabic is the language of Quran so it's better to learn it to understand clearly all the miracles in Quran.	Arabic is the language of the Quran.	entailment
281	Vatican spokesman Joaquin Navarro-Valls announced that Pope John Paul was still in serious condition, but he was not in a coma.	Joaquin Navarro-Valls is the Vatican Spokesman.	entailment
126	The industrial espionage case involving GM and VW began with the hiring of Jos Ignacio Lopez, an employee of GM subsidiary Adam Opel, by VW as production director.	There was an industrial espionage case involving GM and VW.	entailment
433	The British government has indicated its readiness to allow Argentine companies to take part in the development of oilfields in the Falkland islands' territorial waters- provided they acknowledge that any oil extracted belongs to Britain.	The British indicated readiness to allow Argentine companies to take part in the development of oilfields.	entailment
400	Forty-five percent of the bills examined were bipartisan, and 85 percent of the reviewed bills had Republican lead sponsors. 8221; Small business owners are disappointed by the Republican track record, particularly the lack of productivity in the Senate.	The Senate is the least productive.	not_entailment
1516	The cost for some 30 million sheets of paper used each year by Cal State Long Beach colleges and departments went up Wednesday for the first time in four years.	The cost of paper is rising.	entailment
475	Also, in a landmark deal with Disney, iTunes is now offering current and past episodes from two of the most popular shows on television.	I-tunes does business with Disney.	entailment
297	The magnitude 7 earthquake that occurred today on the Hayward fault (a part of the San Andreas fault system, along the densely populated eastern side of San Francisco bay) caused hundreds of deaths and almost $100 billion of damage.	There was a magnitude 7 earthquake on the Hayward fault.	entailment
2299	Canadian MP Belinda Stronach, 40, has reportedly cheated with Canadian hockey star Tie Domi. Domi and his wife were in court today getting divorced and both have now reached a temporary settlement in their divorce proceedings, less than an hour before the case was to be heard before Toronto's Superior Court. Stronach is refusing to comment on the divorce or say if she "wrecked" Domi's marriage. "If it wasn't for my husband's affair with Belinda, we wouldn't be getting a divorce," Leanne told the Toronto Star in an interview last night. Domi's wife claimed that the former Toronto Maple Leaf player told her if she did not hire a lawyer he would give her $1 million in cash and a $1.5-million house if she kept quiet about his affair with Stronach. If she contacted a lawyer, however, she "would get nothing."	Leanne was married to Tie Domi.	entailment
2070	Preliminary tests identified the source of the outbreak as the highly contagious norovirus, which had struck several guests just before they boarded the cruise Nov. 3 in Rome, Carnival officials said.	Norovirus is the source of the outbreak on the ship.	entailment
1704	Canada rig count at 148, down 46 compared to last week's and down 27 compared to last year's.	Last year, the tally was 148	not_entailment
1475	Dr Wood led a courageous and committed team in the fight to save 28 patients suffering from between two and 92 per cent body burns, deadly infections and delayed shock. As well as receiving much praise from both her own patients and the media, she also attracted controversy among other burns surgeons due to the fact that spray-on skin had not yet been subjected to clinical trials.	Burns surgeons approve Dr Wood's spray-on skin.	not_entailment
4	A man is due in court later charged with the murder 26 years ago of a teenager whose case was the first to be featured on BBC One's Crimewatch. Colette Aram, 16, was walking to her boyfriend's house in Keyworth, Nottinghamshire, on 30 October 1983 when she disappeared. Her body was later found in a field close to her home. Paul Stewart Hutchinson, 50, has been charged with murder and is due before Nottingham magistrates later.	Paul Stewart Hutchinson is accused of having stabbed a girl.	not_entailment
1696	Meanwhile, in an exclusive interview with a TIME journalist, the first one-on-one session given to a Western print publication since his election as president of Iran earlier this year, Ahmadinejad attacked the "threat" to bring the issue of Iran's nuclear activity to the UN Security Council by the US, France, Britain and Germany.	Ahmadinejad attacked the UN Security Council.	not_entailment
2202	Although most Palestinians crossed into Egypt in order to shop and see relatives, Palestinian officials say that the recent border chaos enabled smugglers to bring drugs and weapons into Gaza.	Egyptian and Palestinian border guards failed repeatedly in efforts to end the chaos and to close the border.	not_entailment
2032	Al-Jazeera broadcasts to millions of Arab viewers from headquarters in Doha, Qatar.	Al-Jazeera has occasionally run into problems with authorities in other Arab countries.	not_entailment
1606	While local cab drivers had compliments, not everyone appreciated the company. The Chicago Cubs decided to cancel their booking after hearing about the con, and J.J. Hardy of the Milwaukee Brewers reported being kept up by fans on Wednesday night. The Brewers lost their game the following day. The convention closed with next year's date ―June 26-29 ―along with the announcement of a guest: Disney animator Floyd Norman. The event's theme will be "It's a Jungle Out There!".	J.J. Hardy has a contract with the Milwaukee Brewers.	entailment
885	Facebook was founded by Mark Zuckerberg, an individual web developer looking to make friends at Harvard University. Although Facebook has been sued by ConnectU.com for allegedly copying its concept and data, Facebook is actually the first worldwide college network on the Internet. As one of the most popular college websites, Facebook is notable for its lack of prominent advertising. It quickly accumulated $50,000 in debt in 2004, and it took nearly a year for it to begin turning a profit, so clearly it needed a large amount of venture capital.	Mark Zuckerberg invented Facebook.	entailment
443	Lastly, the author uses the precedent of marijuana legalization in other countries as evidence that legalization does not solve any social problems, but instead creates them.	Drug legalization has benefits.	not_entailment
101	A school dinner lady is claiming damages from a teenager who seriously injured her while playing tag with a friend. If she is successful, pupils could become legally liable for boisterous behaviour that results in accidents.   Michelle Orchard, 42, is seeking hundreds of thousands of pounds in damages from Sebastian Lee, who was 13 when he ran into her during the lunch break at Corfe Hills School, Corfe Mullen, Dorset, in January 2004.   Sebastian, with his friend in pursuit, tumbled into her backwards, striking her in the face with the back of his head, senior judges at the Court of Appeal heard yesterday. Mrs Orchard's nose was broken and her teeth were damaged. Her lawyers say that she also suffered serious brain damage, leading to partial paralysis and balance problems. She has been unable to work since the accident.	Michelle Orchard is claiming hundreds of thousands of pounds from Sebastian Lee because she wants a new nose.	not_entailment
2453	Muslims make up some 3.2 million of Germany's 82 million people, and Turks represent two thirds of the minority.	82 million people live in Germany.	entailment
1200	Then the most important part of the day begins as Muslims go to the mosque, their special place of worship.	Muslims pray at the mosque.	entailment
609	Getty also starred in several movies after the show including Mask where she played the mother of singer and song writer Cher and Stop! Or My Mom Will Shoot where she also played the mother of actor Sylvester Stallone. She also starred in the television show spin off of The Golden Girls titled The Golden Palace and made a two episode appearance on another spin off called Empty Nest. Getty was born in New York City on July 25, 1923, passing away just three days before her 85th birthday.	Stallone played Getty's father.	not_entailment
949	In 1983 Turkish Cypriots proclaimed a separate state, naming it the Turkish Republic of Northern Cyprus (TRNC). Peace talks have been held sporadically, but Cyprus remains divided.	Cyprus was divided into two parts in 1983.	entailment
285	The new moon, which is only about 25 miles in diameter, was actually photographed 13 years ago by the Voyager 2.	The moon Titan has a diameter of 5100 kilometers.	not_entailment
1376	On his oak mantelpiece are a drinking bowl from Lake Turkana and an East African gourd, both of which he bought in Nairobi where he went in the fall of 1993 to visit Kitum Cave, the suspected host site for the Marburg virus, which is closely related to Ebola.	The Ebola virus has been found in Zaire.	not_entailment
1899	Don Brash leader of the New Zealand National Party said that the White Crusaders of the Racial Holy War are "a small, fascist underbelly, hell-bent on causing division and destroying New Zealand's egalitarian ethos."	Don Brash is the leader of the New Zealand National Party.	entailment
464	In a sharply-worded internal World Bank report (leaked to The New York Times) the Bank has criticized its own decision to approve a controversial $40 million anti-poverty plan.	The World Bank is criticized for its policies.	entailment
2185	Mercedes-Benz USA (MBUSA), headquartered in Montvale, New Jersey, is responsible for the sales, marketing and service of all Mercedes-Benz and Maybach products in the United States.	MBUSA is based in New Yersey.	entailment
734	United States astronaut Sunita Williams, currently on board the International Space Station, has today broken the record for the longest unbroken space flight by a woman. At 5:47 a.m. UTC Williams passed the previous record of 188 days and four hours set by Shannon Lucid in 1996. This is not the only record Williams has broken. Earlier this year she set a record of 29 hours and 17 minutes for time spent by a woman on space walks.	Anousheh Ansari paid to go in space.	not_entailment
1873	Saudi Arabia was boosting its production.	Saudi Arabia was boosting its own production.	entailment
1865	The eighth Paralympic Winter Games are set to take place in Salt Lake City, Utah. For only the second time the Games are being held outside Europe, following the 1998 Winter Paralympics in Nagano, Japan. And for the first time ever, there is just one combined organising committee for both the Winter Olympic and Paralympic Games. Just 10 days after the Winter Olympics concludes, the Paralympics will begin in the same venue.	The 2002 Olympic Winter games took place in Salt Lake.	not_entailment
2075	The two suspects belong to the 30th Street gang, which became embroiled in one of the most notorious recent crimes in Mexico: a shootout at the Guadalajara airport in May, 1993, that killed Cardinal Juan Jesus Posadas Ocampo and six others.	Cardinal Juan Jesus Posadas Ocampo died in 1993.	entailment
1388	The Sears Tower in Chicago, finished in 1974, has 110 stories and is 1,450 feet tall.	The Sears Tower has 110 stories.	entailment
902	Environment Minister David Anderson today announced his decision regarding the environmental assessment of the proposed Toulnustouc Hydroelectric Project.	A hydroelectric project is proposed or is under construction.	entailment
1383	US Steel could even have a technical advantage over Nucor since one new method of steel making it is considering, thin strip casting, may produce higher quality steel than the Nucor thin slab technique.	US Steel may invest in strip casting.	entailment
2428	And this is a town that everybody agrees, law enforcement, Border Patrol, residents on both sides, is a staging area of illegal drugs and illegal aliens.	Steps are being taken to stop the smuggling of aliens.	not_entailment
1112	There are more than 4,000 street children in the capital city of Ulan Bator.	The population of Ulan Bator is 4,000.	not_entailment
1683	Analysts expected the company to earn $1.42 a share on revenue of $3.82 billion, according to a Thomson Financial survey.	Analysts had expected revenue of $3.8 billion, according to Reuters estimates.	not_entailment
2316	The PMDB is also the party led by Senator Jader Barbalho, the recently elected Senate President heaped with serious corruption charges.	Jader Barbalho is the Senate President.	entailment
504	The agreement also stated a period of transition for the Baltic countries to last until December 31, 1999. This was a much shorter period than that which was assigned to the Central European countries (their transition periods were declared to be 10 years). Estonia declined the transition period, Latvia received a transition period of four years, and Lithuania received a transition period of six years.	Baltic Countries join the EU.	not_entailment
86	On April 28 1945, at the Piazzale Loreto in Milan, Benito Mussolini and his mistress Clara Petacci were shot and hanged in a spectacle that was photographed repeatedly.	Mussolini's mistress was Clara Petacci.	entailment
2098	Prices hit their lowest levels in five weeks Friday, with light, sweet crude for October closing at $63 on the New York Mercantile Exchange, the lowest settlement price since Aug. 5.	Crude oil costs $63.	entailment
894	A zoo spokesman said the endangered lizards, believed to number less than 4,000 in the wild, all hatched in the last two weeks and 14 eggs are still under observation. He calls it the Komodo's most successful breeding year ever at the zoo. The giant reptiles first arrived in the early 1980s, but the new births brought their total from 34 to 66. The Komodo dragon can grow up to 10 feet long and weigh as much as 150 pounds. They have a bite that can be deadly and can only be found in the wild on the eastern Indonesian islands of Komodo, Padar and Rinca.	A Komodo dragon can be 10 feet long.	entailment
221	Typhoon Xangsane was downgraded to a tropical storm Sunday as it moved inland from the central Vietnam coast, where it killed two people, injured at least 80 others and damaged hundreds of homes, officials and state-controlled media reported.	A typhoon batters the Philippines.	not_entailment
670	As leaders gather in Argentina ahead of this weekends regional talks, Hugo Chávez, Venezuela's populist president is using an energy windfall to win friends and promote his vision of 21st-century socialism.	Hugo Chávez acts as Venezuela's president.	entailment
781	Oracle had fought to keep the forms from being released	Oracle released a confidential document	not_entailment
744	The answer to the number one question, "how many continents are there?", is seven.	There are seven continents.	entailment
197	In 1596 the Polish king decided to move the capital from Krakow to Warsaw, making Warsaw the most important city in Poland.	In 1611 the king and his court finally moved from Krakow ( Cracow ) to Warsaw, making it the capital of the Polish state.	not_entailment
1897	Well, the yolk is on us, the bacteria are winning, and at a record pace.	Bacteria is winning the war against antibiotics.	not_entailment
708	Iran will hold the first runoff presidential election in its history, between President Akbar Hashemi Rafsanjani and Tehran's hard-line mayor, election officials said Saturday.	Hashemi Rafsanjani will face Tehran's hard-line mayor in Iran's first runoff presidential election ever, officials said Saturday.	entailment
2199	Two weeks ago, China became the first nation to operate a maglev railway commercially, when officials inaugurated a 30-kilometer-long line between downtown Shanghai and the city's airport.	Maglev is commercially used.	entailment
756	Anglo/Dutch Royal Dutch Shell, Total, of France, and Spain's Repsol were all named as examples of established oil companies involved in the oil-for-food programme before surcharges began in 2001.	Total participated in the oil-for-food programme.	entailment
1128	Mr Fitzgerald revealed he was one of several top officials who told Mr Libby in June 2003 that Valerie Plame, wife of the former ambassador Joseph Wilson, worked for the CIA.	Joseph Wilson worked for CIA.	not_entailment
1625	Historians estimate that 800,000 Chechens were stuffed into rail cars and deported to Kazakhstan and Siberia, and 240,000 of them died en route.	Stalin deported 800,000 Chechens.	not_entailment
2410	United States naval forces evacuated U.S. civilians during hostilities between Turkish and Greek Cypriot forces.	U.S. Military evacuated U.S. citizens.	entailment
284	BTA said those injured in the fire at Borovets, 22 miles southeast of Sofia, were from Britain, the Soviet Union, West Germany, the Netherlands, Greece and Denmark.	Sofia is located in Britain.	not_entailment
115	95% of the Gulf of Mexico's oil output is now out of service following Katrina, together with more than 83% of natural gas production.	Crude oil prices have hit fresh highs as fears grow over the extent of damage, done by Hurricane Katrina, to oil output in the Gulf of Mexico.	not_entailment
1072	A British Dynamite Company (Ardeer, Scotland, UK) is founded. In 1877 the company name was changed to Nobel's Explosives Company.	Alfred Nobel is the inventor of dynamite.	not_entailment
