id	qid1	qid2	question1	question2	is_duplicate
356794	271312	118619	What are the studies to become a pilot?	How do I study to become a pilot?	1
195739	195740	200475	What are the health benefits of eating baked beans for breakfast?	What are the health benefits of eating beans?	0
32703	59133	60170	What are the pros and cons of GST bill as per a common man?	What is GST? What are the pros and cons of GST?	1
80478	136833	136834	Why did the Indian stock market (Nifty &Sensex) crash by over 1.8% on Monday 21 November 2016?	Why is the Indian stock market falling since PM Modi's demonetisation move?	0
267516	312331	384899	What are the best medieval TV shows?	What are the best scientific TV shows?	0
107289	6897	176546	What was there before the Universe?	What existed before the creation of our universe?	1
115167	187852	187853	What are some study hacks every student should know?	What are some best study hacks for school?	1
280239	399790	399791	How do I learn digital painting for cartoon character by photoshop?	How do I learn digital painting for cartoon character?	0
94427	157702	157703	Why do guys wait days to text girls after a date? Do they really want to talk and hold back or do they not care so much and focus on work?	After a handful of dates, guy doesn't text much, waits till night to text and takes hours to respond. He does continue to ask me out. Is he into me?	0
43013	77428	77429	Online transfer on holidays?	I am an 18 year old girl living in Jeddah and im looking for jobs for the summer vacation that would pay around 3000 SR per month?	0
179154	119349	34601	What trivia (and/or little-known facts) do you find interesting about Michigan?	What trivia (and/or little-known facts) do you find interesting about Washington?	0
33160	57121	60957	What is an easy way to learn Java?	What is the easiest way to learn java programming?	1
376423	507564	507565	What is it like to study criminology and security studies?	What is it like to study criminology?	0
295178	417181	417182	What's new with iOS 9?	What are the features added in iOS 9?	1
52956	11397	30022	How can I improve in English?	How can I improve my communication skills in English?	1
384908	516995	440314	Why does FaceTime keep saying reconnecting? How can I fix this?	"What does it mean when FaceTime says someone is ""not available"" for FaceTime?"	0
239589	351202	223507	What are the best and efficient ear plugs for blocking the loud noise in India?	Which is the best in-ear headphone with mic in India under 1k?	0
109227	179295	179296	How can I make one crore in 15years if I invested 10k per month?	How can I make one crore if I invested 10k per month in 15years?	1
350738	26854	161390	What is the best way to flirt with girls?	How a boy flirt with girls?	1
252055	244481	366289	What are the perks of being a Native American?	What do Native Americans want to be called by others?	0
157894	246775	246776	What is Palm Pre software?	What is Palm Pre?	0
273348	391806	391807	What are the best places to visit in Kathmandu?	What are the best places to have momos in Kathmandu?	0
78192	120015	133376	What are the key points do I look for in the companies before investing in them?	What are the factors to look in the company accounts before investing in their shares?	1
312307	267320	222674	How do people who suddenly become rich handle friends and family who borrow/ask for money?	How do rich/successful people deal with friends and family asking for money?	1
258465	374045	374046	What are the most commonly used casserole dish sizes?	Which is the most delicious Indian Veg Dish you have eaten?	0
5991	11754	11755	What was the Industrial Revolution?	What happened in the Industrial Revolution?	1
379078	167856	510581	Is it worth hiring a personal trainer?	Is becoming a personal trainer worth it?	0
384660	249062	103609	What are biotic and abiotic components?	How do biotic and abiotic factors compare and contrast?	1
236365	59030	347257	What are some good one-day picnic spots around 100-125 kms from Ahmedabad?	What are the best picnic spots in Bangalore?	0
191894	291378	291379	Challenge: How to write a Song in Spanish with little or no Spanish knowledge ? What approach should you take, if you have yourself this challenge?	What are some good subjects to teach yourself?	0
241983	15953	4367	What do you think about Modi government banning 500 & 1000 currency note from 9th November?	What do you think about banning 500 and 1000 rupee notes in India?	1
227398	174969	336234	What are the techniques of ASO in 2016?	Which are the techniques that helps to do ASO?	1
236187	19396	4367	Why does 500 and 1000 Rs notes banned by GOI and new notes of 500 and 2000 are issued?	What do you think about banning 500 and 1000 rupee notes in India?	1
277987	35308	73769	What I can do to last longer during sex?	What should I do to last longer in bed?	1
333783	460910	460911	Are you honest to yourself?	Are you always honest with yourself?	1
87735	147708	147709	How do I write an excellent history essay?	How does one write a good history essay?	1
261790	175499	377990	What is important in life?	Is there anything important in life at all?	1
199298	12173	109023	Do you ever thought of doing suicide?	Have you ever thought about committing suicide?	1
230156	339620	339621	What does human existence mean?	What is the meaning of human existence?	1
8291	16170	16171	Which is best university that offers a distant learning program for a MSc in Mathematics?	Which university offers a MSc in mathematics with a distance learning mode in India?	1
46387	82983	82984	What does it mean if a material is ductile but not malleable?	Would it be true if I say all malleable materials are ductile, but all ductile materials may not be malleable?	1
295094	19621	54749	Why do some people ask questions on Quora that could easily be answered by using a search engine?	Why do people ask questions on Quora that could simply be googled?	1
363837	193292	112665	Where can I get very reliable furniture removal services in Central Coast?	Where can I get most reliable moving services in Central Coast?	1
63054	109791	10495	How does your height increase?	How do I increase my height after 22?	1
43980	27773	5894	Is it likely to get pregnant during day 3 of my period with unprotected sex?	Can you get pregnant one day before ovulation?	1
133559	213635	213636	What is spandrel slab?	What is a spandrel slab?	1
13924	2374	17854	Why do so may people ask questions on Quora that can easily be found by a simple Google searh?	Why do people bother to ask questions on Quora they could just google to get the answer?	1
214506	320108	320109	What is the importance of conserving natural resources?	What is the necessity of conservation of natural resources?	1
327379	28873	17729	What was the best day of your life so far?	Can you share best day of your life?	1
303361	15413	13690	As a third year btech student what should I do to start preparing for ias exam?	If I start preparing for IAS exam 2016 now, how can I achieve it?	1
156055	25032	16524	Do new 2000 INR really have a NGC (Nano GPS Chip), or is it just a rumour?	Is it true that the new 2000 rupees notes have a GPS chips?	1
392864	120150	5430	Will India end up having a Muslim majority in the future? What will be the social, economical and political consequences if that happens?	Can India become a Muslim majority state in near future?	1
255311	4475	164702	"Why are some questions marked as ""needing improvement"" when clearly they do not need improving?"	"All of my questions are marked ""needs improvement."" Why?"	1
380060	296949	463937	If elected, how will President Hillary Clinton work with Congress to ensure that her nomination for a new Supreme Court Justice is considered?	How will Hillary get her Supreme Court judges through congress?	1
135233	135181	216012	How can I flirt with girls?	How do you flirt when you pass nearby a girl?	1
199966	301590	301591	What can I do about my family being homophobic?	What do I do about my family being homophobic?	1
274839	252993	393523	What would you do if you knew you could not fail?	What would you do if you cannot fail?	1
189725	288563	82812	When Darth Vader isn't out killing Jedi or squashing rebellions what does he do with his free time?	What does Darth Vader do in his free time?	1
169133	33005	182206	Aside from screen size, what is different between the iPhone 6s and 6s Plus?	What is the difference between iPhone 6s and iPhone 6s Plus?	1
273031	32125	19720	How long does crystal meth stay in your system and how can I dilute it?	How long does crystal meth stay in your system?	1
298544	138476	421055	How Do I get over my anger towards people who abused me?	How do I control my anger towards the people I hate?	1
132275	54750	19756	How do I become mentally strong?	What is a way to become mentally stable and strong?	1
103981	171747	171748	How effective are Facebook ads in generating actual sales?	How effective is Facebook ads?	1
123278	199354	167736	How do you achieve your goal?	How can we achieve our goals?	1
401142	355441	231125	Where is the best place to get online SAP HANA training?	What are the best SAP HANA online training programs?	1
258911	374593	330286	What is the best ecommerce platform for apparel?	Why Magento is the best e-commerce platform?	0
326530	452848	452849	What kind of people do ENFPs hate?	How do people who have a ENFP personality fit in a startup environment?	0
208443	312436	312437	What are your best strategies for researching?	What is a good strategy?	0
318085	443378	443379	What are things that Aristotle taught to Alexander before invading India?	Can Germany invade India?	0
87143	146811	146812	Should I talk to this guy I like?	How should I talk to the girl I like?	0
56922	100121	100122	I've been playing trumpet for 8 years and it’s just not as fun as it used to be, what should I do?	Can I be a pro trumpet player in just 3 months?	0
302814	276738	425845	What IDE should I choose between Netbeans or Eclipse for Java programming if I am a beginner?	Which is better, Eclipse or Netbeans? Why?	0
354822	483979	18338	If some random person adds you on Facebook, should you accept?	How do I find and add friends on Facebook?	0
304925	428260	101152	What are some good books to read if I want to learn about the stock market?	Finance: Which is the best way to learn about stocks?	0
239095	243354	229062	What are some sentence examples using idiomatic expressions?	"What are some sentence examples using ""furthermore""?"	0
164556	255669	255670	What are some funny unknown and inspiring short stories?	What are some inspirational short stories?	0
151253	237863	237864	Can guinea pigs eat potatoes?	Can a guinea pig eat bananas?	0
153869	241426	241427	What is civil engineering?	What is a civil engineer?	0
400792	290317	534152	Which candidate handled the race question best during the first presidential debate?	In the spirit of the penalty fitting the crime how did the fine for copying a movie get to be so high?	0
384278	122305	487339	Which is the largest hedge fund in India?	What are the top hedge funds in India?	0
52287	92595	92596	Who invented Classical music?	How do you think of classical music?	0
351128	479944	90524	What universities does Cousins Properties recruit new grads from? What majors are they looking for?	What universities does Parkway Properties recruit new grads from? What majors are they looking for?	0
224012	331978	223005	Why do my ABS and brake lights come on?	Why do my ABS and brake lights come on in high speeds?	0
373843	90606	504700	What are the best beatboxing videos on YouTube?	What are the best drumming videos on YouTube?	0
274104	202148	261363	What is meaning of the terms appearing under ‘stats for nerds’ on YouTube?	"What does ""YouTube"" mean?"	0
249689	363378	363379	Are there any affordable accredited online courses available in the UK?	I have been banned from PayPal and cannot use eBay. Are there any other good examples of online auctions available to me in the UK?	0
216849	323077	323078	My daughter moved to California, but is driving my car that is owned and registered in a different state. Does it need to be registered in California?	How do I block my bank account from any deposits?	0
291667	413126	413127	What to do if your knee hurts when you walk?	Why do my knees hurt when I walk?	0
94448	157733	157734	Which is the best colour for iPhone 7plus?	Which is best colour in iPhone 6 Plus?	0
336829	464229	464230	What's the best way to get PR for a mobile app?	What is the best way to get a mobile app manufactured?	0
299739	422445	422446	"What is the difference between ""limit on"" and ""limit to""?"	What is the difference between a limit and the limit?	0
52575	93069	93070	What are the best frontline episodes?	What is the best episode of Detective Conan?	0
19832	37466	37467	What are some mind-blowing car accessories that exist that most people don't know about?	What are some mind-blowing phones accessories that exist that most people don't know about?	0
228467	337533	337534	Why do people believe in money?	Why don't people believe in you?	0
58084	101976	101977	How does one get into AFMC ? What is the procedure?	I am getting 612 marks in AIPMT re-test. I have Delhi quota. Should I go for MAMC or AFMC?	0
204776	189455	307773	What are ancient folk tales?	What are some interesting folk tales?	0
274491	393136	393137	What kinds of fish were consumed in the time of Jesus Christ? How were they cooked?	How many languages did Jesus Christ speak, and what were they?	0
381108	512789	512790	I have made a demand draft name in the capital letters instead of small letters will it be accepted?	Should I use capital letter after comma?	0
93890	156887	156888	If, when removing a bandaid, the bandaid sticks to the wound and starts to break the scab, is it better to leave the bandaid in place or just rip it off, removing the healthy scab?	How do I know if my wound is recovered? It is still pink after the scab came off.	0
397055	292947	530155	How do I shop for clothes online?	How do you shop for clothes?	0
