index	sentence1	sentence2	label
542	The World Health Organization moved Friday, to revise alarming predictions that a pandemic stemming from the bird flu virus ravaging parts of Asia, could kill as many as 150 million people.	The U.N. health agency has distanced itself from a top official's prediction that a global influenza pandemic could kill as many as 150 million people.	not_entailment
1641	Cosmonaut Valery Polyakov set the record for the longest continuous amount of time spent in space, a staggering 438 days, between 1994 and 1995. He orbited the Earth 7000 times, witnessing 7000 sunrises and 7000 sunsets.	7000 days is the record for the longest stay in space by a human.	not_entailment
1756	Deployment of workers to Iraq has been halted after the reported hostage-taking of a Filipino man by gunmen	A Filipino man has been kidnapped by gunmen.	entailment
362	Kieslowski later said that he abandoned documentary filmmaking due to two experiences: the censorship of Workers '71, which caused him to doubt whether truth could be told literally under an authoritarian regime, and an incident during the filming of Station (1981) in which some of his footage was nearly used as evidence in a criminal case. He decided that fiction not only allowed more artistic freedom, but could portray everyday life more truthfully.	Kieslowski is a director.	entailment
1477	World health officials warned yesterday that West Africa and Central Africa were on the verge of the worst polio outbreak in years, stemming from the refusal of a single state in northern Nigeria to vaccinate children against the disease.	African polio outbreak feared	entailment
1812	But according to Dr. Williams, other members of the panel have championed other ideas, for example, that planets should be larger than 2,000 kilometers (or about 1,250 miles) in diameter (Pluto is about 1,500 miles).	The diameter of Pluto measures 1,500 miles.	entailment
241	We are committed to the deployment of these technologies and are excited by the advances in remote sensing technology that are enabling us to extract more information from sensors in a cost-efficient and timely manner.	Ocean remote sensing is developed.	not_entailment
2350	The Arak plant, along with the discovery of a secret Iranian enrichment program in 2003, Tehran's refusal to cease uranium enrichment and findings by IAEA inspectors have increased suspicions about Iran s program.	Iran's program is under suspicion because of the findings by IAEA inspectors.	entailment
1207	Sultan Al-Shawi, a.k.a the Attorney, said during a funeral held for the victims, "They were all children of Iraq killed during the savage bombing."	The Attorney, said at the funeral, "They were all Iraqis killed during the brutal shelling."	entailment
1609	Anita Page, an MGM actress who appeared in films with Lon Chaney, Joan Crawford and Buster Keaton during the transition from silent movies to talkies, has died at the age of 98. Page died in her sleep early Saturday morning at her home in Los Angeles, said actor Randal Malone, her longtime friend. Page was born Anita Pomeres on August 4, 1910 in Flushing, New York. She was the leading lady to Lon Chaney, Buster Keaton, Robert Montgomery, and Clark Gable (among others), and during the early 1930s was one of Hollywood's busiest actresses, as well as being romantically involved with Gable. At the height of her popularity, she was receiving more fan mail than any other female star, with the exception of Greta Garbo, and received multiple marriage proposals from Italian Prime Minister Benito Mussolini in the mail.	Clark Gable dated Anita Page.	entailment
1279	The Bulls agreed to trade center, Eddy Curry, to the New York Knicks on Monday.	Eddy Curry was acquired by the Bulls.	not_entailment
1335	Norwegian police released one of three people arrested when Edvard Munch's painting 'The Scream', stolen from the National Gallery in Oslo, was found.	Norwegian police arrested three people for the theft of Munch's painting, 'The Scream'.	entailment
944	ISLAMABAD, Pakistan — The uneasy truce between the Pakistani government and Taliban militants in the Swat Valley appeared increasingly fragile on Monday as government forces attacked militants in a neighboring district for a second day, causing the main negotiator for the Taliban to break off talks. Maulana Sufi Muhammad, the pro-Taliban cleric who has been negotiating peace talks between the government and the Taliban in Swat, halted talks on Monday to protest the military operation in the Lower Dir district west of Swat, his spokesman said.	Maulana Sufi Muhammad is the chief of Tehrik Nifaz Shariat-e-Muhammadi.	not_entailment
494	NPF said that young people displaying onset symptoms of Parkinson's disease have special needs, because they often have children to raise, jobs to keep and other issues to address that are different than those patients in retirement years.	The symptoms of Parkinson's disease are: tremor, rigidity (stiffness; increased muscle tone), bradykinesia/akinesia, also "dysdiadokinesia", and postural instability.	not_entailment
1998	In a move reminiscent for some of another actor, Ronald Reagan, who was twice elected governor of California, Schwarzenegger said he would be putting his movie career on hold so he can devote his time to running for governor.	Ronald Regan was elected governor of California.	entailment
2140	Alternately known as brash, emotional and brilliant, the maverick Kasparov could be a formidable opponent in the realm of politics.	Don Brash is the leader of the New Zealand National Party.	not_entailment
1892	Oil prices this Tuesday rose sharply in New York and London reaching a record 42,33 US dollars per barrel, 2.45 US dollars more than last Friday.	Oil prices this Tuesday surged to an all-time high in New York, at 42 dollars a barrel, 1.92 dollars a barrel more than last Friday.	not_entailment
157	Google and NASA announced a working agreement, Wednesday, that could result in the Internet giant building a complex of up to 1 million square feet on NASA-owned property, adjacent to Moffett Field, near Mountain View.	Google may build a campus on NASA property.	entailment
1142	The board of Marks & Spencer will take another look at Philip Green's increased takeover offer.	Philip Green tries to take over Marks & Spencer.	entailment
2204	A Yorkshire pub affected by flooding in 2007 has been named CAMRA's National Pub of the Year for 2008. The Kelham Island Tavern in Sheffield's Kelham Island Quarter was in a "semi derelict" state when it was purchased in 2001. After it was re-opened in 2002 by licensee Trevor Wraith and manager Lewis Gonda, business quickly picked up and the pub has been awarded Sheffield CAMRA's local Pub of the Year award for the past four years. The pub won the award despite six weeks of closure a year and a half ago when the pub's cellar and floor were affected by the flooding of the River Don and the nearby Kelham goit. The pub also received Yorkshire CAMRA's Pub of the Year award in 2004 and 2007.	The Kelham Island Tavern is situated in Sheffield.	entailment
2031	A doctor from Michigan helped an Oregon woman with Alzheimer's disease commit suicide.	Dr. Kevorkian assisted Janet Adkins to use his suicide device.	not_entailment
1638	The European-born groups with the highest labor force participation rates were  from Bosnia and Herzegovina	The European country with the highest birth rate is Bosnia-Herzegovina.	not_entailment
1527	On Feb. 1, 1945, the Polish government made Warsaw its capital, and an office for urban reconstruction was set up.	Warsaw remained Poland's capital after the war.	not_entailment
619	The Walt Disney Co. donated one of the world's most significant private collections of African artwork, yesterday, to the Smithsonian's National Museum of African Art.	Disney gave the Smithsonian a trove of sought-after African art.	entailment
180	Eating lots of foods that are a good source of fiber may keep your blood glucose from rising too fast after you eat.	Fiber improves blood sugar control.	entailment
356	Bout - who is generally believed to be a model for the arms dealer portrayed by Nicolas Cage in the 2005 movie 'Lord of War' - has repeatedly denied any involvement in illicit activities. At a hearing earlier this month, he angrily accused the United States of framing him and pressuring Thailand to extradite him. He has long been linked to some of the world's most notorious conflicts, allegedly supplying arms to former Liberian dictator Charles Taylor and Libyan leader Colonel Gaddafi.	Gaddafi is the leader of Thailand.	not_entailment
1925	Galvarino Apablaza is the leader of the Marxist group FPMR - Manuel Rodriguez Patriotic Front. FPMR was founded in 1983 and became the armed wing of the Chilean Communist Party to carry out terrorist attacks against the Chilean militarist government of the dictator Augusto Pinochet. Its name is a tribute for Manuel Rodriguez Erdoiza, considered a Chilean hero in the war of the independence of Chile against Spain.	"Comandante Salvador" is the nickname of Galvarino Apablaza.	not_entailment
1770	In addition to data bases and publicity, stolen art is recovered when someone seeks appraisal or offers it for sale to dealers or auction houses, responds to a reward offer, attempts to remove it through customs, or requests a ransom for the art.	Centralized inventory records for museums aid in theft awareness.	not_entailment
1107	To write "The Persians," which opens Thursday at the Aurora Theatre in Berkeley, Ellen McLaughlin spent six days. Given the direction of U.S. foreign policy, McLaughlin says, the lessons of "The Persians" are particularly crucial today, 2,500 years after it was written.	"The Persians" was written by Aeschylus.	not_entailment
1223	Jakarta floods easily during the rainy season.	Jakarta is easily flooded during the rainy season.	entailment
2080	In 1955, the Aurora Borealis, a coating applied to crystal stones to produce a "rainbow of colors" effect was introduced.	The Aurora Borealis was discovered in 1995.	not_entailment
259	The order is worth EUR 58 million and handover of the submarines to the Portuguese navy is scheduled for 2010. The contract also includes an option for the same equipment to be built into a third submarine.	The Portuguese Navy has 58 submarines.	not_entailment
809	Vegetables help to preserve your bones, and help fight the bone-thinning disease osteoporosis.	Fruits and vegetables prevent osteoporosis.	not_entailment
218	In all, Zerich bought $422 million worth of oil from Iraq, according to the Volcker committee. In the early 1990s after the Soviet Union collapsed, Rich quickly became the most powerful trader there.	Zerich bought oil from Iraq during the embargo.	not_entailment
1448	PARIS — Julius Meinl V, the scion of a Viennese business dynasty whose name has been synonymous since the days of the Hapsburgs with luxuries like exotic coffee, handmade tortes and discreet private banking, has been jailed on suspicion of fraud at a company linked to the family. Prosecutors accused Mr. Meinl of artificially bolstering shares of the real estate company Meinl European Land on the Vienna stock exchange, even as its investments in real estate across Eastern and Central Europe cratered.	Julius Meinl V is the chairman of Austria's closely-held Meinl Bank.	not_entailment
1359	According to an Israeli official, the murders of Galan, a high-ranking police officer, and a judge last week were probably carried out by an Israeli mercenary paid by the Medellin cartel - the world's most powerful drug-trafficking mafia - which has set up paramilitary squads accused of hundreds of individual murders and massacres against political and labor leaders, as well as peasants and patriotic union leftist militants in different parts of the country.	Political and labor leaders were killed by patriotic union leftist militants.	not_entailment
1886	A pet must have rabies protection confirmed by a blood test.	A case of rabies was confirmed.	not_entailment
526	The focus on the engines and the fuel, stems from the pilot's radio call, shortly before the crash.	The pilot had been attempting an emergency landing, after both engines failed.	not_entailment
1235	Feith, 63, started his career at age 25 at the ministry of Foreign Affairs. He worked at the Dutch embassies of Syria, Germany and Sudan, at the United Nations headquarters in New York and at NATO in Brussels. In 2004 he represented E.U. in Darfur and prepared an E.U.-mission in Iraq that trained police-officials and judges. A year later Feith was in charge of the E.U. operation in Aceh and supervised the peace negotiations between the Indonesian government and the rebels.	Feith works in Brussels.	not_entailment
294	This coalition took seven months to form, the longest deadlock in Dutch history. It occurred only after negotiations between the CDA and the PvdA failed, first over tax issues, then over the issue of abortion.	Three parties form a Dutch coalition government.	not_entailment
827	Microsoft Corp. and Intel Corp., on Monday, threw their weight behind the next-generation, HD DVD format being promoted by Toshiba Corp., in a blow to Sony Corp.'s Blu-ray format.	Microsoft Corp. is a partner of Intel Corp.	not_entailment
1395	That police statement reinforced published reports, that eyewitnesses said de Menezes had jumped over the turnstile at Stockwell subway station and was wearing a padded jacket, despite warm weather.	However, the documents leaked to ITV News suggest that Menezes, an electrician, walked casually into the subway station and was wearing a light denim jacket.	not_entailment
1583	Over 100 more lives were lost at sea, and 1800 were lost in Holland.	100 or more people lost their lives in a ferry sinking.	not_entailment
684	Although the number of the confirmed Ebola cases has risen slightly to 26 in Gabon and to 16 in Congo Brazzaville, new infections are now so low that it seems the epidemic is "burning out".	Ebola Epidemic breaks out in Zaire.	not_entailment
1338	Brazilian cardinal Dom Eusbio Oscar Scheid, Archbishop of Rio de Janeiro , harshly criticized Brazilian President Luiz Inácio Lula da Silva after arriving in Rome on Tuesday.	The Brazilian President is Luiz Inácio Lula da Silva.	entailment
648	The two rescuers who retrieved him are firefighters with a California-based FEMA team: J.D. Madden of Santa Clara and Eric Mijangos of Menlo Park.	A FEMA team is based in California.	entailment
347	It also raised questions about the quality of financial regulation in Singapore, where derivatives losses run up by former trader Nick Leeson led to the 1995 collapse of Barings Plc.	Nick Leeson was arrested for collapse of Barings Bank PLC.	not_entailment
2380	In naming Guillermo Ortiz to be Mexico's finance minister, President Ernesto Zedillo appointed a friend, former colleague and, like himself, a U.S.-trained economist.	Guillermo Ortiz was born in Mexico.	not_entailment
316	The Pakistani news source GEO states that the first explosion occurred at 9:05 local time (0505 UTC), with the second explosion occurring minutes afterwards. The explosions occurred at the parking lot of the Marriott Hotel in Karachi, about 60 feet (18 meters) from the consulate gate. Damage to the building as well as over ten nearby vehicles was also reported. The Associated Press reports that the same consulate has been targeted twice in the recent past: an attack in 2002 left 14 Pakistanis dead, and in 2004 police defused a time bomb before it was set to detonate.	There is a Marriott Hotel in London.	not_entailment
2072	California Gov. Arnold Schwarzenegger (R) on Friday signed five bills into law that allow California to receive more than $17.5 billion in federal economic stimulus aid, but the funding will not be enough for the state to avoid $3 billion in tax increases and cuts to services to balance its budget, the San Francisco Chronicle reports. The legislation changes eligibility reporting requirements for children enrolled in Medi-Cal and allows more people to qualify for unemployment insurance and extends the benefit by 20 weeks. Medi-Cal is the state's Medicaid program.	Arnold Schwarzenegger is Austrian.	not_entailment
270	In Russia, BAT is setting up a joint venture with Yava, Moscow's largest cigarette factory.	BAT acquired production interests in the Ukraine, Hungary and Russia.	not_entailment
1524	The widow of John Lennon, Yoko Ono, may take legal action against a new breakfast cereal called "Strawberry Fields," which she believes is too close in name to Lennon's song.	Yoko Ono is John Lennon's widow.	entailment
1268	Skunk is a specific type of cannabis and is so-called because it has a very strong smell, but these days it has become the generic term for stronger forms of the drug. It is regarded as stronger because it contains much higher levels of the active ingredient in cannabis, tetrahydrocannabinol (THC). It also contains much lower levels of cannabidiol (CBD), which is an anti-psychotic substance that can moderate the effect of THC on the mental health of users.	The "skunk" cannabis is used to treat mental health problems.	not_entailment
1745	Digging in a different trench Phoenix's robotic Arm connected with a hard surface that has scientists excited about the prospect of next uncovering an icy layer.  "We have dug a trench and uncovered a hard layer at the same depth as the ice layer in our other trench," said Washington University robotic arm investigator for Phoenix, Ray Arvidson. The arm tried at least three times to penetrate the layer, but was unsuccessful. As a result the arm went into a holding pattern, awaiting its next commands.	A robotic arm has been used for scientific discoveries.	entailment
1111	Switzerland has ratified bilateral agreements with the members of the European Union in March 2004, but the new members (Cyprus , Czech Republic , Estonia, Hungary, Latvia, Lithuania, Malta, Poland, Slovakia and Slovenia) were not included in the deal.	Lithuania intends to introduce the use of the Euro as an official currency on January 1, 2007.	not_entailment
707	Nine soldiers and two police officers were killed in the ensuing gun battle, and two police officers were wounded, the officials said.	Six policemen and two soldiers were killed in a gunbattle, officials said.	not_entailment
1065	Gibbs also said that Obama planned to meet with Iraqi Prime Minister Nouri al-Maliki, but poor weather in Baghdad means that Obama will likely talk to the prime minister and Iraqi President Jalal Talibani by telephone. American troops are slated to leave Iraq by August 2010, with The New York Times reporting that troop levels will continue to be high until Iraq's federal elections in December. Obama told a group of university students in Turkey that despite his original opposition to the war in 2003, he realized that the troop withdrawal must be done carefully.	Jalal Talibani is friends with Obama.	not_entailment
1220	In Bosnia, diplomatic determination combined with military muscle to create an opportunity to secure a peace rather than permit instability to undermine this fragile region and U.S. interests.	The Dayton Peace Treaty was formulated to end the war in Bosnia.	not_entailment
468	Movil Access, a Grupo Salinas company, announced today that Gustavo Guzman will appoint Jose Luis Riera as company CFO of Grupo Iusacell.	Movil Access appoints Gustavo Guzman as CFO.	not_entailment
1012	French is the mother tongue of 80.9 percent of Québeckers, while 7.8 percent cite English as their mother tongue.	French is the most widely spoken language in Québec.	entailment
1902	Last month, Menu Foods recalled all of its 60 million products of dry and wet dog and cat food after pets began to fall ill and in some cases died of kidney failure. "Natural Balance, Pacoima, CA, is issuing a voluntary nationwide recall for all of its Venison dog products and the dry Venison cat food only, regardless of date codes. The recalled products include Venison and Brown Rice canned and bagged dog foods, Venison and Brown Rice dog treats, and Venison and Green Pea dry cat food. Recent laboratory results show that the products contain melamine. We believe the source of the melamine is a rice protein concentrate. Natural Balance has confirmed this morning that some production batches of these products may contain melamine," said a press released issued by Natural Balance.	Natural Balance produces pet food.	entailment
185	The Croatian will face competition, especially from the American of Chinese origin, Michael Chang, second-seeded in the tournament. Organizers hope that the tournament will contribute to advancing tennis in their countries.	The Croatian and the Asian-American, Michael Chang (number two) will play eachother, and hopefully popularise the game in their native countries.	entailment
2119	The outlawed Basque political party in Spain, Batasuna, called, on Monday, parties in the Basque Autonomous Government to boycott the parliament decision to ban it.	Spain's Basque party calls for the boycott of a parliament decision.	entailment
2454	The 7-4 defeat by Long Beach State, pushed the Cardinal to the brink in the double-elimination format of NCAA regionals.	Stanford Cardinal were defeated by Long Beach State, 7-4.	entailment
897	Mexico City (Mexico), 12 Jan 90 (DPA) - Salvadoran Social Democratic politician Hector Oqueli Colindres was kidnapped today, in Guatemala city, along with Guatemalan Social Democratic leader Gilda Flores, his party, in Mexico City, reported.	Hector Oqueli Colindres comes from El Salvador.	entailment
977	Three nurses in one of Vienna's oldest hospitals have been arrested on suspicion of killing 35 patients.	Three Vienna nurses are under suspicion for killing patients.	entailment
1895	The American television network "A.B.C." quoted undisclosed sources at the American Defense Department today, Thursday, saying that the intense bombing operations on Iraq may cease by the end of this week.	The television network "CNN", quoting sources in the American Ministry of Defence, revealed that the bombing of Iraq might end this week.	not_entailment
1011	Ministers of the Association of Southeast Asian Nations, ASEAN, are gathering in Laos to discuss topics ranging from terrorism and economic integration to non-aggression treaties with several regional neighbors.	Ministers of the Association of Southeast Asian Nations work for ASEAN.	not_entailment
1755	Management at Huawei also feels that issues over security are hampering its progress - largely stemming from allegations, in 2001, that it was accused of working for Pakistan and the then Taleban government in Afghanistan.	Management at Huawei was accused of working for Pakistan and the then Taleban government in Afghanistan.	entailment
1215	Four men were released on bail and were ordered to return to a police station Monday, when they may be charged with assault, a police spokesman said.	All four men have been released on bail and are due to return to a police station.	entailment
1256	US Catholic bishops are all but unanimous in believing that Cardinal Law must leave Boston for the good of the church.	Cardinal Law returns from Rome with plans to stay in Boston.	not_entailment
1784	Naval units evacuated U.S. civilians and military personnel from the Tachen Islands.	The U.S. military evacuated U.S. citizens.	entailment
2253	Last month, native bird trappers have snared and caught the Luzon Buttonquail (Turnix worcesteri or Worcester's buttonquail) in Dalton Pass, a cold and wind-swept bird passageway in the Caraballo Mountains, in Nueva Vizcaya, located between Cordillera Central and Sierra Madre mountain ranges, in Northern Luzon. The rare species, previously known to birders only through drawings based on dead museum specimens collected several decades ago, was identified in a documentary filmed in the Philippines called Bye-Bye Birdie."	Luzon Buttonquail is a rare species from the Philippines.	entailment
368	A few growers place charcoal in the bottom of containers to absorb excess salts and maintain sweet soil, if plants are grown more than a few months.	Plants are grown in water or in substances other than soil.	not_entailment
646	For a western European country, the birth rate in Finland is high.	Finland is the European country with the highest birth rate.	not_entailment
1221	Nepali mountaineer Ang Rita Sherpa last week broke his own record of the number of climbing Mt. Everest.	Alison Hargreaves is the first woman to have made the climb up the Everest with no artificial oxygen.	not_entailment
1079	Nevertheless, the international reputation of some Polish artists, notably the film maker Krzysztof Kieslowski, has never been higher. To use a crass commercial yardstick, the DVD boxed set of his Decalogue series (ten one-hour dramas based loosely on the Ten Commandments, made for Polish TV in 1988) is currently number 3,700 in Amazon.com's sales rankings (about even with The Alfred Hitchcock Signature Collection).	Kieslowski is a film and TV director.	entailment
