index	sentence1	sentence2	label
2451	Rod Blagojevich, the former governor of the US state of Illinois, was indicted on Thursday on charges of corruption for allegedly planning to "sell" Barack Obama's Senate seat when the latter vacated it to become President. Five of his advisers, including Blagojevich's brother Robert, were also indicted. The others are former fundraiser, Christopher Kelly, former chief of staff John Harris, former aide Lon Monk, and the lobbyist William Cellini.	Rod Blagojevich has been appointed as the US President.	not_entailment
364	This became Aquincum when the Romans established a military camp and civilian town there at the end of the 1st century AD.	One of the first organized settlements on the site, though, was the Roman fortress of Aquincum.	not_entailment
1903	Swift was offered and accepted the post of secretary and chaplain to the Earl of Berkeley, one of the Lords Justices, but when he reached Ireland he found that the secretaryship had been given to another.	Swift worked for the Earl of Berkeley.	not_entailment
240	Saudi Arabia's production mix will shift to a higher proportion of lighter crudes. Unlike last year's Qatif and Abu Safah developments, nearly all of the proposed projects produce Arab Light or lighter crudes.	Saudi Arabia produces more oil than any other country.	not_entailment
344	The father of an Oxnard teenager accused of gunning down a gay classmate who was romantically attracted to him has been found dead, Ventura County authorities said today.  Bill McInerney, 45, was found shortly before 8 a.m. in the living room of his Silver Strand home by a friend, said James Baroni, Ventura County's chief deputy medical examiner. The friend was supposed to drive him to a court hearing in his son's murder trial, Baroni said.  McInerney's 15-year-old son, Brandon, is accused of murder and a hate crime in the Feb. 12, 2008, shooting death of classmate Lawrence "Larry" King, 15. The two boys had been sparring in the days before the killing, allegedly because Larry had expressed a romantic interest in Brandon.	Bill McInerney is accused of killing a gay teenager.	not_entailment
916	A briefcase containing magnets, batteries and a cell phone sitting in the bushes outside a Charleston, South Carolina coffee shop drew the local bomb squad's attention, before it was determined that it contained no explosives. Police had earlier closed down Calhoun Street in downtown, where the coffee shop is located, but reopened the street and let local residents and business owners that the situation was over after performing an investigation.	A briefcase was found outside Starbucks in Charleston.	not_entailment
1463	While the Baltic countries are set to join the European Union soon, their economies are already in good shape. Estonia, Latvia and Lithuania boast the fastest economic growth in the entire Baltic Sea region, for example.	The Baltic Countries will join the EU.	entailment
972	On the other hand, the article, "Fiction and Facts About Drug Legalization", by Joseph Califano identifies possible social problems that could occur as a result of marijuana being decriminalized in any form, whether for medical purposes or for recreational use.	Drug legalization has benefits.	not_entailment
1701	In 1986 he became the head of London European Airways, a business in which Ryanair had bought an 85% stake. This position, however, quickly disappeared as the carrier became Ryanair UK and was then merged entirely with Ryanair. Over the next decade, Cathal worked both on the executive board of the airline and as a pilot, although he resigned from the latter by 1996. He remained with Ryanair until leaving the board 2002, by which time he was a multi-millionaire due to the success of the airline.	Ryan was Cathal's father.	not_entailment
363	President Alvaro Uribe was sworn into his second term of office in the Colombian capital of Bogota, Monday, pledging to improve the economy and make peace with FARC (Revolutionary Armed Forces of Colombia) rebels. Security was tight in order to prevent a repetition of the attack on his first inauguration in 2002 when FARC rebels fired mortars at the presidential palace killing 20. Police reported deactivating a car bomb outside of the capital on Monday.	Alvaro Uribe is the current President of Colombia.	entailment
1046	Gen. Maza Marquez said that the fact that a payment is being offered for the capture of Pablo Escobar does not mean that other persons accused of being capos of the mafia are not being sought, and that if anyone being held in connection with the investigation of the killing of Luis Carlos Galan is released, that does not mean that the investigations are not proceeding well.	Luis was killed by the capos of the mafia.	not_entailment
1544	Jyestadeva (1500-1610), was an astronomer of the Kerala school founded by Madhava of Sangamagrama and a student of Damodara. He is most known for writing the first calculus text, the Yuktibhasa . He also authored the Drk-karana on astronomical observations.	Jyestadeva invented calculus.	not_entailment
1139	The institute's breakthrough came about after it set out to examine Thür's belief that an octagonal tomb in the remains of the Roman city of Ephesus contained the body of Arsinöe. According to Roman texts the city, in what is now Turkey, is where Arsinöe was banished after being defeated in a power struggle against Cleopatra and her then lover, Julius Caesar.  Arsinöe was said to have been murdered after Cleopatra, now with Mark Antony following Caesar's death, ordered the Roman general to have her younger sibling killed to prevent any future attempts on the Egyptian throne.	Queen Cleopatra ordered the assassination of her sister.	entailment
2439	"I think we've already seen the effect on oil and gas prices," said economist Kathleen Camilli of New York-based Camilli Economics.	Kathleen Camilli works for Camilli Economics.	entailment
2302	Seal hunting has been a tradition in Norway for thousands of years, but has dwindled recently with only about half the annual 1,200 quota being killed each year.	Seal-hunting endangers species.	not_entailment
2345	Ask Andy Grove, chairman of Intel, about his toughest business challenge, and a pensive look appears in his piercing blue eyes.	Andy Grove is chairman of Intel.	entailment
1092	Contrast the Leitrim story with that of Rita Levi-Montalcini, an Italian Nobel laureate who turned 100 last Wednesday. She still attends for work every day at the European Brain Research Institute in Rome, which she founded. She was appointed a senator for life in 2001, and in 2006, aged 97, she attended the opening assembly of the newly elected senate. She takes part in discussions in the Upper House, and in 2004 defended the teaching of evolution in Italian schools. There is no record of her having claimed a day off because of festival commitments. Apparently she even manages to work right through the Rose of Tralee without lifting her head from her Petri dish.	Rita Levi-Montalcini is a Nobel prize winner.	entailment
101	A school dinner lady is claiming damages from a teenager who seriously injured her while playing tag with a friend. If she is successful, pupils could become legally liable for boisterous behaviour that results in accidents.   Michelle Orchard, 42, is seeking hundreds of thousands of pounds in damages from Sebastian Lee, who was 13 when he ran into her during the lunch break at Corfe Hills School, Corfe Mullen, Dorset, in January 2004.   Sebastian, with his friend in pursuit, tumbled into her backwards, striking her in the face with the back of his head, senior judges at the Court of Appeal heard yesterday. Mrs Orchard's nose was broken and her teeth were damaged. Her lawyers say that she also suffered serious brain damage, leading to partial paralysis and balance problems. She has been unable to work since the accident.	Michelle Orchard is claiming hundreds of thousands of pounds from Sebastian Lee because she wants a new nose.	not_entailment
1993	Guerrillas killed a peasant in the city of Flores.	Guerrillas killed a civilian	entailment
984	He also developed a breath test that could detect sulfur compounds emitted from the H. pylori.	The H. pylori produces sulphur compounds.	entailment
2397	Jyestadeva (1500-1610), was an astronomer of the Kerala school founded by Madhava of Sangamagrama and a student of Damodara. He is most known for writing the first calculus text, the Yuktibhasa . He also authored the Drk-karana on astronomical observations.	Jyestadeva is the author of the Yuktibhasa.	entailment
2103	Then came the dozens of protesters who started camping out near Bush's ranch this month, led by a California mother who lost her son in the war and insists on speaking to the president.	FBI whistleblower Coleen Rowley has also arrived in Texas, as has Becky Lourey, another mother who has lost her son in Iraq and a state senator in Minnesota	not_entailment
1263	Pyongyang said there was no point in the talks since the US had termed North Korea an 'outpost of tyranny'.	The US labelled North Korea part of an 'axis of evil'.	not_entailment
1021	More than 1,500 people died when the Titanic sank in 1912.	The Titanic sank in 1912.	entailment
1823	Officials from TAG Heuer have announced that the company received the iF product design award, which was given away by the jury from the International Forum Design. TAG Heuer received the award for its concept watch, called Monaco Calibre 360 (Linear Second) Concept Chronograph. The jury that gives away the iF product design awards each year consists of leading design experts from all over the world gathered in one place. The iF awards are presented in Hanover, Germany, at the International Forum Design Hannover GMBH. There are a number of fields and disciplines which have their own awards.	Monaco Calibre 360 (Linear Second) Concept Chronograph is produced in Hannover.	not_entailment
95	Two Turkish engineers and an Afghan translator kidnapped in December were freed Friday.	translator kidnapped in Iraq	not_entailment
960	Published Date:  06 April 2009  Carrie Underwood was named Entertainer Of The Year at the Academy of Country Music Awards in the US.  The former American Idol winner was the first female act to win the honour since the Dixie Chicks in 2000. "I've had a lot of good moments in the past four years. This one takes the cake," the tearful 26-year-old said.   "Thank you God, thank you fans, thank you to ACM for nominating me in the first place. I never thought I'd be nominated and never thought I'd win. I'm shaking. I don't know what to say."	Carrie Underwood won the second prize at the Academy of Country Music Awards.	not_entailment
856	"Mayday! Here is Estonia! Outside Uto lighthouse. We have listed 20 to 30 degrees," the Finnish Coast Guard quoted the distress signal.	The Estonia sank south of Uto island.	not_entailment
1796	San Francisco (Reuters) -- Dell Inc. plans to announce preliminary quarterly results after the market closes Tuesday, after last week delaying their release due to accounting complexities related to a regulatory probe.	Tuesday, preliminary quarterly results will be announced.	entailment
1484	It would help the economy by putting people back to work and more money in the hands of consumers.	More money in the hands of consumers means more money can be spent to get the economy going.	entailment
730	Eddeh reasserted his opinion that President Al-Hrawi ought to be reinstated for another 3 years, claiming that the he "has considerable experience in the running of the state, but his resignation would be appropriate after the withdrawal of Israeli and Syrian forces."	Eddeh calls for an extension to Al-Hrawi's presidency, saying that he should resign after the withdrawal of the Israeli and Syrian forces."	entailment
280	A Pentagon committee and the congressionally chartered Iraq Study Group have been preparing reports for Bush, and Iran has asked the presidents of Iraq and Syria to meet in Tehran.	Bush will meet the presidents of Iraq and Syria in Tehran.	not_entailment
920	The trial court may allow the prevailing party reasonable attorney fees as part of costs.	The prevailing party may not recover attorney fees.	not_entailment
1381	The cholera epidemic in Zimbabwe appears to have passed its peak, says the World Health Organization (WHO).  The number of new cases recorded in the week to mid-March nearly halved to 2,000, against 3,800 the preceding week and 8,000 cases a week in February.  But the agency warned the weekly statistics were not always accurate.  There have been more than 90,000 cholera cases in Zimbabwe since the start of the epidemic last August, about 4,000 of them fatal.	Since last August about 4,000 people died of cholera in Zimbabwe.	entailment
1321	The previous town hall meeting was held to address concerns of the community about a steel plating manufacturing plant that applied to the AQMD for a  permit to expand its facilities to increase pollution emissions. Parents and teachers were concerned over the facts that the plant was located directly adjacent to Kennedy Elementary School, and that their children were experiencing high levels of lead, respiratory problems, excessive nose-bleeding, and leukemia.	There is an outbreak of leukemia among children in California.	not_entailment
731	The first dinosaur remains in south-east Asia were found in Laos as early as 1936, but little else eventuated until the 1980s. Much of the area is heavily vegetated, and although difficult to explore, promises many significant finds in the future. Thailand has provided the best finds, particularly from the Khorat Group, which covers the period from the late Triassic to the early Cretaceous .	Dinosaur remains were found in Asia.	entailment
848	That prompted Clinton, wife Hillary Rodham Clinton and daughter Chelsea to spend a cold and dreary Saturday in Minsk.	Clinton's wife is called Hillary Rodham Clinton.	entailment
826	Valero Energy Corp., on Monday, said it found "extensive" additional damage at its 250,000-barrel-per-day Port Arthur refinery.	Valero Energy Corp. caused damages to Port Arthur refinery.	not_entailment
586	Animals are permitted to enter the UK 6 months later without quarantine as long as they have been treated for ticks, fleas and tapeworms between 24 and 48 hours before boarding the transport that will return the pets to the UK.	Quarantine is compulsory for animals to enter the UK.	not_entailment
735	Like the United States, U.N. officials are also dismayed that Aristide killed a conference called by Prime Minister Robert Malval in Port-au-Prince in hopes of bringing all the feuding parties together.	Aristide kills Prime Minister Robert Malval	not_entailment
426	Meanwhile, in an exclusive interview with a TIME journalist, the first one-on-one session given to a Western print publication since his election as president of Iran earlier this year, Ahmadinejad attacked the "threat" to bring the issue of Iran's nuclear activity to the UN Security Council by the US, France, Britain and Germany.	Ahmedinejad was attacked by the US, France, Britain and Germany.	not_entailment
2144	Iraqi militants said Sunday they would behead Kim Sun-Il, a 33-year-old translator, within 24 hours unless plans to dispatch thousands of South Korean troops to Iraq were abandoned.	translator kidnapped in Iraq	entailment
2141	Officials in Pakistan say parliamentary elections will be delayed until next month. VOA correspondent Nancy-Amelia Collins in Islamabad reports the Pakistan Election Commission says the delay is due to the destruction of election offices and materials in violence that broke out last week after Benazir Bhutto's assassination. Chief election commissioner Qazi Mohammed Farooq says the elections originally scheduled for January 8 are being postponed and will be held next month. "The polling will now be held on 18th February, 2008 instead of 8th January 2008," he said.	Islamabad is a city in Pakistan.	entailment
68	Israeli Prime Minister Ariel Sharon has said that Mahmoud Abbas is a man that Israel can do business with.	Palestinian leader, Mahmoud Abbas, may be someone Israel can talk with.	entailment
2190	A priest who served in the Diocese of Metuchen in the mid-1980s has been sentenced to life in prison for sexually abusing a Massachusetts boy.	Pedophile gets life in prison	entailment
2208	The ecological problems stem in large part from the fact that the brackish water and productive coastal wetlands and natural areas are often supplied with nutrient-rich irrigation return water, sometimes from rice farming. The Ebro Delta and its wetlands suffer similar water quality problems since they lie around the fringes of the large Delta farm region.	The Ebro Delta is used for farming.	entailment
2248	With Washington hinting it might soften its tough stance to break the deadlock, top US negotiator, Christopher Hill, said the two sides needed to review the situation.	Christopher Hill works for the US.	entailment
1296	No player scored more goals in European cup games than Miller: 66 goals in 74 games.	Miller was the best scorer at the World Championship in 1966.	not_entailment
695	Yes, water is a critical area of dispute in the Arab-Israeli conflict; but given the current climate of peacemaking, and given the general war-weariness among states and populations, such predictions are excitable pieces of subjectivism.	There is a territorial waters dispute.	not_entailment
1941	Prosecutors were still expected to unseal an 11-count manslaughter indictment against the ferry's captain, Michael Gansas. He violated procedure by his absence from the wheelhouse during docking, when Smith lost control of the ferry.	Mr Smith entered his guilty plea to 11 counts of manslaughter and also to lying to investigators about his medical history, under an agreement reached with prosecutors.	not_entailment
232	Five U.S. soldiers were killed and five wounded Friday in an ambush near the Shiite neighborhood Sadr City.	Five US soldiers were killed and five wounded on Friday in an ambush near the Shi'ite neighbourhood Sadr City.	entailment
2475	Anne Marie David corresponded with Wikinews' Mike Halterman about her eventful career, her personal anecdotes regarding living abroad, her successes in past Eurovision contests and her grievances with the way the show is produced today. This is the second in a series of interviews with past Eurovision contestants, which will be published sporadically in the lead-up to mid-May's next contest in Moscow.	Anne Marie David won the Eurovision Song Contest.	not_entailment
1315	He said those three detainees are Khalid Sheikh Mohammed - one of the architects of the September 11th attacks on New York and Washington, Abu Zubaydah - who is believed to have been a top al-Qaida strategist, and Abd al-Rahim al-Nashiri - who is believed to have played a key role in the bombing of the USS Cole. All three are being held at the U.S. detention facility at Guantanamo Bay. Hayden said waterboarding was used against the three detainees nearly five years ago because of circumstances at the time, including the belief that additional attacks against the United States were imminent. Hayden defended the CIA's use of extreme interrogation techniques as lawful, and urged lawmakers not to impose restrictions on such methods. Congress is considering legislation that would restrict the CIA to using only the interrogation techniques authorized by the U.S. Army's field manual, which does not include waterboarding.	Abu Zubaydah belongs to al-Qaida.	entailment
1842	The human species may be more than 100,000 years old but the bulk of its numerical growth has come in just the last few decades: 2.6 billion of today's 5.6 billion people have been born since 1960.	The world population is 5.6 billion.	entailment
1161	FMLN militias sabotaged power lines along the road linking Nueva Concepcion to the northern trunk highway at 1800 on 12 August.	Power lines were attacked by FMLN.	entailment
1706	Oh Eun-sun was the first Korean woman to climb Mt. Everest solo. For all the hardships she must have endured, she merely says that she was lucky. She now reminisces about the days she spent in that mountain.	A woman succeeds in climbing Everest solo.	entailment
2057	There are many Baroque churches of the Counter-Reformation period, including the Jesuit Church next to the cathedral and the Church of the Holy Cross, which contains Chopin's heart.	Sigismund made Warsaw the capital of Poland in 1611.	not_entailment
1152	The United States Department of Homeland Security has announced the awarding of a $3 million grant to Rutgers University to lead a consortium researching advanced information analysis and computational technologies to protect the United States. Under the agreement, Rutgers will also coordinate a team of four university-based centers at the University of Southern California, the University of Illinois at Urbana-Champaign and the University of Pittsburgh. Plans call for a total of $10.2 million in funding over three years for Rutgers and these institutions to advance efforts aimed at identifying common patterns from numerous sources of information.	Rutgers University will be awarded a $3 million grant.	entailment
199	A joint survey by two conservation groups, World Conservation Union and the World Wildlife Fund, says the black rhino population has risen to over 3,600. That is an increase of 500 animals over the last two years.	Two conservation groups have increased the black rhino population.	not_entailment
1148	Honda also released a video where a humanoid robot named Asimo was operated by a person wearing the helmet. The employee was stated to be thinking about raising his right hand, after which Asimo moved its right arm. Honda states that it could be quite some time before the technology is ready to go live due to difficulties such as the human brain's liability to become distracted, creating mixed thought patterns. A related problem is the amount of focus required by the operator. "Practical uses are still way into the future." said Honda Research Institute Japan Co executive, Yasuhisa Arai. "I'm [just] talking about dreams today."	Yasuhisa Arai is an employee of Honda Research Institute Japan.	entailment
1306	Their work has stimulated research into microbes as possible reasons for other chronic inflammatory conditions, such as Crohn's disease, ulcerative colitis, rheumatoid arthritis and atherosclerosis, the Nobel assembly said.	Rheumatoid arthritis is caused by microbes.	not_entailment
671	Al-Qaida-linked militants have carried out a series of suicide bombings targeting Western interests in Indonesia since 2002.	Since 2002 Al-Qaida militants have tried to hit Western interests in Indonesia.	entailment
98	The discovery is based on velocity measurements of a whirlpool of hot gas orbiting the black hole.	Hubble discovers black holes.	not_entailment
1156	Microsoft's (MSFT) own search engine will permanently replace the Yahoo (YHOO) search technology that has been used on Microsoft's MSN website.	Yahoo's technology will still be used.	not_entailment
2377	Mr. Bush warned opposition Democrats in Congress against raising taxes, saying that is the worst thing lawmakers could do. But he did urge them to pass legislation that could help more Americans refinance their homes. "When Congress comes back, I look forward to working with them to deal with the economic realities of the moment and to ensure the American people that we will do everything we can to make sure we remain a prosperous country," he added.	The Congress wants to boost the economy.	not_entailment
504	The agreement also stated a period of transition for the Baltic countries to last until December 31, 1999. This was a much shorter period than that which was assigned to the Central European countries (their transition periods were declared to be 10 years). Estonia declined the transition period, Latvia received a transition period of four years, and Lithuania received a transition period of six years.	Baltic Countries join the EU.	not_entailment
2468	It takes 560 years to complete one trip around the Sun (versus 250 years for Pluto).	Pluto's trip around the Sun lasts 250 years.	entailment
1841	Vinicio Cerezo tacitly blamed president Alfredo Cristiani's administration for the crisis which prevails in the country as a result of the Farabundo Marti National Liberation Front's (FMLN) offensive. Meanwhile, Morales Ehrlich blamed the extreme- right, death-squads of El Salvador for the assassination of six Jesuit priests at the Central American University.	Farabundo Marti National Liberation Front is suspected of the assassination of six Jesuit priests.	not_entailment
48	Libya's case against Britain and the US concerns the dispute over their demand for extradition of Libyans charged with blowing up a Pan Am jet over Lockerbie in 1988.	One case involved the extradition of Libyan suspects in the Pan Am Lockerbie bombing.	entailment
131	Although they were born on different planets, Oscar-winning actor Nicolas Cage's new son and Superman have something in common - both were named Kal-el.	Nicolas Cage's son is called Kal-el.	entailment
851	While preliminary work goes on at the Geneva headquarters of the WTO, with members providing input, key decisions are taken at the ministerial meetings.	The WTO headquarters are located in Geneva.	entailment
1573	Apart from the new substances entering the market, the phase out of existing ones, which have been definitely identified as damaging the ozone layer, is far from complete.	New substances are damaging the ozone layer.	not_entailment
2160	Accompanied by Sioux prayers and the keening of Scottish bagpipes, a plain cotton shirt was returned to South Dakota this past summer.	A Sioux ghost shirt was returned by a Scottish museum.	not_entailment
