index	sentence1	sentence2	label
1415	If you have an immediate problem with ice dams, you should remove the snow from the part of the roof directly above the ice dam. This limits the amount of water that can collect behind the dam.	Dam building prevents life-threatening situations.	not_entailment
2295	People who are deaf or have hearing impairments, those who are blind or have vision impairments, and those with mobility impairments may face unique challenges in an emergency. Their ability to detect a fire or escape its effects may be hindered by their impairments. As a result, people with these impairments are at a greater risk of death or injury due to fire.	Deaf people encounter problems in the social community.	not_entailment
1825	Former Peruvian President Alberto Fujimori has been sentenced to 25 years in jail for ordering killings and kidnappings by security forces. At the end of a 15-month trial, judges found him guilty of two death-squad killings of 25 people during the conflict with guerrillas in the 1990s. After being sentenced, Mr Fujimori said he would appeal against the verdict. Human rights group Amnesty International described the verdict as "a milestone in the fight for justice".	Alberto Fujimori has been sentenced to life in prison.	not_entailment
1462	Climatologists believe artificially induced climate change is the reason Australia is destined for the warmest year on record. Temperatures so far this year have averaged one degree above the 30-year average, the Bureau of Meteorology (BOM) told the Greenhouse 2005 - Action in Climate Change Conference being held in Melbourne this week. The head of the National Climate Centre, Michael Coughlan, says Australia has had the warmest ever first 10 months of 2005, and seems likely to be a record-breaking year.	Bad weather creates problems.	not_entailment
1194	Scott Island was discovered and landed upon in December 1902 by Captain William Colbeck commander of the Morning, relief ship for Capt. Robert F. Scott's expedition.	Capt. Scott reached Scott Island in December 1902.	not_entailment
627	The West Pharmaceutical Services plant, which had been cited for numerous safety violations last fall, made syringe plungers and IV supplies.	The West Pharmaceutical Services plant had been cited for numerous safety violations last autumn.	entailment
1559	The Independent Police Complaints Commission (IPCC) is trying to reassure lawyers for the family of Jean Charles de Menezes that the inquiry is still on track.	Police issued John Wadham's statement after lawyers for the de Menezes family met with the complaints commission, demanding more information about the killing.	not_entailment
2369	"They brought us 7-Up, bottled water, ice and a diet of rice, though you didn't feel like eating," said Jim Lankes, 48, of Phoenix.	Jim Lankes was given bottles of waters, ice and rice.	entailment
1852	In 1975, a 19 year old Wilkins was handed the captaincy of Chelsea, despite the presence of elder and more experienced players in the squad.	Wilkins became the captain of Chelsea in 1975.	entailment
1486	Paul Watson, the founder of Greenpeace, will speak on campus Wednesday, March 3.	Paul Watson is the founder of Greenpeace.	entailment
1475	Dr Wood led a courageous and committed team in the fight to save 28 patients suffering from between two and 92 per cent body burns, deadly infections and delayed shock. As well as receiving much praise from both her own patients and the media, she also attracted controversy among other burns surgeons due to the fact that spray-on skin had not yet been subjected to clinical trials.	Burns surgeons approve Dr Wood's spray-on skin.	not_entailment
1344	In Johannesburg, about 500 angry AIDS activists, many wearing red and white T-shirts that said "HIV Positive," criticized Bush, saying he had hurt the global fight against AIDS by spending billions of dollars on war.	In Johannesburg, activists complained that Bush spent billions of dollars on the global fight against AIDS instead of on war.	not_entailment
1291	The Bolan Pass is a gap through the Toba Kakar Range of mountains on the border of Pakistan. The British took the threat of a Russian invasion of India via the Khyber and Bolan Passes very seriously so in 1837, a British envoy was sent to Kabul to gain support of the Emir, Dost Mohammed. In February of 1839, the British Army under Sir John Keane took 12,000 men through the Bolan Pass and entered Kandahar.	The British Army crossed the Toba Kakar Range of mountains in 1839.	entailment
112	The 10-men team is expected to arrive at the foot of the mountain in the end of April and began their journey to the 8,586-meter peak in early May.	Kanchenjunga is 8586 meters high.	not_entailment
1461	Critics said the National Certificate of Educational Achievement or NCEA, the main qualification for high school students, would be degraded by the authority allowing text speak use in exams.	NCEA is the main qualification for high school students.	entailment
1403	John Paul II  was the first non-Italian Pope in exactly 600 years, so other things being equal, his successor would presumably be Italian.	John Paul II is Italian.	not_entailment
278	Investigators described the gunman as white, about 30 years old, of medium build with shoulder-length, wavy blond hair and as having a "scruffy" or "grunge" appearance.	The gunman is described as a white male in his 30s with a medium build, shoulder-length blonde hair and an unkempt appearance.	entailment
184	The source added that the investigation proved that the bases of the genocide crime "were completed with a series of illegal arrests followed in some cases with assassinations or cases of disappearances and were preceded, according to information attached to the file, by cases of torture."	Investigators discovered that a series of illicit arrests of were often followed by disappearances or murders and were preceded by torture.	entailment
236	Gabriel Garcia Marquez was a liberal thinker whose left-wing politics angered many conservative politicians and heads of state. His job as a reporter for the Cuban news agency Prensa Latina, in 1960, and and friendship with Fidel Castro resulted in his being ultimately denied entry to the United States for political reasons.	Gabriel Garcia Marquez was a conservative politician.	not_entailment
2260	The Beetle has achieved an unbelievable cult status across the world, not least because its creation marked the launch of what has since become the largest car company in Europe.	Europe produces the 'Beetle'.	not_entailment
2044	Pulitzer Prize-winning American novelist John Updike has died of lung cancer at a hospice near his home in Beverly Farms, Massachusetts. He was 76. Born John Hoyer Updike in Reading, Pennsylvania in 1932, he documented ordinary ―if highly sexualized ―American life in around 50 works, beginning with The Poorhouse Fair in 1959. He once said that his books were about "the American small town, Protestant middle class".	John Updike won the Pulitzer Prize.	entailment
975	In most Pacific countries there are very few women in parliament.	Women are poorly represented in parliament.	entailment
1985	In August, Gates' foundation gave Yunus' Grameen Foundation 1.5 million for a program to extend its microfinance programs to 5 million more of the world's poorest families. Three years ago, tech entrepreneur Craig McCaw provided 2 million to start up the Grameen Technology Center, which is using microcredit to finance cheap mobile service for people in Uganda and Rwanda.	Gates' foundation extends its microfinance programs to 5 million more of the world's poorest families.	not_entailment
1310	As with the Babylonian New Year, the Chinese New Year, which occurred on the 1st of February in 2003, the day before Groundhog Day, is correlated to the beginning of spring.	The Chinese New Year's Day falls on the 1st of February in 2003.	entailment
329	Since 1974, Cyprus has been divided, de facto, into the government-controlled southern two-thirds of the island and the Turkish-Cypriot northern one-third.	Cyprus was divided in 1974.	entailment
1146	His latest release, Together Through Life, has reached the top spot 38 years and five months after his last chart-topper, New Morning, in 1970. The 67-year-old American singer-songwriter now holds the record for the longest gap between solo number one albums. It is Dylan's seventh UK number one, his 33rd studio album and his 53rd album, including compilations and soundtracks. He first reached number one with The Freewheelin' Bob Dylan released in 1964. HMV's Gennaro Castaldo said: "It's evident that Dylan is going through one of his zeitgeist moments, as a new generation of fans join his more established followers in appreciating his musical legacy."	Gennaro Castaldo is 67 years old.	not_entailment
1155	NEW YORK - (Business Wire) Pfizer Inc announced today that it has become the first pharmaceutical company to be accredited by the Association for the Accreditation of Human Research Protection Programs (AAHRPP) for ensuring the protection of human subjects taking part in early-stage clinical trials. The AAHRPP accreditation was awarded to Pfizer's clinical research units (CRUs) in New Haven, CT, Brussels, Belgium and Singapore, where the company conducts most of its Phase I clinical research. To earn the accreditation, Pfizer participated in a rigorous, 15-month examination of the clinical research practices at these units.	Pfizer is a pharmaceutical company.	entailment
1136	Two persons were injured in dynamite attacks perpetrated this evening against two bank branches in this northwestern, Colombian city.	Two bank branches were attacked with dynamite.	entailment
1332	Treasures belonging to Hollywood legend Katharine Hepburn have raised £3.2m at a two-day auction in America.	A two-day auction of property belonging to actress Katharine Hepburn brought in 3.2 million pounds.	entailment
230	The ghost shirt was then donated to the Glasgow Museum in 1892 by an Indian interpreter and has remained a visitor attraction for 100 years. It became the subject of an ownership wrangle when descendants of the Sioux tribe petitioned for its return in 1995. The Wounded Knee Survivors Association including a Lakota elder had it returned to the tribe.	A Sioux ghost shirt was returned by a Scottish museum.	entailment
1626	This taught postgraduate masters degree programme will provide specialised training at a postgraduate level in the methods and uses of remote sensing applied to the ocean.	Ocean remote sensing is applied.	entailment
62	The Dutch, who ruled Indonesia until 1949, called the city of Jakarta Batavia.	Formerly ( until 1949 ) Batavia, Jakarta is largest city and capital of Indonesia.	not_entailment
2210	The west has preferred to focus on endangered animals, rather than endangered humans. African elephants are hunted down and stripped of tusks and hidden by poachers. Their numbers in Africa slumped from 1.2m to 600,000 in a decade until CITES - the Convention on International Trade in Endangered Species - banned the trade in ivory.	The African elephant population was decimated by poachers.	entailment
354	President Fujimori was first elected in 1990, and then re-elected in 1995 under a new constitution.	President Fujimori was re-elected in 1995.	entailment
1435	Elizabeth Alexandra Mary was born on April 21, 1926 in London, England. Her father, Prince Albert, Duke of York, was the second son of King George V. Her mother, the former Elizabeth Bowes-Lyon, was the daughter of a Scottish earl. Princess Elizabeth was their first child. Her only sibling, Margaret Rose, was born in 1930.	Elizabeth the Second's father was George VI.	not_entailment
2318	Helena Brighton, an attorney for Eliza May who served as executive director of the Texas Funeral Services Commission -the state agency that regulates the funeral business- claimed that she was fired from her state job because she raised questions about SCI.	Helena Brighton is a clerk of the Texas Funeral Services Commission.	not_entailment
1470	The main library at 101 E. Franklin St. changes its solo and group exhibitions monthly in the Gellman Room, the Second Floor Gallery, the Dooley Foyer and the Dooley Hall.	Dooley Foyer is located in Dooley Hall.	not_entailment
2003	Edison decided to call "his" invention the Kinetoscope, combining the Greek root words "kineto" (movement), and "scopos" ("to view").	Edison invented the Kinetoscope.	entailment
645	Earlier this year, Kai-Uwe Ricke, chief executive of Deutsche Telekom, floated the possibility that T-Mobile USA might be sold.	Deutsche Telekom sold T-Mobile USA.	not_entailment
2254	Yunus, who shared the 1.4 million prize Friday with the Grameen Bank that he founded 30 years ago, pioneered the concept of "microcredit." It allows very poor people, who don't qualify for traditional loans, to get loans of as little as a few dollars without collateral. The banks' shareholders are the impoverished people it supports.	Yunus founded the Grameen Bank 30 years ago.	entailment
2130	Twenty-two other miners were working at the nearby Kangjiayao mine at the time of the accident, although it is unclear if any of those miners were affected. Thousands of miners die in mining accidents each year in China. Today's accident comes just one day after 19 coal miners were killed in a mining accident in the Sulongsi mine in Chongqing, and one month after the largest accident in recent history killed 214 miners, in Fuxin, Liaoning Province.	Liaoning Province is in China.	entailment
2480	On 24 March 1992, the number 3 power generating unit at the Leningrad Atomic Power Station in Sosnovyi Bor underwent an emergency shutdown. The plant suffered a steam leak, which spewed a total of some 3 thousand curies into the atmosphere.	Nuclear Power Plant of Sosnovyi Bor suffers an emergency shut down.	entailment
2108	The city continued to grow through much of the 20th century.	The city continued to grow, but its services deteriorated.	not_entailment
273	Rich and poor nations struck a historic deal on Sunday to slash billions of dollars in farm subsidies, create more open industrial markets and revive stalled world trade talks that could boost global growth.	Rich and poor nations crashed into a historic deal on Sunday.	not_entailment
18	FIFA has received 11 bids to host the 2018 and 2022 FIFA World Cup tournaments, an international football competition contested by the men's national teams. The countries vying to host the tournament are Australia, England, Indonesia, Japan, Mexico, Qatar, Russia, South Korea and United States, who have individual bids and the joint bids are from Belgium-Netherlands and Spain-Portugal.  Select bids are for 2018 and 2022 tournaments and two bids are just for the 2022 tournament. Qatar and South Korea are vying just for the 2022 tournament. The two winning bids will be chosen on December 2010 by the 24-man executive committee of FIFA.  Said FIFA president Sepp Blatter: "We are very pleased about the fantastic level of interest in our flagship competition, with all initial bidders confirming their candidature."	Sepp Blatter is the president of FIFA.	entailment
1893	While civilians ran for cover or fled to the countryside, Russian forces were seen edging their artillery guns closer to Grozny, and Chechen fighters were offering little resistance.	Grozny is the capital of Chechnya.	not_entailment
1006	GM established grounds for suspicion of industrial spying by presenting affidavits from its employees. The aim will be to determine if VW's project was copied from GM data - essential if industrial espionage is to be proved.	There was an industrial espionage case involving GM and VW.	entailment
1515	Recently of the Canadian Broadcasting Corporation (CBC), where he worked in media and public relations, Mr. Jay Walsh was announced as the replacement for Sandy Ordonez as the communications officer for the Wikimedia Foundation on an internal mailing list on Tuesday, 8 January. "I'm extremely grateful for [Sandy Ordonez's] hard work and excellent judgement," said Sue Gardner, Executive Director of Wikimedia Foundation, in her announcement. Ordonez managed the WMF's public and media relations from January 2007, and will stay on in Florida until the end of the month when the Tampa office is closed.	Sandy Ordonez was replaced by Jay Walsh.	entailment
1205	Israeli scientists predict the world's coral reefs could begin to collapse in as little as 30 years from now. Studies show the oceans are becoming increasingly acidic as they soak up manmade emissions of carbon dioxide. The Hebrew University of Jerusalem researchers say this will make it difficult for many coral organisms to produce skeletal and other hard parts. The team's work on corals in the Red Sea suggests a tipping point will be reached in between 30 and 70 years.  Then the forces of erosion eating away at corals will outstrip the organisms' ability to make the reefs.	The acidification of oceans affects tourism.	not_entailment
2483	Bülent Ecevit, former prime minister of Turkey and poet, has died at 81. Ecevit was in a coma for nearly six months following a stroke. Ecevit was the prime minister of the government ordering a military intervention on July 20, 1974, to prevent a coup in Cyprus by Greek forces, dividing the island and setting the stage for the foundation of the breakaway Turkish Republic of Northern Cyprus.	Bülent Ecevit was a poet.	entailment
1162	Moscow (USSR), 12 Jul 89 (PRAVDA)- Blood is flowing in Columbia, where last year, according to official statistics, there were 4,600 victims of political violence, including Jaime Pardo Leal (president of Colombia's national coordination committee), around 30 deputies and many municipal advisors and mayors.	Around 30 deputies were killed on 12 Jul 89.	not_entailment
1728	Airbus could site a design engineering centre in the Midlands region of the UK to take advantage of the availability of skilled engineering staff following the demise of MG Rover, the collapsed UK carmaker.	Airbus plans a design engineering centre.	entailment
1102	Scientists had observed that mice with a defective Klotho gene aged prematurely and wondered if an enhanced gene would have an opposite effect.	Scientists have discovered a gene that produces a hormone that raises the life expectancy in mice by 30 percent.	not_entailment
1257	Nine men from Darfur have been executed for the beheading of a Sudanese newspaper editor in 2006. They were hanged in a prison in the capital, Khartoum, in front of the relatives of the editor, Mohammed Taha. It was initially thought that Mr Taha had been killed by Islamists but a defence lawyer said an article in his newspaper had angered Darfur groups. His decapitated body was found on a dirt road a day after he had been abducted from his home in Khartoum.	Mohammed Taha was Sudanese.	entailment
833	Today in the city of Sao Paulo (from May 1 to May 30) we have a display on Ayrton Senna.	Ayrton Senna was from Sao Paulo.	not_entailment
2317	China yesterday threw down a challenge to America's 50-year dominance of the global economy as it proposed replacing the dollar as the world's main reserve currency with a new global system under the control of the International Monetary Fund. In a muscle-flexing move that will be seen as an attempt to exploit the big shifts in economic power created by the recession sweeping the West, Beijing said that the dollar's role could eventually be taken over by the IMF's so-called Special Drawing Right (SDR), a quasi-currency that was created in 1969.	The Special Drawing Right is a quasi-currency.	entailment
776	20th Century spokesman Rick Dinon said that between the time it applied for the rate increase and changed its mind, the estimated quake losses had ballooned by several hundred million dollars.	Rick Dinon is the senior vice president of 20th Century Insurance Co.	not_entailment
1208	It is outstripped only by Denmark, the Netherlands, Belgium, Sweden, Finland and France, and thus ranks 7th in the 25-member European Union in terms of broadband Internet penetration.	12 members of the European Union use the Euro instead of their own national currencies.	not_entailment
1934	Nichols was found guilty May 26 of 161 counts of first-degree murder for 160 victims and an unborn child in a state trial.	The state charges against Nichols are for 160 victims and one victim's fetus.	entailment
1174	The sale was made to pay Yukos' US$ 27.5 billion tax bill, Yuganskneftegaz was originally sold for US$9.4 billion to a little known company Baikalfinansgroup which was later bought by the Russian state-owned oil company Rosneft.	Rosneft belonged to the Russian State.	entailment
1873	Saudi Arabia was boosting its production.	Saudi Arabia was boosting its own production.	entailment
541	In November, the results of the 2008 United States Senate election in Minnesota showed Republican Norm Coleman with a 215 vote lead over the Democratic challenger Franken. The close margin ―less than 0.0075 percent ―triggered an automatic recount which resulted in Franken leading by 225 votes, the total ratified by the Minnesota Canvasing Board January 5. The Coleman campaign filed a motion January 6 in court to block the certification of Franken's victory and prevent Franken from taking a seat in the United States Senate. On March 31, a three-judge panel hearing the case ordered 400 additional ballots be counted.	Norm Coleman is a member of the Republican Party.	entailment
949	In 1983 Turkish Cypriots proclaimed a separate state, naming it the Turkish Republic of Northern Cyprus (TRNC). Peace talks have been held sporadically, but Cyprus remains divided.	Cyprus was divided into two parts in 1983.	entailment
2000	Brought under Ottoman rule in the 16th century, Jordan has been led only since the 1920s by Hashemite rulers, a family whose roots are in present-day Saudi Arabia.	The Hashemite dynasty rules Jordan.	entailment
372	In Jerusalem, the faithful celebrated Mass at the Church of the Holy Sepulcher, traditionally believed to mark the site where Jesus was crucified, buried and then resurrected. Brown-robed friars marched into the church to the sound of bagpipes, followed by clergymen in purple capes and others bearing crosses. And in the earthquake-ravaged central Italian city of L'Aquila, survivors gathered in makeshift chapels set up in tent cities that are housing some of the 55,000 people driven from their homes by Monday's 6.3-magnitude temblor.	A 6.3-magnitude earthquake struck the center of Italy.	entailment
1792	German Siemens and ThyssenKrupp may sell relevant core technology to China, which owns the first commercially operated maglev line.	Maglev is commercially used.	entailment
2024	IT must rate as the literary snub of the 20th century. T S Eliot, one of Britain's greatest poets, rejected George Orwell's Animal Farm for publication on the grounds of its unconvincing Trotskyite politics. Eliot, a former director of Faber and Faber, the publisher, wrote his rejection in a highly critical letter in 1944, one of many private papers made available for the first time by his widow Valerie for a BBC documentary. When Orwell submitted his novel, an allegory on Stalin's dictatorship, Eliot praised its "good writing" and "fundamental integrity".	T.S. Eliot wrote "Animal Farm".	not_entailment
360	Jim Tracy became the latest to be shown the door in Paul DePodesta's restructuring of the Los Angeles Dodgers.	Jim Tracy was fired by Paul DePodesta.	entailment
418	Some observers say the partnership between Google and NASA Ames could create a new hub of technological innovation in Silicon Valley, an area gutted by the technology bust.	Google's blockbuster partnership with NASA Ames Research Center is leaving local officials, environmentalists and Silicon Valley landlords feeling left out of the party.	not_entailment
2378	Harvey Weinstein, the co-chairman of Miramax, who was instrumental in popularizing both independent and foreign films with broad audiences, agrees.	Harvey Weinstein is the co-chairman of Miramax.	entailment
2125	"I will take a brief vacation with some priest friends after Christmas and then I will go on retreat at a monastery," Law, reading from a brief statement, told reporters.	Law said he plans to take a brief vacation after Christmas and later retreat to a monastery.	entailment
2433	For many years, Sudam was controlled by Jader Barbalho, who was the governor of the state of Para and its senator.	Jader Barbalho is the governor of Sudam.	not_entailment
2218	If toxic waste containg cyanide is not disposed of properly, it may drain into ponds, streams, sewers, and reservoirs.	Leaks into environment are caused by bad disposal of toxic waste containing cyanide.	entailment
652	A male rabbit is called a buck and a female rabbit is called a doe, just like deer.	A female rabbit is called a doe.	entailment
1253	Rescuers searched rough seas off the capital yesterday for survivors of a ferry collision that claimed at least 28 lives, as officials blamed crew incompetence for the accident.	100 or more people lost their lives in a ferry sinking.	not_entailment
137	The SEC's new rule to beef up the independence of mutual fund boards represents an industry defeat.	Industries were defeated by the SEC.	not_entailment
643	Westbridge manufactures certified organic fertilizers including liquid growth enhancers and biostimulants.	Organic fertilizers are used as soil enhancers.	not_entailment
2150	One year after shareholders approved a massive expansion in its pool of stock options, eBay is asking for more.	Shareholders approved expansion for one year.	not_entailment
