index	sentence1	sentence2	label
1629	Meteorological observations suggest Claudette remained a tropical storm as she affected parts of west Texas.	A tropical storm has caused significant property damage.	not_entailment
981	Lucinda Creighton has claimed that people resent her as being "overambitious" and "in too much of a hurry" to climb the political ladder. The outspoken Fine Gael deputy was speaking after a heated exchange with Enda Kenny led to her walking out of a parliamentary party meeting last week. Creighton, who at 29 is already acknowledged as a potential future leader of Fine Gael, slammed detractors who see her rapid success in a "negative" light -- and believes her friend and colleague Leo Varadkar has suffered the same fate. Speaking in the run up to the Fine Gael Ard Fheis, Ms Creighton also rejected suggestions which surfaced last week that she is seen as a 'loose cannon' within the party.  "I certainly don't regard myself as a loose cannon. I'm absolutely part of the Fine Gael team," she said.	Lucinda Creighton is the leader of a parliamentary party.	not_entailment
2277	Stefano Falconi, director of finance at the Massachusetts Institute of Technology (MIT), has joined Carnegie Mellon as its vice president for administration and chief financial officer. Falconi succeeds Jeff Bolton, who left the university last July to become chief financial officer at the Mayo Foundation in Rochester, Minn.	The Massachusetts Institute of Technology (MIT) appoints Stefano Falconi as chief financial officer.	not_entailment
1715	The interest of the automotive industry increases and the first amplifier project, a four-channel output module for the German car manufacturer, Porsche, is finished.	Porsche is a German car manufacturer.	entailment
2240	A statement said to be from al Qaida, claimed the terror group had killed one American and kidnapped another in Riyadh.	A U.S. citizen working in Riyadh has been kidnapped after a colleague in the same company was shot dead yesterday.	entailment
286	Claes denied categorically that they had ever known of the existence of an Agusta proposal, and told the NATO ambassadors that he did not know anything about an Agusta payment to the Socialist Party.	NATO Secretary General Willy Claes resigned.	not_entailment
556	PM tried to buy the Belin biscuit company from RJR Nabisco two years ago.	American tobacco companies began to diversify production.	not_entailment
2418	Last week, NATO and Iran had contact for the first time in thirty years, NATO officials stated Thursday. "[An Iranian] diplomat met with Assistant Secretary General for Political Affairs and Security Policy Martin Erdmann," said chief alliance spokesman James Appathurai. The Iranian embassy in Brussels declined to comment on the visit. The visit to Brussels by the Iranian diplomat was the first "since the regime of the Shah" collapsed by the Ayatollah Khomeini led Iranian Revolution in 1979.	Martin Erdmann works for Iran as a diplomat.	not_entailment
2005	A 55-year-old orangutan named Nonja, who was believed to be the oldest living orangutan in the world both in captivity and the wild, has died at the Miami MetroZoo in Miami, Florida. "Everybody's very sad, especially with an animal like an orangutan. You see a lot of yourself in these animals. The great apes are our closest relatives. She was really a grand old dame," said zoo spokesman Ron Magill.	A 45-year-old orangutan died in Florida.	not_entailment
1845	After the polio cases were identified, public health officials in the Dominican Republic and Haiti began giving the vaccines to large numbers of children. Public health officials now say the disease is under control and is not a public health threat.	Polio is under control in the world.	not_entailment
798	Two new Les Paul books arrive in stores this year: The Les Paul Legacy by Rob Lawrence is due from Hal Leonard Publishing on October 27.	Rob Lawrence works for The Les Paul Legacy.	not_entailment
69	The Tempe Hometown Premiere will have all the trappings of a mega-Hollywood  event including red carpet arrivals, klieg lights, screaming fans, paparazzi and  media coverage of the film`s stars headed by Wolverine himself, Hugh Jackman and  including Liev Schreiber, Ryan Reynolds, Taylor Kitsch, Lynn Collins, will.i.am  and director Gavin Hood.  Following a hard-fought contest stretching over thousands of cities and towns  across the United States, Tempe emerged triumphant in a far-reaching, citywide  bid to nab the gala event. Mayor Hugh Hallman himself rallied the community,  which stepped up with dozens of videos that were posted on YouTube.	Hugh Jackman plays the role of Wolverine in the movie.	entailment
1290	SEATTLE - Apple Inc., maker of Macintosh computers and the iPhone, reports fiscal second-quarter earnings Wednesday after the closing bell. The following is a summary of key developments related to that period. OVERVIEW: In January, Apple founder Steve Jobs addressed the matter of his increasingly gaunt appearance — twice. He first said it was caused by an easily treatable hormone imbalance, and that he would remain at the helm. The next week, Jobs, a cancer survivor, revealed the problem was more complicated and said he would take a medical leave of absence until the end of June. Chief Operating Officer Tim Cook is running the company in his absence.	Steve Jobs is the creator of Apple.	entailment
355	Miles of Australia's most pristine coastline have been declared a disaster zone following a large oil spill from a storm-damaged cargo ship. At least 60 kilometres of Queensland's southeastern shore were contaminated when at least 42 tonnes of oil spilled into the ocean from MV Pacific Adventurer on Wednesday night.  The ship, which had sailed into cyclonic weather, lost 31 containers aboard, one of which pierced the ship's hull and a fuel tank.  Anna Bligh, the Queensland premier, has declared Moreton Island, Bribie Island and southern parts of the Sunshine Coast disaster zones.	MV Pacific Adventurer has lost oil in the area of Moreton Island, Bribie Island and southern parts of the Sunshine Coast.	entailment
2309	Among the fascinating sites in the city are Independence Hall where the Declaration of Independence was signed, and one of America's principal symbols of freedom, The Liberty Bell, located in Congress Hall.	The US Declaration of Independence is located in America.	not_entailment
2009	In the gas explosion disaster, the towing vessel Miss Megan, which was of specifications that did not require inspection by the United States Coast Guard, was being operated in the West Cote Blanche Bay oil field in Louisiana by Central Boat Rentals on behalf of Athena Construction on October 12, 2006. The Miss Megan was pushing barge IBR 234, which was tied along the starboard side of barge Athena 106, en route to a pile-driving location. Athena Construction did not require its crews to pin mooring spuds (vertical steel shafts extending through wells in the bottom of the boat and used for mooring) securely in place on its barges and consequently this had not been done. During the journey, the aft spud on the Athena 106 released from its fully raised position. The spud dropped into the water and struck a submerged, high-pressure natural gas pipeline. The resulting gas released ignited and created a fireball that engulfed the towing vessel and both barges. The master of the towing vessel and four barge workers were killed. The Miss Megan deckhand and one barge worker survived. One barge worker is officially listed as missing.	NTSB is responsible for investigating transportation accidents in the United States.	not_entailment
1888	Two of Japan's biggest financial institutions on Friday announced plans to merge and create the world's largest bank, underscoring growing sentiments that the country's long troubled banking system has significantly improved.	The merger of Japanese Banks creates the world's biggest bank.	not_entailment
1718	The Anzio beachhead, 33 miles south of Rome, saw some of the bloodiest fighting of World War II, and accounted for many of the 10,000 US battle deaths in Italy in the first half of 1944.	The Anzio beachhead is located 33 miles south of Rome.	entailment
2337	Among Stellafane's most ardent partisans is David H. Levy, co-discoverer with Dr. Eugene Shoemaker of a comet named for the two that broke apart in 1994 as it was drawn toward Jupiter, creating fireworks visible from Earth.	The Shoemaker-Levy comet was discovered by Shoemaker, his wife, Carolyn, and an astronomer David H. Levy.	not_entailment
1008	Franz Liszt (Hungarian: Liszt Ferenc) was a Hungarian/Austrian virtuoso pianist and composer who lived from 1811 to 1886. Liszt is widely considered to be one of the greatest piano virtuosi of all time, and certainly the most famous of the nineteenth century.	Franz Liszt lived from 1811 to 1886.	entailment
587	Though Wilkins and his family settled quickly in Italy, it wasn't a successful era for Milan, and Wilkins was allowed to leave in 1987 to join French outfit Paris Saint-Germain.	Wilkins departed Milan in 1987.	entailment
1919	If any legal action is due to enforcement, dispute, breach, or default, the successful party shall be entitled to reasonable attorney fees and other costs incurred in the actions, in addition to any relief to which they may be entitled.	The prevailing party shall recover attorney fees.	entailment
606	The Red Planet is thought to have no magnetic field. It has the greenhouse effect which raises the temperature about 5 degrees. It has a very thin atmosphere consisting of 95.3% carbon dioxide, 2.7% nitrogen, 1.6% argon, 0.15% oxygen, and 0.03% water.	Mars is called the red planet.	not_entailment
2193	Nicholas Cage's wife, Alice Kim Cage, gave birth Monday, to Kal-el Coppola Cage, in New York City, said the actor's Los Angeles-based publicist, Annett Wolf.	Kal-el Coppola Cage is the son of Nicholas Cage.	entailment
1308	Boris Becker is a true legend in the sport of tennis. Aged just seventeen, he won Wimbledon for the first time and went on to become the most prolific tennis player.	Boris Becker is a Wimbledon champion.	entailment
1025	When the Berlin Wall fell in early November, 1989 Berlin's east and west sections were rejoined to create the third-largest city in Europe , with a population of about 3 million.	The Berlin Wall was torn down in November, 1989.	entailment
76	SEATTLE — United Nations gang leader Clay Roueche should spend at least 30 years behind bars after his surprise guilty plea here Tuesday for conspiracy to smuggle cocaine, marijuana and illicit drug profits, U.S. Attorney Jeffrey Sullivan said. Sullivan said outside court that Roueche's leadership of the violent UN gang and the sophistication of the international drug conspiracy will all be factors used to argue for a longer sentence — up to life — for the 33-year-old Canadian. And he stressed that the plea agreement reached with Roueche did not include "any kind of break with respect to sentencing.".	Clay Roueche is 33 years old.	entailment
1764	His group's recently developed computer program, which provides group intelligence for a swarm of mini-robots to rapidly pin-point a source of contagion, can also be used by a group of humans carrying minicomputers, global positioning receivers, and simple radio equipment to find a skier buried in whiteness.	Robots are used to find avalanche victims.	not_entailment
515	Nike Inc. said, Monday, that its first-quarter profit grew 32 percent, as the world's largest sneaker and athletic apparel company posted broad gains in sales and orders.	Nike said that orders for delivery were up 11 percent from a year earlier, and it was optimistic about its growth prospects.	not_entailment
1644	The introduction of the euro has dismantled barriers to cross-border trading and enhanced risk sharing and opportunities for diversification.	The introduction of the euro has been opposed.	not_entailment
551	Christopher Reeve, an actor and director who became an inspiration worldwide after being paralyzed in a horse riding accident, died Sunday of heart failure.	Christopher Reeve had an accident.	entailment
110	Police say that he was wearing orange overalls, a balaclava and a pistol when he stole $6300 from Cherrywood at about 3:15 p.m. Outside the bank Leatham was trying to hijack a car, he threatened an old man with his pistol, eventually stealing a black Mitsubishi Mirage. The car was later found abandoned around Fairmont Terrace in the Glenn Terrace or Ridge Street area.	Children in New Zealand are forced to wear orange overalls.	not_entailment
665	The 84-year-old pope was wheeled to a hospital window, and blessed the crowd by making the sign of the cross in clear gestures, as a Vatican photographer snapped pictures.	The pope made the sign of the cross.	entailment
1004	On June 28, 1997, in what would become known as the bite fight, Mike Tyson bit Evander Holyfield's ear, purportedly in retaliation for Holyfield headbutting him.	Mike Tyson bit Evander Holyfield's ear on June 28, 1997.	entailment
829	G & H Restaurant Specialties has not released a statement regarding the violations, but the corporate offices in Louisville, Kentucky for KFC said, "our franchisee has finalized a plan for some structural repairs... The units will be temporarily closed while these building maintenance issues are addressed. [They will be] re-opened as soon as the repairs are complete." The health department also gave violations out to the East Delevan store for failing to maintain a clean floor throughout the restaurant and for not stopping food from becoming contaminated. Several rat traps were also found inside the storage cooler and around the kitchen area, but the establishment was "not free of rodents," said Commissioner of the Erie County Health Department, Dr. Anthony Billittier.	Louisville is in Kentucky.	entailment
1778	The Italian air transport sector features many typical causes of industrial conflict, including: the troubled economic situation of Alitalia, Italy's flagship airline (IT0404304F); a set of specific factors concerning services delivery; and a marked fragmentation of trade union representation.	Italian flight assistants go on strike.	not_entailment
2183	Bogota, 4 May 88 - The dissemination of a document questioning Colombia's oil policy, is reportedly the aim of the publicity stunt carried out by the pro-Castro Army Of National Liberation, which kidnapped several honorary consuls, newsmen, and political leaders.	The Army Of National Liberation are supporters of Castro.	entailment
1836	Hydrogen cyanide is used in manufacturing chemicals such as tryptophan and other amino acids.	Cyanide is used in the production of pharmaceuticals.	not_entailment
1247	Mr. Balasingham will return to his London home and then move on to Sri Lanka in early October to consult with LTTE leader Vilupillai Prabhakaran, diplomats said.	Vilupillai Prabhakaran is a diplomat.	not_entailment
642	Some of the stolen trade secrets were seized from the defendants at the San Francisco International Airport (SFO) while they were attempting to fly to China.	Trade secrets were stolen.	entailment
2175	By buying local companies, Philip Morris and its subsidiary inherit informal trade contacts cultivated under Soviet rule that may help to smooth any future moves east.	American tobacco companies used state tobacco monopoly liberalization.	not_entailment
615	The London Eye in London, England sits 443ft over the River Thames. It has attracted more than 27 million visitors since its formal opening on December 31, 1999. Each compartment is set to be air-conditioned and hold up to 30 people. Three possible locations for the wheel to sit have been selected. This is not the first attempt by the Iraqi Tourism Board to bring tourists into the capital. The board are seeking investors for a resort island. The island would include a six star hotel and a 18 hole golf course.	The River Thames flows through London.	entailment
1118	Bountiful arrived after war's end, sailing into San Francisco Bay 21 August 1945. Bountiful was then assigned as hospital ship at Yokosuka, Japan, departing San Francisco 1 November 1945.	Bountiful reached San Francisco in August 1945.	entailment
1078	Lt. Mark Banks, of Savannah, Ga., tends to a patient who was medically evacuated by U.S. Navy helicopter to a temporary triage site in Aceh, Sumatra, Indonesia.	U.S. Military evacuated U.S. citizens.	not_entailment
63	The name for the newest James Bond film has been announced today. The 22nd film, previously known only as "Bond 22", will be called "Quantum of Solace". EON Productions who are producing the film made the announcement today at Pinewood Studios, where production for the film has been under way since last year. The name of the film was inspired by a short story (of the same name) from For Your Eyes Only by Bond creator, Ian Fleming.	James Bond was created by Ian Fleming.	entailment
1746	A zoo worker is dead and two visitors are seriously injured after a Siberian tiger escaped from the San Francisco Zoo in San Francisco, California in the United States and attacked three people who were inside a cafe. The tiger was shot dead by police who were called to the scene. They found the tiger attacking one of the zoo visitors when they killed it.	A tiger attacked three people in San Francisco.	entailment
82	Alex Da Silva, a salsa dance instructor and choreographer for Fox's "So You Think You Can Dance," was arrested Saturday on suspicion of sexually assaulting four of his students, according to a statement from the Los Angeles Police Department. Da Silva, 41, is accused of assaulting the students in his two homes in the San Fernando Valley over the last six years, police said. He is being held in lieu of $3.8 million bail. Authorities said the four victims were all students of Da Silva at the time of the assaults.	Alex Da Silva is a student of salsa dance.	not_entailment
349	Like Jews and Christians, Muslims believe there is only one God.	Muslims are monotheistic.	entailment
2469	Oil prices edged up today as Norwegian employers said they would respond to a strike by locking out all workers next week, threatening to shut off almost all oil and gas output.	Norwegian employers caused oil prices to rise.	entailment
1143	A strong supporter of the "Italian road to socialism", he was close to Enrico Berlinguer, and gained a position in the party secretariat. In 1969, he drew up the report proposing the expulsion from the party of the Manifesto group. In 1984, after Berlinguer's death, Natta was elected as party secretary.	Natta supported Italian Socialism.	entailment
1277	The Rolling Stones kicked off their latest tour on Sunday, with a flashy, high-energy concert at Boston's Fenway Park that made no concession to the band's more than four decades playing pounding rock 'n roll.	The Rolling Stones kicked off their tour in Boston.	entailment
2258	Confidential scriptural materials allegedly stolen from a church were not "trade secrets" as defined by California statute.	Trade secrets were stolen.	not_entailment
2376	The chaotic situation unleashed in Bogota last night, with the assasination of Justice Carlos Valencia, began on 28 July in Medellin, when motorized paid assasins murdered third public order Judge Maria Elena Diaz.	Justice Carlos Valencia was killed on 28 July.	not_entailment
1464	The seven refineries located in Lake Charles, La., and the Texas cities of Beaumont and Port Arthur, appear to be the ones hardest hit by the water and wind that accompanied Rita.	Rita caused damages to seven refineries located in Lake Charles, La.	entailment
649	The resignation came amid recent allegations by Massachusetts' attorney general that the Boston archdiocese engaged in "an elaborate scheme" to keep quiet the issue of child sexual abuse by priests.	The state attorney general claimed that the archdiocese engaged in a coverup.	entailment
2450	Macedonia seems confident it can weather the storm, but some fear Athens may soon take things up a notch.	Greece and Macedonia are in dispute over name.	not_entailment
431	Police in Rio de Janeiro arrested five men and recovered millions of dollars worth of art stolen earlier this month, including works by Salvador Dali and Henri Matisse. Police recovered all the stolen art except two Chinese ceramic sculptures from the 7th Century and a collection of silverware.	Millions of dollars of art were recovered, including works by Dali.	entailment
996	Crude oil prices shot to new highs yesterday as markets reacted to a threat by Russian authorities to shut down most of the production from that country's largest oil company	Crude oil prices rise.	entailment
488	Today marks the 80th birthday of Her Majesty Queen Elizabeth II, whose reign has lasted over 54 years. Her Majesty became the first female to become the sovereign since Queen Victoria, who died in 1901 after a 64-year reign. She was crowned on June 2, 1953, in Westminster Abbey. It was the first coronation that was televised live. She is Queen of sixteen independent nations known as the Commonwealth Realms, which includes the United Kingdom.	United Kingdom includes the Commonwealth Realms.	not_entailment
54	On 12 August, the San Carlos Battalion came across mines placed in their path and one soldier was killed while two were seriously injured. Meanwhile on 10 August, urban commandos took a patrol car by surprise and dropped a grenade inside the car, injuring four and partially destroying the vehicle.	A patrol car was attacked by the San Carlos Battalion.	not_entailment
756	Anglo/Dutch Royal Dutch Shell, Total, of France, and Spain's Repsol were all named as examples of established oil companies involved in the oil-for-food programme before surcharges began in 2001.	Total participated in the oil-for-food programme.	entailment
2211	Alleged terrorists today, killed Dolores Hinostroza, the mayor of Mulqui district, shooting her five times.	The mayor of Mulqui district was murdered with a firearm.	entailment
557	Bunker started XenuTV in 1999 and began to make videos that he provided for the Lisa McPherson Trust. Bunker has been a critic of the Church of Scientology since 1997. In 2006, he won a Regional Emmy Award after he and KUSI-TV news reporter Lena Lewis produced a documentary news video on the issues with the United States - Mexico border with San Diego, California.	Church of Scientology includes Lena Lewis among its members.	not_entailment
2388	China has taken delivery of the first section of a futuristic high-speed train which levitates above the track.	The train literally floats above the track.	entailment
816	Ramadan told reporters at the opening ceremony of the Baghdad International Exposition, "No cooperation and no inspection or monitoring by the American Zionist espionage commission (the Special Commission for disarming Iraq's banned weapons - UNSCOM) before Iraq's demands are met."	Ramadan announced that Iraq will not cooperate with the inspectors.	entailment
1820	A Belgian policeman posing as an art dealer in Brussels arrested three Swedes.	Three Swedes were arrested in a Belgian police sting operation.	entailment
1652	September 26 - Trial against former Italian Prime Minister Giulio Andreotti, accused of Mafia connections, begins.	Andreotti collaborates with the Mafia.	not_entailment
129	Three anti-Olympic games protesters, posed as a flower delivery service, quickly ransacked British Columbia, Canada premier Gordon Campbell's downtown Vancouver, British Columbia office yesterday afternoon, breaking windows and throwing pictures, office documents, and various other items. After the suspects were caught, they said that they were upset over Campbell's support for the 2010 Winter Olympic Games in Vancouver, British Columbia. They also claimed to work for "The Anti-Poverty Committee". They are now facing charges for property damage and uttering threats during or after the incident. Police are only identifying them as a 23-year-old man, a 29-year-old man, and a 17-year old female. The 23-year-old faces a third charge of assault by trespassing.	Vancouver is located in Canada.	entailment
564	Officials claimed they were backed by influential members of the Santa Cruz business community of Croatian descent. The security vice-minister, Marcos Farfan, said that police have surveillance photographs of Mr Dwyer at various public events attended by Mr Morales, including a peasant rally near Santa Cruz and a visit to naval installations on Lake Titicaca. Mr Farfan said that Mr Dwyer was "following" Mr Morales and other officials as part of the preparations for the "assassination plot". He added that police experts are analysing contents reportedly found in computers taken from the rooms in which the men were killed.	Lake Titicaca has a naval installation.	entailment
1459	Tropical Storm Debby is blamed for several deaths across the Caribbean.	A tropical storm has caused loss of life.	entailment
2016	"The word in the galley food queues is that we could do with more men, and the kit does keep wearing out, but that's due to the conditions here," said Corporal Martin Page.	Martin Page was sent on a mission to Afghanistan.	not_entailment
1297	The release of its report led to calls for a complete ivory trade ban, and at the seventh conference in 1989, the African Elephant was moved to appendix one of the treaty.	The ban on ivory trade has been effective in protecting the elephant from extinction.	not_entailment
683	Prime Minister Silvio Berlusconi was elected March 28 with a mandate to reform Italy's business regulations and pull the economy out of recession.	The Italian Prime Minister is Silvio Berlusconi.	entailment
1757	Moreau, 72, received a Golden Bear award for lifetime achievement at the Berlin Film Festival Friday.	The Golden Palm has been awarded at the Cannes film Festival.	not_entailment
