index	sentence1	sentence2	label
2170	Martin was taken to New Orleans Ochsner Foundation Hospital, where nurse Jinny Resor said he was treated for dehydration.	Jinny Resor is employed at Ochsner Foundation Hospital.	entailment
1655	A Russian Soyuz spacecraft docked with the International Space Station, after a two-day flight from the Baikonur Cosmodrome in Kazakhstan.	Soyuz spacecraft were built by Russia.	entailment
1140	Every year Israel jails individuals simply because they refuse to perform military service for reasons of conscience.	People are willing to risk imprisonment rather than perform military service.	entailment
995	The Dow Jones Industrial Average closed at its lowest level in over six years on Thursday, having lost 1.16%, or 89.68 points, bringing it to a level of 7,465.95. It had, at one point, set an intraday bear market low of 7,447.55. It was the lowest ending for the index since October 9, 2002. The Dow has fallen almost fifteen percent since the start of this year.	The Dow Jones has gained points.	not_entailment
1555	A series of projects with the objective of finding solutions to some of the consequences of the Chernobyl accident have been carried out within the framework of the UNESCO Chernobyl Programme. The IHP organized a workshop to review and compare present knowledge of radionuclide transfer in the hydrological cycle.	The Chernobyl disaster had repercussions outside the ex-USSR.	not_entailment
2340	Heavy rain flooded parts of the site, with dozens of tents lost under water, while lightning strikes affected the stages and knocked out power lines.	100 tents had been washed away.	not_entailment
2242	This weekend, March 25 and 26, was a big weekend in the Ottawa area for Canadian Idol want a Be's. Canadian Idol is a national singing competition that is organized by CTV Inc. a Canadian broadcasting communications company for Canadian citizens. The television show, greatly based on "American Idol," has been on going for several seasons. In the past auditions have been know to have line-ups of thousands of people, however, this year after taking a tour around the new location it appears that line ups were manageable. Having the auditions at the St. Laurent Shopping mall [1] makes this easier said Idol's security coordinator Rick Paciorek.[2] Organizers have decided to change the way the auditions will "rock and roll."	"Canadian Idol" is a competition for singers.	entailment
1588	Two 8-year-old girls in Orlando, Florida, located in the United States have made a big donation to the research and curing of breast cancer. Victoria Petrucelly and Jesse Theobald along with classmates from their third grade class at The Christ School, raised almost US$24,000 by setting up lemonade stands and selling pink lemonade. The two girls were thinking about starting the lemonade stand in 2008, but were inspired to donate money when Petrucelly's mother, who suffered from the disease, died on Valentine's Day, February 14.	Victoria Petrucelly is a student from the Christ School.	entailment
1201	Victor Emmanuel was born on Nov. 11, 1869, in Naples. After his father, Umberto I, was assassinated in 1900, Victor Emmanuel succeeded to the throne.	Victor Emmanuel III was king of Italy from 1900 to 1946.	not_entailment
1885	"This is a major milestone on our road to recovery, and I want to thank the members of Congress who came together in common purpose to make it happen," Obama said in his weekly address. "I will sign this legislation into law shortly, and we'll begin making the immediate investments necessary to put people back to work doing the work America needs done. This historic step won't be the end of what we do to turn our economy around, but the beginning."	The Congress wants to boost the economy.	entailment
513	When comparing Michele Granger and Brian Goodell, Brian has to be the clear winner. In 1976, while still a student at Mission Viejo High, Brian won two Olympic gold medals at Montreal, breaking his own world records in both the 400- and 1,500-meter freestyle events. He went on to win three gold medals in he 1979 Pan American Games.	Brian Goodell won three gold medals in the 1979 Pan American Games.	entailment
67	Sonia Gandhi can be defeated in the next elections in India by BJP.	Sonia Gandhi is defeated by BJP.	not_entailment
537	The world's oldest known child has been discovered in East Africa in an area known appropriately as the Cradle of Humanity.  The 3.3-million-year-old fossilized toddler was uncovered in north Ethiopia's badlands along the Great Rift Valley (map of Ethiopia). The skeleton, belonging to the primitive human species Australopithecus afarensis, is remarkable for its age and completeness, even for a region spectacularly rich in fossils of our ancient ancestors, experts say.  The new find may even trump the superstar fossil of the same species: "Lucy," a 3.2-million-year-old adult female discovered nearby in 1974 that reshaped theories of human evolution. (Related: "Fossil Find Is Missing Link in Human Evolution, Scientists Say" [April 2006].) .	Lucy fossils have been discovered 3.3 million years ago.	not_entailment
1754	Ewald, now 74, headed the East German Sports Federation from 1961 to 1988. He was found guilty of making 142 East German sportswomen, mostly swimmers and athletes, take banned performance-enhancing drugs.	Several sportswomen have been accused of doping.	not_entailment
1265	She has become world renowned for her patented invention of spray on skin for burns victims, a treatment which is continually developing. Via her research, Fiona found that scarring is greatly reduced if replacement skin could be provided within 10 days. As a burns specialist the holy grail for Dr Fiona Wood is 'scarless, woundless healing'.	Dr Fiona Wood has invented a treatment for burns victims.	entailment
1262	"Do you remember Tsar Nikolai's era? When the Red Army came and when Vladimir Lenin died? Well I do. So take a guess how old I am." Meet Sohan Dosova - the newly found treasure of Kazakhstan. She is 130 years old, at least she is according to her documents. The Soviet passport issued in the early 1980s states that Sohan Dosova was born in the Karaganda region on 27 March 1879. Now after a new national census in Kazakhstan, she has been "rediscovered".	Sohan Dosova is 130 years old.	entailment
2304	As leaders gather in Argentina ahead of this weekends regional talks, Hugo Chávez, Venezuela's populist president, is using an energy windfall to win friends and promote his vision of 21st-century socialism.	Chávez is a follower of socialism.	entailment
1539	Tintin, the Smurfs, Boule et Bill, Astérix, Natacha, Spirou and other legendary characters were created by talented artists like Hergé, Morris, Franquin and Walthéry.	Spirou was created by Rob-Vel.	not_entailment
702	The world's fast-growing thirst for water can only be met by purifying sea water as rivers and reservoirs become unable to meet demand, Spain said last week unveiling a major program to fight its own chronic shortages.	The Ebro Delta is used for farming.	not_entailment
309	The current President of Brazilian Central Bank, Henrique Meirelles, is accused of financial fraud among other accusations.	The current President of Honduras is Manuel Zelaya.	not_entailment
2407	Beth Israel is fighting back in the lab, where bacteria taken from patients are grown in cultures and tested against antibiotics to determine if the bug beats the drug.	Bacteria is winning the war against antibiotics.	not_entailment
573	Greece objects to the neighbouring Skopje government using the name Macedonia, saying it implies claims on a Greek province of the same name.	Greece and Macedonia are in dispute over name.	entailment
1454	Albert Sabin developed an oral, attenuated (live) vaccine, which, with Salk's discovery, brought polio under control.	Polio is under control in the world.	entailment
1875	Evans Paul, the pro-Aristide mayor of Port-au-Prince, said he had been told that the money will go to American lobbyists, politicians and journalists to campaign against the return of Aristide, Haiti's first democratically elected president	Aristide is the mayor of Port-au-Prince	not_entailment
1237	The presence of oil in the South Atlantic was first proved in 1974, but the distance and isolation of the Falklands deterred oil companies from exploring the area until the 1990s.	Petroleum is explored in the South Atlantic.	entailment
1276	Unfortunately, a visit from Mrs Hobday, causes Mr Browne to leave for London.	Mrs Hobday departs London.	not_entailment
1228	FROM two tiny rooms high up and far back in St. Augustine's Episcopal Church, with its neo-Georgian archways, straight-backed pews and simple, graceful detail, the legacy of slavery in Manhattan looks down. The stone church, on Henry Street near Montgomery Street on the Lower East Side, was built for a patrician white congregation. But although it was completed in 1828, a year after slavery was legally abolished in New York State, behind the balcony and on either side of the organ are two cramped rooms, built so that black churchgoers could worship there without being seen by white parishioners.	St. Augustine's Episcopal Church is in Manhattan.	entailment
972	On the other hand, the article, "Fiction and Facts About Drug Legalization", by Joseph Califano identifies possible social problems that could occur as a result of marijuana being decriminalized in any form, whether for medical purposes or for recreational use.	Drug legalization has benefits.	not_entailment
2100	When she was barely 20 years old, Dutch singer Edsilia Rombley got her first large taste of international acclaim. Already a winner of the smaller imitation contest Soundmix Show, she decided to shoot higher. With a great deal of determination, she performed in front of hundreds of millions of television viewers at the 1998 Eurovision Song Contest in Birmingham, United Kingdom. Her song, the R&B flavored "Hemel en aarde" (Heaven and earth), placed fourth and gave her country their highest placing at Eurovision since their last win in 1975. No Dutch contestant after her has been able to place similarly.	Edsilia Rombley is a Dutch singer.	entailment
125	Jacques Santer succeeded Jacques Delors as president of the European Commission in 1995, the second Luxembourger to hold this high office.	Jacques Delors succeeded Jacques Santer in the presidency of the European Commission.	not_entailment
1903	Swift was offered and accepted the post of secretary and chaplain to the Earl of Berkeley, one of the Lords Justices, but when he reached Ireland he found that the secretaryship had been given to another.	Swift worked for the Earl of Berkeley.	not_entailment
2417	On 21 July, the Macdonough patrolled the waters off Guam to protect the assault craft from enemy submarines, continuing that role until departing for Hawaii on 10 August. After a day at Pearl Harbor, she departed for the Admiralty Islands.	The Macdonough left Hawaii on 10 August.	not_entailment
2138	Injections of human stem cells seem to directly repair some of the damage caused by spinal cord injury, according to research that helped partially paralyzed mice walk again.	Anderson and colleagues used fetal neural stem cells, a type that are slightly more developed than embryonic stem cells because they're destined to make cells for the central nervous system.	not_entailment
220	Paul Bremer, the top U.S. civilian administrator in Iraq, and Iraq's new president, Ghazi al-Yawar, visited the northern Iraqi city of Kirkuk.	Ghazi al-Yawar is Iraq's new president.	entailment
452	Acid attacks on women are carried out across Asia, with reports of such incidents from Burma, Cambodia, India and Pakistan.	Acid attacks are carried out on women	entailment
149	Two bombs planted near an Islamic school in Pakistan killed eight people and injured 42 others yesterday in the latest outbreak of violence gripping the southern port of Karachi.	Eight people planted two bombs near an Islamic school in Pakistan.	not_entailment
2131	Chancellor Schroeder has presided over three years of almost zero growth in the economy and an unemployment rate that has remained stubbornly above four million people.	More than four million people have remained stubbornly unemployed in the last three years.	not_entailment
1407	A joint venture led by Australia's Global Petroleum Ltd. said, yesterday, it had won the right to explore for oil and gas in the inhospitable waters south and east of the Falkland Islands.	Petroleum will be explored in the South Atlantic.	entailment
2064	With its headquarters in Madrid, Spain, WTO is an inter-governmental body entrusted by the United Nations to promote and develop tourism.	The WTO headquarters is located in Madrid, Spain.	entailment
1335	Norwegian police released one of three people arrested when Edvard Munch's painting 'The Scream', stolen from the National Gallery in Oslo, was found.	Norwegian police arrested three people for the theft of Munch's painting, 'The Scream'.	entailment
678	The ship, owned by Mitsui O.S.K. Lines and flagged in the Cayman Islands, came under attack at around 4 p.m. Somali time (UTC+3) as gunfire came from two small priate boats. The vessel, with a crew of eighteen from the Philippines, suffered light damage to its front and windows were broken. The Jasmine Ace was en-route from Sharjah, United Arab Emirates to Mombasa, Kenya. The 126.75m car carrier had loaded with 377 used cars in Sharjah on March 17.	Mitsui O.S.K is the owner of the Cayman Islands.	not_entailment
1132	The renewed attention to the war came as peace activists, camping near the president's ranch, awaited a performance Sunday evening by peace movement icon Joan Baez.	Folk singer Joan Baez brought her latest anti-war message Sunday to President Bush's adopted hometown, supporting Iraq war protesters camping out near his ranch.	not_entailment
1985	In August, Gates' foundation gave Yunus' Grameen Foundation 1.5 million for a program to extend its microfinance programs to 5 million more of the world's poorest families. Three years ago, tech entrepreneur Craig McCaw provided 2 million to start up the Grameen Technology Center, which is using microcredit to finance cheap mobile service for people in Uganda and Rwanda.	Gates' foundation extends its microfinance programs to 5 million more of the world's poorest families.	not_entailment
549	Today about 75% of people live in cities or towns. Art and culture are an important part of France.	75 people live in France.	not_entailment
2184	Preliminary results from the National Assessment of Adult Literacy (NAAL), released 15 December 2005 by the US National Center for Education Statistics, indicate gains and losses in literacy among minority adults between 1992 and 2003.  The nationally representative study among US adults age 16 and older found the over-all average prose and document literacy remained relatively unchanged, but quantitative literacy improved 8 points (on a scale of 500.) Results among minorities were mixed, with White and Asian/Pacific Islander minorities scoring significantly higher than Hispanic or Black ethnicities; Hispanic subjects in particular had sharp decreases in prose and document literacy (-9% and -8%, respectively) and quantitative illiteracy remained unchanged with 50% of subjects scoring at less than basic literacy levels.	The National Assessment of Adult Literacy is a project held by the US National Center for Education Statistics.	entailment
1447	iTunes software has seen strong sales in Europe.	Strong sales for iTunes in Europe.	entailment
985	Two men have been charged with starting the Zaca Fire, the second-largest wildfire in the history of California. The fire is continuing to burn through the Los Padres National Forest, and has consumed a total of 240,000 acres, having started on July 4. However, the fire is now under control, and is expected to be contained by September 4. Jose Jesus Cabrera of Santa Ynez, 38, Santiago Iniguez Cervantes of Santa Maria, 46, and the company of Rancho La Laguna, whom they worked for, have all been charged with six counts of felony in relation to starting the fire.	Cabrera and Cervantes are accused of having caused the Zaca Fire.	entailment
877	The murders of Galan, a high-ranking police officer, and a judge last week, were probably carried out by an Israeli mercenary paid by the Medellin cartel - the world's most powerful drug-trafficking mafia - which has set up paramilitary squads accused of hundreds of individual murders and massacres against political and labor leaders, as well as peasants and patriotic union leftist militants in different parts of the country.	Galan was killed by patriotic union leftist militants.	not_entailment
1705	U.S. Secretary of State Condoleezza Rice said Thursday that North Korea should return to nuclear disarmament talks and avoid a path toward further international isolation.	North Korea says it will rejoin nuclear talks.	not_entailment
2321	"A force majeure is an act of God," said attorney Phil Wittmann, who represents the New Orleans Saints and owner Tom Benson's local interests.	New Orleans Saints are property of Tom Benson.	entailment
1450	The program will include Falla's "Night in the Gardens of Spain," Ravel's Piano Concerto in G, Berlioz's Overture to "Beatrice and Benedict," and Roy Harris' Symphony No. 3.	"Beatrice and Benedict" is an overture by Berlioz.	entailment
1661	The accident in the Ukrainian nuclear power plant at Chernobyl on April 26, 1986 brought along great harm for many people. There were immediate damages and consequential burdens for human beings, the environment and the economy over long distances.	Nuclear Power Plant of Sosnovyi Bor suffers an emergency shut down.	not_entailment
2428	And this is a town that everybody agrees, law enforcement, Border Patrol, residents on both sides, is a staging area of illegal drugs and illegal aliens.	Steps are being taken to stop the smuggling of aliens.	not_entailment
829	G & H Restaurant Specialties has not released a statement regarding the violations, but the corporate offices in Louisville, Kentucky for KFC said, "our franchisee has finalized a plan for some structural repairs... The units will be temporarily closed while these building maintenance issues are addressed. [They will be] re-opened as soon as the repairs are complete." The health department also gave violations out to the East Delevan store for failing to maintain a clean floor throughout the restaurant and for not stopping food from becoming contaminated. Several rat traps were also found inside the storage cooler and around the kitchen area, but the establishment was "not free of rodents," said Commissioner of the Erie County Health Department, Dr. Anthony Billittier.	Louisville is in Kentucky.	entailment
672	France is to compensate people who suffered health problems as a result of three decades of nuclear weapons tests, its government says.  It was time to investigate health complaints reported by staff who took part in tests, Defence Minister Herve Morin said.  Mr Morin told Le Figaro France should be "true to its conscience".  France carried out more than 200 tests, firstly in Algeria and later in French Polynesia, between 1966 and 1996.  Mr Morin said about 150,000 civil and military workers were "theoretically affected" by the tests.  Mr Morin said an independent commission would examine claims on a case-by-case basis.  He added that 10m euros ($13.6m; £9.3m) had already been earmarked to compensate victims.	France carried out more than 200 nuclear tests during 30 years.	entailment
1230	The president Cristiani spoke today at the El Salvador military airport before he left for Costa Rica to attend the inauguration ceremony of president-elect Rafael Calderon Fournier.	Cristiani is the president of Costa Rica.	not_entailment
1128	Mr Fitzgerald revealed he was one of several top officials who told Mr Libby in June 2003 that Valerie Plame, wife of the former ambassador Joseph Wilson, worked for the CIA.	Joseph Wilson worked for CIA.	not_entailment
2437	Commander Thomas Karremans, who was in charge of Dutch troops in Srebrenica at the time, was filmed drinking a toast with war-crimes suspect and Serb general Ratko Mladic.	Dutch photos of Srebrenica have disappeared.	not_entailment
2369	"They brought us 7-Up, bottled water, ice and a diet of rice, though you didn't feel like eating," said Jim Lankes, 48, of Phoenix.	Jim Lankes was given bottles of waters, ice and rice.	entailment
264	Heemeyer cut portholes for his guns, then welded a tight enclosure around them so police bullets could not penetrate.	Out of an old bulldozer, Heemeyer built a concrete box that no police bullet could penetrate.	not_entailment
227	ECB spokeswoman, Regina Schueller, declined to comment on a report in Italy's La Repubblica newspaper that the ECB council will discuss Mr. Fazio's role in the takeover fight at its Sept. 15 meeting.	Regina Shueller works for Italy's La Repubblica newspaper.	not_entailment
299	Kerry hit Bush hard on his conduct on the war in Iraq.	Kerry shot Bush.	not_entailment
456	A computer system failure closed down share trading at the Tokyo Stock Exchange for most of yesterday, the worst disruption to date for Asia's largest bourse.	The Tokyo Stock Exchange was closed down by computer system failure.	entailment
943	White supported Gough Whitlam's Labor government of 1972 to 1975, and after Whitlam was ousted in the 1975 constitutional crisis, became particularly anti-royalist.	White assisted the Labor government from 1972 to 1975.	entailment
1432	The human rights promotion and protection secretariat of the FMLN strongly condemns the massacre of five Spanish-born Jesuit priests, and three Salvadoran citizens, carried out by the Salvadoran Armed Forces Soldiers.	The Salvadoran Armed Forces Soldiers murdered three Salvadoran citizens.	entailment
1442	Clinton informed the two parties that in the absence of an agreement, a public announcement would be made, with the apparent objective of applying pressure to both sides, particularly the Israelis.	Clinton told the two sides that he would publicly announce their failure to agree, thereby pressurising them.	entailment
398	Io is 2,236 miles (3,598 kilometers) in diameter, slightly larger than the Earth's moon.	The terrestrial moon has a diameter of 3746 kilometers.	not_entailment
1660	Buffalo, New York - The Common Council of Buffalo voted on Tuesday to send the Elmwood Village Hotel proposal "to committee for further discussion", after citing the need for more public involvement. The Elmwood Village Hotel is a development proposal by the Savarino Construction Services Corporation, a project designed by the architect Karl Frizlen of The Frizlen Group. The hotel would be placed on the southeast corner of Elmwood and Forest Avenues in Buffalo.	The Frizlen Group is situated in Buffalo.	not_entailment
1336	Carmine Rocco, Health Director was contacted in June by Sue Robbins, Division of Waste Management, to advise him that she would be in the county to conduct a site visit to the former Woodson-Tenent Laboratory.	Sue Robbins visits the former Woodson-Tenent Laboratory.	entailment
2130	Twenty-two other miners were working at the nearby Kangjiayao mine at the time of the accident, although it is unclear if any of those miners were affected. Thousands of miners die in mining accidents each year in China. Today's accident comes just one day after 19 coal miners were killed in a mining accident in the Sulongsi mine in Chongqing, and one month after the largest accident in recent history killed 214 miners, in Fuxin, Liaoning Province.	Liaoning Province is in China.	entailment
1837	U.S. policy on drug trafficking is not consistent with the need to put an end and actively repress the consumption of drugs. The solution is not based on the destruction of a native plant, coca, in the continent, but on an active fight against the Colombian drug mafia, which has created a great money and crime empire in Colombia with powerful ramifications outside its borders.	A native plant is destroyed by the Colombian drug mafia.	not_entailment
2396	"AFCA has received tremendous support from the climbing community around the world," Tanya Weaver, executive director of the AFCA, said. "We think the challenge of climbing to the summit of Mount Kilimanjaro is an appropriate symbol for the uphill battle HIV/AIDS children face."  This viral event is not just limited to climbing. The AFCA invites anyone and everyone to climb, hike, bike, or run for whatever distance to raise money for the children.  Corporations are encouraged to either sponsor, match donations, or organize a team of their own. Non-participants of the fundraiser can go the AFCA's website for the program and sponsor one of the climbers for the Climb Up Kilimanjaro part of the program.  The AFCA's assistance in HIV/AIDS stricken countries does not go unnoticed. Children who have received care from hospitals funded by the organization have sent letters of appreciation, which can be viewed on their website.	The climbing community supports AFCA.	entailment
2433	For many years, Sudam was controlled by Jader Barbalho, who was the governor of the state of Para and its senator.	Jader Barbalho is the governor of Sudam.	not_entailment
202	The organizing committee said 65 countries have entered the Lillehammer Olympic Games, matching the number of nations at the 1992 Winter Games in Albertville, France.	65 countries take part in the Lillehammer Olympic Games.	entailment
347	It also raised questions about the quality of financial regulation in Singapore, where derivatives losses run up by former trader Nick Leeson led to the 1995 collapse of Barings Plc.	Nick Leeson was arrested for collapse of Barings Bank PLC.	not_entailment
