index	sentence1	sentence2	label
1415	If you have an immediate problem with ice dams, you should remove the snow from the part of the roof directly above the ice dam. This limits the amount of water that can collect behind the dam.	Dam building prevents life-threatening situations.	not_entailment
2295	People who are deaf or have hearing impairments, those who are blind or have vision impairments, and those with mobility impairments may face unique challenges in an emergency. Their ability to detect a fire or escape its effects may be hindered by their impairments. As a result, people with these impairments are at a greater risk of death or injury due to fire.	Deaf people encounter problems in the social community.	not_entailment
1825	Former Peruvian President Alberto Fujimori has been sentenced to 25 years in jail for ordering killings and kidnappings by security forces. At the end of a 15-month trial, judges found him guilty of two death-squad killings of 25 people during the conflict with guerrillas in the 1990s. After being sentenced, Mr Fujimori said he would appeal against the verdict. Human rights group Amnesty International described the verdict as "a milestone in the fight for justice".	Alberto Fujimori has been sentenced to life in prison.	not_entailment
1462	Climatologists believe artificially induced climate change is the reason Australia is destined for the warmest year on record. Temperatures so far this year have averaged one degree above the 30-year average, the Bureau of Meteorology (BOM) told the Greenhouse 2005 - Action in Climate Change Conference being held in Melbourne this week. The head of the National Climate Centre, Michael Coughlan, says Australia has had the warmest ever first 10 months of 2005, and seems likely to be a record-breaking year.	Bad weather creates problems.	not_entailment
1194	Scott Island was discovered and landed upon in December 1902 by Captain William Colbeck commander of the Morning, relief ship for Capt. Robert F. Scott's expedition.	Capt. Scott reached Scott Island in December 1902.	not_entailment
627	The West Pharmaceutical Services plant, which had been cited for numerous safety violations last fall, made syringe plungers and IV supplies.	The West Pharmaceutical Services plant had been cited for numerous safety violations last autumn.	entailment
1559	The Independent Police Complaints Commission (IPCC) is trying to reassure lawyers for the family of Jean Charles de Menezes that the inquiry is still on track.	Police issued John Wadham's statement after lawyers for the de Menezes family met with the complaints commission, demanding more information about the killing.	not_entailment
2369	"They brought us 7-Up, bottled water, ice and a diet of rice, though you didn't feel like eating," said Jim Lankes, 48, of Phoenix.	Jim Lankes was given bottles of waters, ice and rice.	entailment
1852	In 1975, a 19 year old Wilkins was handed the captaincy of Chelsea, despite the presence of elder and more experienced players in the squad.	Wilkins became the captain of Chelsea in 1975.	entailment
1486	Paul Watson, the founder of Greenpeace, will speak on campus Wednesday, March 3.	Paul Watson is the founder of Greenpeace.	entailment
1475	Dr Wood led a courageous and committed team in the fight to save 28 patients suffering from between two and 92 per cent body burns, deadly infections and delayed shock. As well as receiving much praise from both her own patients and the media, she also attracted controversy among other burns surgeons due to the fact that spray-on skin had not yet been subjected to clinical trials.	Burns surgeons approve Dr Wood's spray-on skin.	not_entailment
1344	In Johannesburg, about 500 angry AIDS activists, many wearing red and white T-shirts that said "HIV Positive," criticized Bush, saying he had hurt the global fight against AIDS by spending billions of dollars on war.	In Johannesburg, activists complained that Bush spent billions of dollars on the global fight against AIDS instead of on war.	not_entailment
1291	The Bolan Pass is a gap through the Toba Kakar Range of mountains on the border of Pakistan. The British took the threat of a Russian invasion of India via the Khyber and Bolan Passes very seriously so in 1837, a British envoy was sent to Kabul to gain support of the Emir, Dost Mohammed. In February of 1839, the British Army under Sir John Keane took 12,000 men through the Bolan Pass and entered Kandahar.	The British Army crossed the Toba Kakar Range of mountains in 1839.	entailment
112	The 10-men team is expected to arrive at the foot of the mountain in the end of April and began their journey to the 8,586-meter peak in early May.	Kanchenjunga is 8586 meters high.	not_entailment
1461	Critics said the National Certificate of Educational Achievement or NCEA, the main qualification for high school students, would be degraded by the authority allowing text speak use in exams.	NCEA is the main qualification for high school students.	entailment
1403	John Paul II  was the first non-Italian Pope in exactly 600 years, so other things being equal, his successor would presumably be Italian.	John Paul II is Italian.	not_entailment
278	Investigators described the gunman as white, about 30 years old, of medium build with shoulder-length, wavy blond hair and as having a "scruffy" or "grunge" appearance.	The gunman is described as a white male in his 30s with a medium build, shoulder-length blonde hair and an unkempt appearance.	entailment
184	The source added that the investigation proved that the bases of the genocide crime "were completed with a series of illegal arrests followed in some cases with assassinations or cases of disappearances and were preceded, according to information attached to the file, by cases of torture."	Investigators discovered that a series of illicit arrests of were often followed by disappearances or murders and were preceded by torture.	entailment
236	Gabriel Garcia Marquez was a liberal thinker whose left-wing politics angered many conservative politicians and heads of state. His job as a reporter for the Cuban news agency Prensa Latina, in 1960, and and friendship with Fidel Castro resulted in his being ultimately denied entry to the United States for political reasons.	Gabriel Garcia Marquez was a conservative politician.	not_entailment
2260	The Beetle has achieved an unbelievable cult status across the world, not least because its creation marked the launch of what has since become the largest car company in Europe.	Europe produces the 'Beetle'.	not_entailment
2044	Pulitzer Prize-winning American novelist John Updike has died of lung cancer at a hospice near his home in Beverly Farms, Massachusetts. He was 76. Born John Hoyer Updike in Reading, Pennsylvania in 1932, he documented ordinary ―if highly sexualized ―American life in around 50 works, beginning with The Poorhouse Fair in 1959. He once said that his books were about "the American small town, Protestant middle class".	John Updike won the Pulitzer Prize.	entailment
975	In most Pacific countries there are very few women in parliament.	Women are poorly represented in parliament.	entailment
1985	In August, Gates' foundation gave Yunus' Grameen Foundation 1.5 million for a program to extend its microfinance programs to 5 million more of the world's poorest families. Three years ago, tech entrepreneur Craig McCaw provided 2 million to start up the Grameen Technology Center, which is using microcredit to finance cheap mobile service for people in Uganda and Rwanda.	Gates' foundation extends its microfinance programs to 5 million more of the world's poorest families.	not_entailment
1310	As with the Babylonian New Year, the Chinese New Year, which occurred on the 1st of February in 2003, the day before Groundhog Day, is correlated to the beginning of spring.	The Chinese New Year's Day falls on the 1st of February in 2003.	entailment
329	Since 1974, Cyprus has been divided, de facto, into the government-controlled southern two-thirds of the island and the Turkish-Cypriot northern one-third.	Cyprus was divided in 1974.	entailment
1146	His latest release, Together Through Life, has reached the top spot 38 years and five months after his last chart-topper, New Morning, in 1970. The 67-year-old American singer-songwriter now holds the record for the longest gap between solo number one albums. It is Dylan's seventh UK number one, his 33rd studio album and his 53rd album, including compilations and soundtracks. He first reached number one with The Freewheelin' Bob Dylan released in 1964. HMV's Gennaro Castaldo said: "It's evident that Dylan is going through one of his zeitgeist moments, as a new generation of fans join his more established followers in appreciating his musical legacy."	Gennaro Castaldo is 67 years old.	not_entailment
1155	NEW YORK - (Business Wire) Pfizer Inc announced today that it has become the first pharmaceutical company to be accredited by the Association for the Accreditation of Human Research Protection Programs (AAHRPP) for ensuring the protection of human subjects taking part in early-stage clinical trials. The AAHRPP accreditation was awarded to Pfizer's clinical research units (CRUs) in New Haven, CT, Brussels, Belgium and Singapore, where the company conducts most of its Phase I clinical research. To earn the accreditation, Pfizer participated in a rigorous, 15-month examination of the clinical research practices at these units.	Pfizer is a pharmaceutical company.	entailment
1136	Two persons were injured in dynamite attacks perpetrated this evening against two bank branches in this northwestern, Colombian city.	Two bank branches were attacked with dynamite.	entailment
1332	Treasures belonging to Hollywood legend Katharine Hepburn have raised £3.2m at a two-day auction in America.	A two-day auction of property belonging to actress Katharine Hepburn brought in 3.2 million pounds.	entailment
230	The ghost shirt was then donated to the Glasgow Museum in 1892 by an Indian interpreter and has remained a visitor attraction for 100 years. It became the subject of an ownership wrangle when descendants of the Sioux tribe petitioned for its return in 1995. The Wounded Knee Survivors Association including a Lakota elder had it returned to the tribe.	A Sioux ghost shirt was returned by a Scottish museum.	entailment
