index	sentence1	sentence2	label
1529	On the morning of 1 June, there was a blackout throughout most of the capital caused by urban commandos of the Farabundo Marti National Liberation Front (FMLN).	FMLN caused a blackout in the capital.	entailment
1666	Capital punishment has a deterrent effect.	Capital punishment is a deterrent to crime.	entailment
1938	Egon Eiermann (born September 29, 1904, Neuendorf; died July 20, 1970, Baden-Baden) was one of Germany's most prominent architects in the second half of the 20th century.	Egon Eiermann died on September 29, 1904.	not_entailment
2336	The Antarctic ozone 'hole' is defined as a thinning of the ozone layer, over the continent, to levels significantly below pre-1979 levels.	The ozone hole is above Antarctica.	entailment
2435	However, Peter Cervelli of the Alaska Volcano Observatory said that "Anchorage might dodge the bullet" and come through the eruption unscathed. Dave Stricklan of the National Weather Service predicted a "light dusting" of fine ash that would disrupt air travel but not seriously affect people on the ground. Mudflows may affect the Drift and Crescent Rivers. Mount Redoubt last erupted in late 1989, causing mudflows which put an oil refinery at risk while ash from the eruption stalled the engine of a passing airliner. US$160 million worth of damage was estimated to have been caused.	The Volcano Observatory in Alaska is the employer of Peter Cervelli.	entailment
832	An American journalist of Russian descent, Klebnikov was shot four times by at least one assassin in a passing car as he stepped outside his office that evening in Moscow. He died shortly after arriving at City Hospital No. 20 in Moscow.	Vladislav Listyev was murdered in Moscow.	not_entailment
1131	Sir Ian Blair, the Metropolitan Police Commissioner, said, last night, that his officers were "playing out of their socks", but admitted that they were "racing against time" to track down the bombers.	Sir Ian Blair works for the Metroplitan Police.	entailment
1436	Co-author Dr Zita Martins, a chemist and astrobiologist from Imperial College London, believes their findings suggest that some of the chemicals that generated life on Earth came from meteorite bombardments. "We are not saying that only meteorites contributed to the building blocks of life," she said, "but it's a very great contribution." Other scientists, however, do not believe that meteoritic chemicals played such a significant role. According to Emeritus Professor Robert Shapiro of New York University, "They're a subunit of a subunit of DNA. My opinion is that their amounts were utterly unimportant and insignificant." Wikinews contacted Professor Paul Davies, a physicist and astrobiologist presently at Arizona State University, about the recent findings. While he agreed with the findings, he said that he thinks such discoveries are "a red herring in the origin of life story - a hangover from the Miller-Urey experiment. Life is all about information - its replication and processing."	Shapiro teaches at NY University.	entailment
485	Aboard Air Force One, Nov. 22, 2006 President Bush and Iraqi Prime Minister Nouri al-Maliki will meet next week in Jordan to discuss the deteriorating security situation in Iraq.	Jordan will host the meeting between President Bush and Iraqi Prime Minister Nouri al-Maliki.	entailment
1015	In 1932 he joined the then illegal Communist party and held high government and party posts from 1942, becoming home secretary in 1948, when the Communist party took control in Hungary.	Communist control in Hungary ended in 1948.	not_entailment
1968	Professor Sir Alec Jeffreys, whose pioneering discoveries revolutionised police investigation techniques, told the Guardian newspaper innocent people were being "branded as criminals" because the database retained details of everyone arrested, regardless of whether they were later convicted. The Government now holds more than five million profiles, up 1.4 million in two years. Sir Alec also called for improved genetic testing procedures, warning that the current system could result in a miscarriage of justice, in an interview with the Guardian newspaper.	Alec Jeffreys is the inventor of genetic fingerprinting.	not_entailment
67	Sonia Gandhi can be defeated in the next elections in India by BJP.	Sonia Gandhi is defeated by BJP.	not_entailment
1357	About 30,000 Rolling Stones fans poured into Fenway Park this evening, fortunate to have scored tickets to the kickoff of the band's latest world tour.	The Rolling Stones have begun their latest world tour with a concert in Boston.	entailment
1731	Of course, most of the tax cuts expire in 2010; only three years from when Rangel would take over as chair if Democrats win.	Democrats won the elections three years ago.	not_entailment
2201	The United Nations last night elected eight judges for the international war crimes tribunal that will try those accused of murders and other atrocities in former Yugoslavia since 1991.	11 judges in the Yugoslavia war tribunal were sworn in at the World court.	not_entailment
1312	We present a novel approach to enhance avalanche companion rescue using wearable sensing technologies. The time to find and extricate victims is most crucial: once buried by an avalanche, survival chances drop dramatically already after the first 15 minutes.	Robots are used to find avalanche victims.	not_entailment
49	Argentina sought help from Britain on its privatization program and encouraged British investment.	Argentina sought UK expertise on privatization and agriculture.	not_entailment
772	"Unlike the three subtypes, Zaire, Sudan and Ivory Coast, which can cause hemorrhagic symptoms, Reston does not. There has been no evidence that Reston can cause significant illness in humans. When Reston was previously found in monkeys, few animal handlers were infected but only one had very mild symptoms," the DOH's official website announced. In January 1997, the Philippines Department of Environment and Natural Resources ordered the immediate slaughter of some 600 monkeys in Ferlite, a breeding farm in Laguna, to prevent an outbreak of Reston ebolavirus.	DOH stands for Department of Hurricanes.	not_entailment
29	The Armed Forces Press Committee (COPREFA) admitted that the government troops sustained 11 casualties in these clashes, adding that they inflicted three casualties on the rebels.	Three rebels were killed by government troops.	entailment
229	On Friday evening, a car bomb exploded outside a Shiite mosque in Iskandariyah, 30 miles south of the capital, killing seven people and wounding 10, doctors said on condition of anonymity.	A bomb exploded outside a mosque.	entailment
1342	The assassins of former Defense Minister Enrique Lopez Albujar Trint are presumably members of the Maoist terrorist organization, Shining Path, since the counterterrorism division has identified one of them as Gerardo Olivos Silva, through a composite made from witness' reports.	Gerardo Olivos Silva is a member of the Maoist terrorist organization Shining Path.	entailment
295	A recent study offers sound medical proof that ACE inhibitors, like beta-blockers and aspirin, can improve a patient's odds of surviving a heart attack.	People experienced adverse effects while taking aspirin.	not_entailment
1059	In the United Kingdom, The Carphone Warehouse, Celebrity Big Brother's sponsor, has pulled out after some of the reality TV show's contestants were accused of racism, with which the company did not want to be associated. The Perfume Shop has announced they will withdraw the perfume Shh... of Jade Goody, one of the contestants accused of bullying with a racist undertone. Motorcycle insurance company Bennetts unilaterally terminated its deal with former Miss England Danielle Lloyd to front an advertisement campaign.	Jade Goody is a contestant in Celebrity Big Brother.	entailment
2368	C&D Technologies announced that it has closed the acquisition of Datel, Inc.	C&D Technologies acquired Datel Inc.	entailment
516	Munir Mezyed, a poet and critic, aroused the sentiments and emotions of the audience when he recited his smooth flowing poetry both in Arabic and English, which demonstrated his unique and overwhelming style.	Gotthold Ephraim Lessing lived from 1729 to 1781.	not_entailment
1958	O'Connor then fought on the side of the Republicans in the 1921-22 Civil War, with those who favored rejection of the treaty which brought peace between Ireland and Britain, but at the cost of a divided island.	Ireland has been divided since 1921.	not_entailment
1310	As with the Babylonian New Year, the Chinese New Year, which occurred on the 1st of February in 2003, the day before Groundhog Day, is correlated to the beginning of spring.	The Chinese New Year's Day falls on the 1st of February in 2003.	entailment
1559	The Independent Police Complaints Commission (IPCC) is trying to reassure lawyers for the family of Jean Charles de Menezes that the inquiry is still on track.	Police issued John Wadham's statement after lawyers for the de Menezes family met with the complaints commission, demanding more information about the killing.	not_entailment
890	The terror attacks, it was clear, had blasted a hole in the dam holding back Mumbai's reservoir of woes. While the protesters seemed to be reacting to a tragedy that had left at least 164 people dead and 308 injured, they were really venting the frustrations of having to cope with life in a city with an infrastructure so stretched that simply getting to work and back is an ordeal. At peak hour, the commuter trains - which carry six million people each day - are packed with up to 5,000 commuters, even though they're built for 1,800. Every day, an average of 11 people die on the railway system, either because they fall off the trains or because they're hit by passing locomotives as they cross the tracks.	11 people died in the terror attacks in Mumbai.	not_entailment
222	An Israeli judicial inquiry has ruled out prosecuting the police officers who shot dead 13 Israeli Arabs during a violent demonstration in 2000.	Israel will not prosecute the police who killed 13 Israeli Arabs during pro-Palestinian protests in 2000, because of a lack of evidence, an official inquiry said yesterday.	not_entailment
843	Two women from two counties are dead and police have some clues as to who murdered them.	Police gather clues in double assassination.	entailment
727	The Dayton Peace Accords for Bosnia and Herzegovina was the first major peace agreement adopted after the Beijing conference, in December 1995.	The Dayton Peace Treaty was formulated to end the war in Bosnia.	entailment
582	The GDP report showed growth in business outlays advanced at a solid 8.9% pace.	The GDP was a disappointing report.	not_entailment
1595	There is no way Marlowe could legally leave Italy, especially after an arrest warrant has been issued for him by the authorities. Assisted by Zaleshoff, he succeeds in making his escape from Milan.	Marlowe supported Zaleshoff.	not_entailment
2440	Although the birth rate is the highest it has been for five years, there were still more deaths in Scotland than births last year.	Scotland is the European country with the highest birth rate.	not_entailment
280	A Pentagon committee and the congressionally chartered Iraq Study Group have been preparing reports for Bush, and Iran has asked the presidents of Iraq and Syria to meet in Tehran.	Bush will meet the presidents of Iraq and Syria in Tehran.	not_entailment
1936	British armor crashed into a jail in order to free the two soldiers who were arrested by Iraqi police and militiamen.	UK troops stormed a police station in Iraq.	not_entailment
361	Secretary-General Kofi Annan and Nane Annan are greeted by President Fidel Castro upon their arrival at Jose Marti Airport in Havana on April 10.	Castro visits the UN.	not_entailment
1608	At the 1932 Olympic Games in Los Angeles, Didrikson won gold medals in the javelin (Olympic record) and 80-meter hurdles (world record), along with a silver in the high jump (share of the world record).	2,45 m is the world record in the high jump.	not_entailment
2149	Kozlowski and the company's former chief financial officer, Mark Swartz, were sentenced, on Monday, to up to 25 years in prison.	Two former bosses of US manufacturer, Tyco, have been sentenced to up to 25 years in jail for stealing more than $150m (£m) from the company.	not_entailment
144	The Counts of Holland and Geldern, between whose territories the lands of the Bishops of Utrecht lay, also sought to acquire influence over the filling of the episcopal see. This often led to disputes and consequently the Holy See frequently interfered in the election.	The Counts of Holland supported the Holy See.	not_entailment
299	Kerry hit Bush hard on his conduct on the war in Iraq.	Kerry shot Bush.	not_entailment
1071	Meanwhile, at a Pushkin-Goethe Festival held recently in Moscow to observe the poets' birthdays (this year is Goethe's 250th), Dmitri Prigov, a post-modernist poet and conceptual artist, took the first line from "Onegin" ("My uncle - high ideals inspire him") and set it to Buddhist and Muslim mantras and Russian Orthodox and Gregorian chants.	Johann Wolfgang von Goethe was born in Germany.	not_entailment
870	It uses the first day of the first month of the Lunar Year as the start of the Chinese New Year.	The Chinese New Year's Day falls on the first day of the first month of the Lunar Year.	entailment
1850	In 1867, Nobel obtained a patent on a special type of nitroglycerine, which he called "dynamite". The invention quickly proved its usefulness in building and construction in many countries.	Alfred Nobel is the inventor of dynamite.	entailment
1265	She has become world renowned for her patented invention of spray on skin for burns victims, a treatment which is continually developing. Via her research, Fiona found that scarring is greatly reduced if replacement skin could be provided within 10 days. As a burns specialist the holy grail for Dr Fiona Wood is 'scarless, woundless healing'.	Dr Fiona Wood has invented a treatment for burns victims.	entailment
740	Three major bombings in less than a week will be causing some anxiety among political leaders in Baghdad and Washington.  Last Thursday 10 people were killed by a car bomb at a crowded cattle market in Babel province, south of Baghdad.  On Sunday more than 30 died when a suicide bomber riding a motorbike blew himself up at a police academy in the capital. Tuesday's bombing in Abu Ghraib also killed and wounded a large number of people - including journalists and local officials.	Some journalists and local officials were killed in one of the three bombings in the Baghdad area.	entailment
1463	While the Baltic countries are set to join the European Union soon, their economies are already in good shape. Estonia, Latvia and Lithuania boast the fastest economic growth in the entire Baltic Sea region, for example.	The Baltic Countries will join the EU.	entailment
983	They're being forced to live on crumbs, so nuns at a Hollywood convent famous for its pumpkin bread are warning that they may have to slice up the place for development. The threat of a shutdown of the 75-year-old Monastery of the Angels below the Hollywood sign has prompted neighbors and supporters to mount a campaign to save the four-acre religious retreat. The volunteers say they may turn to the nuns' moist and fragrant pumpkin bread to help make up a cash shortfall that has slashed the monastery's operating budget by more than 70%.	The Monastery of the Angels was founded 75 years ago.	entailment
169	U.S. President George W. Bush and Congressional leaders from both political parties have reached agreement on US$150 billion in tax relief in an effort to help stimulate the United States economy. VOA White House Correspondent Scott Stearns has the story. The agreement includes provision to give up to US$600 in tax rebates to millions of wage earners and an additional US$300 refund for each child. It allows businesses to immediately write off 50 percent of capital equipment purchases.	The Congress wants to boost the economy.	entailment
204	More than 2,000 people lost their lives in the devastating Johnstown Flood.	100 or more people lost their lives in a ferry sinking.	not_entailment
2325	The main institutionalised forms of recognition for those who have made a significant contribution in the fields of physics, chemistry, medicine, literature, as well as for those working for peace (and more recently in the area of economics), are the Nobel prizes.	Nobel Peace Prize candidates have been chosen.	not_entailment
614	One year on since he was elected to office as President of Paraguay, Fernando Lugo is making headlines in the country he leads, but for all the wrong reasons. Newspapers and TV programmes have been dominated by stories of women coming forward to claim they had a child with the former Catholic bishop. This "political soap opera", complained one of these reports, is "paralysing the government".  Three women have made allegations so far and there were reports in the Paraguay media that there may be more claims to come.	Fernando Lugo was a Catholic bishop.	entailment
1461	Critics said the National Certificate of Educational Achievement or NCEA, the main qualification for high school students, would be degraded by the authority allowing text speak use in exams.	NCEA is the main qualification for high school students.	entailment
1061	Iraq's representative to the United Nations, Nizar Hamdoun, announced today, Sunday, that thousands of people were killed or injured during the four days of air bombardment against Iraq.	Nizar HAMDOON, Iraqi ambassador to the United Nations, announced that thousands of people could be killed or wounded due to the aerial bombardment of Iraq.	not_entailment
1074	The first Windows DNA lab outside Microsoft was established in suburban Philadelphia in June 1998.	Microsoft was established in June 1998.	not_entailment
895	About 2,200 Americans and 27,000 Filipinos died from disease and starvation at Camp O'Donnell before the camp was closed in July 1942, just three months after the beginning of the Death March. Ortega -- now the lone surviving member of the 192nd tank battalion - spent 3 ½ years in captivity in the Philippines and Japan before being liberated in August 1945 following the atomic bombs that devastated Hiroshima and Nagasaki, forcing a reluctant Japan to surrender. Ortega eventually returned to the United States in October 1945, the first of five brothers to return home from the war. A sixth died in action.	Americans used atomic bombs on Hiroshima and Nagasaki in 1945.	not_entailment
1234	Levomepromazine has prominent sedative and anticholinergic/ sympatholytic effects (dry mouth, hypotension, sinus tachycardia, extreme night sweats) and causes massive weight gain. These side effects normally do not allow to give the drug in doses needed for full remission of schizophrenia, so it has to be combined with a more potent antipsychotic.	Levomepromazine causes schizophrenia.	not_entailment
2169	In an interview with the Sci Fi Wire, Robert Shaye, co-chairman of New Line and executive producer of The Lord of the Rings, said that New Line does not want to do any films, including The Hobbit, with Mr Jackson in the future. "I do not want to make a movie with somebody who is suing me. It will never happen during my watch." "I don't care about Peter Jackson anymore. He wants to have another $100 million or $50 million, whatever he's suing us for," Mr Shaye said.	New Line wants to work with Peter Jackson.	not_entailment
2231	The fight originated when Gilson Ramos da Silva, 21, a.k.a. "Gilson Aritana," a member of the ADA ("Amigos do Bairro") gang led other members into the "morro da Mineira" (Miner Hill) to sell drugs, Ricardo Teixeira Dias, a local police official said. The region is controlled by rival gang Comando Vermelho (Red Command), which does not approve of other gangs selling drugs in the region. Comando Vermelho members started attacking the rival members of ADA to protect their turf.	Ramos da Silva killed 11 people.	not_entailment
875	A wooden steamer of 293 ft sank on 10/13/1902, 13.5 miles North by Northwest of Fairport Harbor, Ohio. The lives of ten of the 19 persons on board were lost in the wreck.	100 or more people lost their lives in a ferry sinking.	not_entailment
1776	The president Cristiani spoke today at the El Salvador military airport before he left for Costa Rica to attend the inauguration ceremony of president-elect Rafael Calderon Fournier.	Rafael Calderon Fournier has been elected president of Costa Rica.	entailment
2311	A front page editorial in South Africa's largest weekly newspaper, The Sunday Times, criticizes President Thabo Mbeki's "incompetent" handling of the country's ongoing anti-immigrant violence, and urges him to resign from office. "Either he will not lead or he cannot lead. Whichever is the case, the conclusion is the same: he must go," the editorial reads. "And so we appeal to President Mbeki: Stand down in the interests of your country."	"The Sunday Times" is the name of the largest weekly newspaper in South Africa.	entailment
988	The National Park Trust identified 20 high-priority sites - including the Blue Ridge Parkway in North Carolina and Virginia and Everglades National Park in Florida - as areas with private property that could be sold.	Everglades National Park is located in Florida.	entailment
1332	Treasures belonging to Hollywood legend Katharine Hepburn have raised £3.2m at a two-day auction in America.	A two-day auction of property belonging to actress Katharine Hepburn brought in 3.2 million pounds.	entailment
879	The Socialist Party was formerly part of the Labour Party, which has ruled the United Kingdom since 1997 and remains a member of the Socialist International. On the bus, Saunders and some of his cohorts — they occasionally, especially the older members, address each other as "comrade" — explains their view on how the split with Labour came about. As the Third Way became the dominant voice in the Labour Party, culminating with the replacement of Neil Kinnock with Tony Blair as party leader, the Socialist cadre became increasingly disaffected. "There used to be democratic structures, political meetings" within the party, they say. The branch meetings still exist but "now, they passed a resolution calling for renationalisation of the railways, and they [the party leadership] just ignored it." They claim that the disaffection with New Labour has caused the party to lose "half its membership" and that people are seeking alternatives.	The Socialist Party was founded in the United Kingdom.	not_entailment
1188	Speaking in the Russian Black Sea resort of Sochi on Monday, Mr Putin said the deal was "at the very least ill-considered and unprofessional because discussing such issues without the main supplier is simply not serious". Despite their bitter rivalry, Ukrainian President Viktor Yushchenko and Prime Minister Yulia Tymoshenko were both in Brussels for an international conference with the European Commission, the World Bank and other key lenders. The EU gets 80% of its gas supplies from Russia via a network of more than 13,000km (8,060 miles) of Ukrainian pipelines, some of which are 40 years old.	Putin is 40 years old.	not_entailment
186	Felicity Huffman and Patricia Arquette became first-time Emmy winners as they received lead actress honors, while Tony Shalhoub and James Spader, once again, proved favorites in the best actor category.	Patricia Arquette collected best drama actress for psychic crime drama "Medium", while James Spader won best actor for "Boston Legal" for a second year.	not_entailment
608	Los Angeles Mayor James Hahn, along with top members of the Automobile Club of Southern California, along with will announce the kickoff of a $9 billion plan to fund Los Angeles County's Top Ten Traffic Busters.	James Hahn is a member of the Automobile Club of Southern California.	not_entailment
405	Qwest's revised bid, which did not offer more cash for MCI stock as expected, was deemed disappointing by one major MCI shareholder, and Qwest's shares fell more than 8 percent.	MCI shareholders accepted a $6.7 billion offer over Qwest's initial $8 billion.	not_entailment
1444	The man known as just the "Piano Man" has left the hospital and has returned home to his native Germany. According to British tabloids, the man, after losing his job in Paris, travelled to the UK through the Channel Tunnel.	The "Piano Man" came from Germany.	entailment
948	Byrraju Ramalinga Raju, founder and chairman of Satyam Computer Services, and his brother, B. Rama Raju, the company's managing director, were arrested late Friday by Andhra Pradesh police. The brothers were placed under judicial custody in a Hyderabad, India jail and will remain there until January 23. Facing charges of criminal breach of trust (Section 406 of IPC), criminal conspiracy (Section 120-B), cheating (Section 420), falsification of records and forgery (Section 468), and fraudulent cancellation of securities (Section 477-a), they face up to ten years imprisonment if convicted.	Raju has Hepatitis-C.	not_entailment
2170	Martin was taken to New Orleans Ochsner Foundation Hospital, where nurse Jinny Resor said he was treated for dehydration.	Jinny Resor is employed at Ochsner Foundation Hospital.	entailment
