index	sentence1	sentence2	label
539	An Iraqi official reported today, Saturday, that 68 Iraqi civilians were killed as a result of the American and British bombing on Iraq and that their funerals were held today in Baghdad.	The 68 civilians killed as a result of the Anglo-American bombing of Iraq, were buried today in Baghdad.	entailment
788	State Police issued bulletins via teletype requesting patrols to be on the lookout for Robert Senacal, 35, of Cortlandt Manor.	Robert Senacal was arrested by police.	not_entailment
2176	The comments made by Wells today, regarding the commissioner of baseball, do not in any way reflect the views of the club, Sox said in a statement.	David Wells' comments drew a quick response from the players' union and the commissioner's office.	not_entailment
1046	Gen. Maza Marquez said that the fact that a payment is being offered for the capture of Pablo Escobar does not mean that other persons accused of being capos of the mafia are not being sought, and that if anyone being held in connection with the investigation of the killing of Luis Carlos Galan is released, that does not mean that the investigations are not proceeding well.	Luis was killed by the capos of the mafia.	not_entailment
398	Io is 2,236 miles (3,598 kilometers) in diameter, slightly larger than the Earth's moon.	The terrestrial moon has a diameter of 3746 kilometers.	not_entailment
2159	Benjamin Vanderford, 22, said he posted the 55-second clip, which shows a knife sawing against his neck, on an online file-sharing network in May.	Mr Vanderford said he filmed his own mock execution in a friend's garage to show how the media could be fooled.	not_entailment
268	In 1983, McClintock found that bacteria have rings of DNA (plasmids) that reproduce and have genetic changes that tell the bacteria how to defend itself against the antibiotics.	Bacteria is winning the war against antibiotics.	not_entailment
1941	Prosecutors were still expected to unseal an 11-count manslaughter indictment against the ferry's captain, Michael Gansas. He violated procedure by his absence from the wheelhouse during docking, when Smith lost control of the ferry.	Mr Smith entered his guilty plea to 11 counts of manslaughter and also to lying to investigators about his medical history, under an agreement reached with prosecutors.	not_entailment
2365	Iran is said to give up al Qaeda members.	Iran hands over al Qaeda members.	entailment
74	Ruth's 1927 single season record of 60 home runs stood unsurpassed until Roger Maris hit 61 in 1961.	Babe Ruth hit 60 home runs in his lifetime.	not_entailment
1879	TWA connects through New York en route to Frankfurt . Lufthansa , the German airline , flies direct daily from Los Angeles to Frankfurt , and the airline shares flights with Lauda Air , an Austrian carrier , on Wednesdays , Fridays and Sundays to fly directly to Munich . Another German airline , Ltu , also flies direct from Los Angeles to Dusseldorf and Munich on Mondays and Thursdays . Frankfurt is the hub for trips to most of the country 's smaller cities.	Lufthansa is the German airline.	entailment
674	Gold mining operations in California and Nevada use cyanide to extract the precious metal.	Cyanide is used in gold mining.	entailment
2015	Hudson's mother, Darnell Donerson, 57, and brother, Jason Hudson, 29 were found dead in Donerson's home on October 24 and the body of Hudson's 7-year-old nephew, Julian King was found four days later in a stolen SUV. A handgun police say is tied to the case was found nearby, but Reuters reports that Bond did not comment on any evidence in the case.	Jason Hudson was Jennifer's brother.	not_entailment
2139	Stolen Warhol works recovered: Amsterdam police said Wednesday that they have recovered stolen lithographs by the late U.S. pop artist Andy Warhol worth more than $1 million. Dali's paintings are still missing.	Millions of dollars of art were recovered, including works by Dali.	not_entailment
2019	While the total population for Missouri increased by 2.8 percent, the Hispanic population shows a 24.9 percent increase between 2000 and 2004.	Missouri's population is 2.8 million.	not_entailment
659	Reagan was seriously wounded by a bullet fired by John Hinckley Jr. in an attempted assassination, but made a remarkably speedy recovery.	Reagan survived an attempted assassin's bullets.	entailment
2111	A 15ft (4.5 meter) northern bottle-nosed whale has been spotted swimming in the river Thames in Central London, UK. The "Thames whale" managed to swim up past the Thames barrier and under many bridges, reaching as far as Chelsea before it turned around just before Albert Bridge. TV news helicopters scrambled to provide live TV footage of the whale, and many spectators lined the banks of the river. The whale is said to be looking healthy, although some fear that the whale may beach itself as it tried to do before rescuers forced it back into the middle of the river. Normally found in the North Atlantic, there have been sightings of a second whale near Southend.	The River Thames flows through London.	entailment
1294	Thai soldiers have been accused of crossing into Cambodia near a disputed temple where the two sides briefly exchanged fire last year. A spokesman for Cambodia's government said that about 100 troops crossed the border before retreating hours later. A Thai border commander denied there had been any troop movements and said there had been no increase in tension. Thailand and Cambodia both lay claim to the temple area. Despite several rounds of talks, a settlement remains elusive. Soldiers from the two countries have been stationed in the area since the clashes in July last year.	Thai soldiers have shot two Cambodians crossing the border.	not_entailment
2418	Last week, NATO and Iran had contact for the first time in thirty years, NATO officials stated Thursday. "[An Iranian] diplomat met with Assistant Secretary General for Political Affairs and Security Policy Martin Erdmann," said chief alliance spokesman James Appathurai. The Iranian embassy in Brussels declined to comment on the visit. The visit to Brussels by the Iranian diplomat was the first "since the regime of the Shah" collapsed by the Ayatollah Khomeini led Iranian Revolution in 1979.	Martin Erdmann works for Iran as a diplomat.	not_entailment
385	The Actors Studio offering will be based on Simon's female version of the play which was premiered in 1985 in New York, at the Broadhurst Theatre, with the characters' names being Florence Unger and Olive Madison, played by Sally Struthers and Rita Moreno respectively.	Broadhurst Theatre is located in New York.	entailment
1394	In that decade, Missouri's Hispanic population grew to 118,000 from about 60,000, he said.	Missouri's population is 118,000.	not_entailment
675	Hakimi also claimed that the rebels killed Mawlavi Waqifi, a religious leader in the southeastern province of Khost.	Mawlavi Waqifi lived in the southeastern province of Khost.	entailment
316	The Pakistani news source GEO states that the first explosion occurred at 9:05 local time (0505 UTC), with the second explosion occurring minutes afterwards. The explosions occurred at the parking lot of the Marriott Hotel in Karachi, about 60 feet (18 meters) from the consulate gate. Damage to the building as well as over ten nearby vehicles was also reported. The Associated Press reports that the same consulate has been targeted twice in the recent past: an attack in 2002 left 14 Pakistanis dead, and in 2004 police defused a time bomb before it was set to detonate.	There is a Marriott Hotel in London.	not_entailment
1100	After leaving Time-Life, Shuker joined the Public Broadcast Laboratory, forerunner of PBS, and participated in two pioneering films -- 'The Chair,' about an attorney trying to save a condemned man, and 'Free At Last,' a 90-minute documentary about Dr. Martin Luther King Jr. that by chance was being made when King was murdered in 1968.	Martin Luther King was murdered in 1968.	entailment
1200	Then the most important part of the day begins as Muslims go to the mosque, their special place of worship.	Muslims pray at the mosque.	entailment
1598	A U.S. soldier accused of participating in the rape of an Iraqi girl and then killing her and her family was sentenced to 90 years in jail on Thursday, media reports said.	A U.S. soldier was sentenced to 90 years in jail.	entailment
878	Hovind, self-styled as "Dr. Dino" (whose Ph.D, from a non-accredited correspondence university, is in Christian education) believes in Biblical literalism claimed that he is not liable for taxes and his "ministry" does not have to "render unto Caesar" because, as he claimed, his workers are "missionaries" not "employees". Hovind's tax troubles date back to at least 1996, when a judge at Hovind's bankruptcy trial wrote, Hovind "failed to acknowledge his obligations as a citizen and taxpayer of the United States, seeks to utilize this taxpayer supported court in order to thwart the lawful collection efforts of the Internal Revenue Service." The judge concluded, Hovind filed for bankruptcy in "bad faith," and lied about his possessions and income.	Hovind  was found guilty on 59 federal counts.	not_entailment
693	Ms. Miers' whole life was based in Dallas and revolved around her legal work, her family and an attachment to an evangelical church that led her to what her former pastor described as a flowering of faith late in life.	Ms. Miers was a leader of an evangelical church.	not_entailment
72	Most people are familiar with the idea of St. Bernards or other dogs taking part in rescue and recovery efforts. Robots might also take part in search and rescue missions.	Robots are used to find missing victims.	entailment
1252	Lao government spokesman, Yong Chantalangsy, said Rangoon has promised to announce its decision in Vientiane.	Yong Chantalangsy is a representative of Laos.	entailment
924	A recent study found no evidence of seasonal affective disorder in Iceland where the sun does not appear for a long time in the winter.	Seasonal affective disorder (SAD) is a worldwide disorder.	not_entailment
1720	Alan Mulally, Boeing's head of the unit, said at the start of the strike that it may cause delivery delays that would give Airbus SAS an advantage in what is the strongest commercial aircraft market in five years.	Alan Mulally is the owner of Boeing.	not_entailment
2446	The Hotel Moulin de Paris in 2.5km away from Disneyland Paris, and is located in the charming city of Magny-Le-Hongre.	EuroDisney is located in the charming city of Magny-Le-Hongre.	not_entailment
2224	Arsenal sneaked a 1-0 victory over Birmingham at Highbury, taking advantage of Stephen Clemence's own-goal in the 81st minute.	Arsenal lost to Birmingham.	not_entailment
799	The New-York based company said, Tuesday, that profits totaled a record $946 million, or 75 cents a share, in the January-March period, up from $794 million, or 61 cents a share, a year earlier.	Net income grew to $369 million, or 83 cents per share, in the January-March period from $291 million, or 65 cents per share, a year ago.	not_entailment
1141	After the SkyWest airliner touched down, the Airport Movement Area Safety System (AMASS) alerted and the air traffic controller transmitted "Hold, Hold, Hold" to the SkyWest flight crew in an attempt to stop the aircraft short of runway 1L. The SkyWest crew applied maximum braking that resulted in the airplane stopping in the middle of runway 1L. As this was occurring, the captain of Republic Airlines flight 4912 took control of the aircraft from the first officer, realized the aircraft was traveling too fast to stop, and initiated an immediate takeoff. According to the crew of SkyWest 5741, the Republic Airlines aircraft overflew theirs by 30 to 50 feet. The Federal Aviation Administration has categorized the incident as an operational error.	NTSB is responsible for investigating transportation accidents in the United States.	not_entailment
2376	The chaotic situation unleashed in Bogota last night, with the assasination of Justice Carlos Valencia, began on 28 July in Medellin, when motorized paid assasins murdered third public order Judge Maria Elena Diaz.	Justice Carlos Valencia was killed on 28 July.	not_entailment
2314	He endeared himself to artists by helping them in lean years and following their careers, said Henry Hopkins, chairman of UCLA's art department, director of the UCLA/Armand Hammer Museum and Cultural Center and former director of the Weisman foundation.	The UCLA/Hammer Museum is directed by Henry Hopkins.	entailment
1186	The steel division of Broken Hill Proprietary, the Australian resources group, and North Star steel, part of the privately-owned Cargill group in the US, are joining forces to build and operate a new steel mini-mill in the US Midwest.	Australia's Broken Hill Proprietary and the US's North Star Steel will build and operate one in the US Midwest.	entailment
409	Volkswagen should start to co-operate fully with the investigation by public prosecutors of the alleged theft of secret documents from General Motors.	German officials began investigating VW for theft.	not_entailment
1867	Often criticized and blamed for politically unpopular policies, and confronted with numerous setbacks, the World Bank is experiencing a difficult time with regard to which strategies to adopt, in particular in Africa.	The World Bank is criticized for its policies.	entailment
1410	Scientists had thought all gamma-ray bursts had a standard energy.	The scientists had thought that all explosions gamma the ray have a standard energy.	not_entailment
354	President Fujimori was first elected in 1990, and then re-elected in 1995 under a new constitution.	President Fujimori was re-elected in 1995.	entailment
1374	The Republic of Tajikistan, which declared independence from the Soviet Union in 1991, is in a region that has changed hands many times.	The Soviet Union collapsed in 1991.	not_entailment
286	Claes denied categorically that they had ever known of the existence of an Agusta proposal, and told the NATO ambassadors that he did not know anything about an Agusta payment to the Socialist Party.	NATO Secretary General Willy Claes resigned.	not_entailment
2212	IKEA offers fantastic and affordable solutions for your home furnishing needs.	Ikea is a home.	not_entailment
120	The Kinston Indians are a minor league baseball team in Kinston, North Carolina. The team, a Class A affiliate of the Cleveland Indians, plays in the Carolina League.	Kinston Indians participate in the Carolina League.	entailment
2209	Also Friday, five Iraqi soldiers were killed and nine wounded in a bombing, targeting their convoy near Beiji, 150 miles north of Baghdad, the Iraqi military said.	Three Iraqi soldiers also died Saturday when their convoy was attacked by gunmen near Adhaim.	not_entailment
719	Kuwait becomes the fourth Gulf country where women as well as men can vote in elections. Saudi Arabia holds strictly limited, male-only elections.	Women can vote in elections in Saudi Arabia.	not_entailment
807	But these are only first hazards. "If the rain continues at the same magnitude and according to the forecast, then some of the rivers could reach flood stage either later [Tuesday] or Wednesday morning," said Allan Chapman, a hydrologist with the River Forecast Centre in Victoria.	Allan Chapman is employed at the River Forecast Centre.	entailment
1340	By the time a case of rabies is confirmed, the disease may have taken hold in the area.	A case of rabies was confirmed.	not_entailment
1757	Moreau, 72, received a Golden Bear award for lifetime achievement at the Berlin Film Festival Friday.	The Golden Palm has been awarded at the Cannes film Festival.	not_entailment
1116	For such patients, regular aspirin use significantly decreased the risk for fatal and nonfatal strokes or heart attacks.	People experienced adverse effects while taking aspirin.	not_entailment
276	Bechtolsheim left Sun in 1995 to found Granite Systems, a maker of high-speed networking systems, which he later sold to Cisco Systems.	Bechtolsheim was the owner of Cisco Systems.	not_entailment
1096	South Korea's deputy foreign minister says his country won't change its plan to send three-thousand soldiers to Iraq, despite the kidnapping of a South Korean man there.	South Korea continues to send troops.	entailment
1602	In June the Supreme Court ruled that anti-sodomy laws are unconstitutional.	U.S. Supreme Court in favor of same-sex marriage	not_entailment
2045	The participation of women in parliament in Mauritius is expected to increase as more female candidates have contested Monday's election.	Women are poorly represented in parliament.	not_entailment
2342	As a result, the elephant has been brought back from the brink of extinction, thanks to the ban on international trade in ivory and other elephant products.	The ban on ivory trade has been effective in protecting the elephant from extinction.	entailment
221	Typhoon Xangsane was downgraded to a tropical storm Sunday as it moved inland from the central Vietnam coast, where it killed two people, injured at least 80 others and damaged hundreds of homes, officials and state-controlled media reported.	A typhoon batters the Philippines.	not_entailment
2388	China has taken delivery of the first section of a futuristic high-speed train which levitates above the track.	The train literally floats above the track.	entailment
1344	In Johannesburg, about 500 angry AIDS activists, many wearing red and white T-shirts that said "HIV Positive," criticized Bush, saying he had hurt the global fight against AIDS by spending billions of dollars on war.	In Johannesburg, activists complained that Bush spent billions of dollars on the global fight against AIDS instead of on war.	not_entailment
1583	Over 100 more lives were lost at sea, and 1800 were lost in Holland.	100 or more people lost their lives in a ferry sinking.	not_entailment
1124	Canadian traffickers also are reported to drop their marijuana loads across the border in remote areas (often without the knowledge of rural landowners), cross into the United States without drugs, later retrieve the marijuana, and continue on to U.S.  distribution sites.	Most of the marijuana entering the United States comes from Canada.	not_entailment
1028	Moog's synthesiser, which bears his name, revolutionised music from the 1960s onwards, and was used by bands like The Beatles and The Doors.	Moog's instruments were used by The Beatles and The Doors among others.	entailment
816	Ramadan told reporters at the opening ceremony of the Baghdad International Exposition, "No cooperation and no inspection or monitoring by the American Zionist espionage commission (the Special Commission for disarming Iraq's banned weapons - UNSCOM) before Iraq's demands are met."	Ramadan announced that Iraq will not cooperate with the inspectors.	entailment
683	Prime Minister Silvio Berlusconi was elected March 28 with a mandate to reform Italy's business regulations and pull the economy out of recession.	The Italian Prime Minister is Silvio Berlusconi.	entailment
1409	Other drugs on the market, approved to treat mild to moderate Alzheimer's, are believed to work by inhibiting cholinesterase, an enzyme that breaks down acetylcholine which is a chemical used by nerves to communicate with each other.	Alzheimer's disease is treated using drugs.	entailment
189	Dr. Pridi was forced into exile, and Field Marshal Pibul again assumed power.	Pibul was a field marshal.	entailment
732	Friday, June 9, 2006 Oklahoma Governor Brad Henry signed SB 1800 that allows the death penalty or life without parole for those convicted of sexually abusing a child under the age of 14. Additionally, the bill also establishes a Child Abuse Response Team within the Oklahoma State Bureau of Investigation. Oklahoma has now joined Florida, Louisiana, Montana, and South Carolina to have similar measures for repeat child molestation.	SB 1800 is a law that protects children.	entailment
258	Tilda Swinton has a prominent role as the White Witch in "The Chronicles of Narnia: The Lion, The Witch and The Wardrobe", coming out in December.	Tilda Swinton plays the part of the White Witch.	entailment
2384	Bowles will take the title HRH Duchess of Cornwall, changing it to the Princess Consort, when Charles becomes King.	Bowles will be known as HRH Duchess of Cornwall.	entailment
139	Doug Lawrence bought the impressionist oil landscape by J. Ottis Adams in the mid-1970s at a Fort Wayne antiques dealer.	Doug Lawrence sold the impressionist oil landscape by J. Ottis Adams	not_entailment
981	Lucinda Creighton has claimed that people resent her as being "overambitious" and "in too much of a hurry" to climb the political ladder. The outspoken Fine Gael deputy was speaking after a heated exchange with Enda Kenny led to her walking out of a parliamentary party meeting last week. Creighton, who at 29 is already acknowledged as a potential future leader of Fine Gael, slammed detractors who see her rapid success in a "negative" light -- and believes her friend and colleague Leo Varadkar has suffered the same fate. Speaking in the run up to the Fine Gael Ard Fheis, Ms Creighton also rejected suggestions which surfaced last week that she is seen as a 'loose cannon' within the party.  "I certainly don't regard myself as a loose cannon. I'm absolutely part of the Fine Gael team," she said.	Lucinda Creighton is the leader of a parliamentary party.	not_entailment
571	So far the British have preferred a policy of a voluntary approach to restricting advertising and high taxes on tobacco products.	Sales have declined due to restrictions on advertising.	not_entailment
1168	The Interacademy Panel on International Issues (IAP), a global network of the world's science academies, has released a statement urging parents and teachers to provide children with 'the facts about the origin and evolution of life on Earth'. The statement is signed by 67 of the 92 member academies of the organisation, and notes that in some schools around the world, "testable theories" about evolution are being "concealed, denied or confused by theories not testable by science".	Scientists want children to learn evolution.	entailment
116	Toshiba, the world's third-largest notebook computer maker behind Dell Inc. and Hewlett-Packard Co., said the PC would be introduced in Japan in early 2006.	Toshiba is a subsidiary of Dell Inc.	not_entailment
209	Australia was one of the countries in the U.S.-led coalition that invaded Iraq in 2003.	The coalition is coordinated by the U.S	entailment
66	The former leader of Iraq was rushed to hospital last Sunday after refusing to eat for sixteen days. But according to news agencies, he has ended the hunger strike by eating lunch at the court in Baghdad. "Saddam ate beef and rice and cola with bread which he brought from hospital," one source told Reuters news agency. He was fasting with three co-defendants, and they were demanding more security for their defence lawyers, three of whom have been murdered.	Some Australians have fasted to protest.	not_entailment
600	After graduating in 1977, Gallager chose to accept a full scholarship to play football for Temple University.	Gallager attended Temple University.	entailment
576	The so-called "grandmother hypothesis", based on studies of African hunter-gatherer groups, suggests that infertile women are vital for successful child-rearing despite being unable to produce children themselves.	The "grandmother hypothesis" suggests that infertile women are very important for raising children.	entailment
1029	With half of the vote counted, the ANC has 66% of the vote. Its nearest rival, the Democratic Alliance, has 16%, while ANC splinter-group the Congress of the People trails with 8%.  The results will see ANC leader Jacob Zuma elected as President of South Africa when the National Assembly reconvenes in May.  Provincial elections are also being held, and the ANC looks likely to lose power in the province of Western Cape to the Democratic Alliance. This will be the first time an opposition party has won control of a provincial parliament since the end of apartheid.  The election campaign has focused on crime, poverty, and the suitability of Zuma to be President. Zuma was acquitted of rape in 2006, and corruption charges against him were withdrawn shortly before the election after prosecutors found the charges had been politically motivated.	Jacob Zuma is the leader of the ANC party.	entailment
1378	This document declares the 'irrevocable determination' of Edward VIII to abdicate. By signing this document on December 10th, 1936, he gave up his right to the British throne.	King Edward VIII abdicated on the 10th of December, 1936.	entailment
467	In fact, Woolsey had had no first-hand experience with the world of spies until President Bill Clinton appointed him Director of Central Intelligence.	James Woolsey is the director of the CIA.	entailment
1057	In 2003, Yunus brought the microcredit revolution to the streets of Bangladesh to support more than 50,000 beggars, whom the Grameen Bank respectfully calls Struggling Members.	Yunus supported more than 50,000 Struggling Members.	entailment
1887	George Herbert Walker Bush (born June 12, 1924) is the former 41st President of the United States of America. Almost immediately upon his return from the war in December 1944, George Bush married Barbara Pierce.	The name of George H.W. Bush's wife is Barbara.	entailment
2160	Accompanied by Sioux prayers and the keening of Scottish bagpipes, a plain cotton shirt was returned to South Dakota this past summer.	A Sioux ghost shirt was returned by a Scottish museum.	not_entailment
1579	No case of indigenously acquired rabies infection has been confirmed in man or any animal species during the past 2 years.	A case of rabies was confirmed.	not_entailment
