index	sentence1	sentence2	label
774	Manuel Rosales, who ran against Mr Chavez in the 2006 presidential election, faces corruption charges he says are baseless. He had been in hiding since the charges were filed last month. Venezuela's Interior Minister Tareck el-Aissami said Mr Rosales was a criminal on the run. "If he doesn't appear before the appropriate courts, he would be a fugitive from justice, and as a result the court will activate mechanisms for his international capture," said Mr Aissami, denying that the charges were political.	Manuel Rosales was mayor of Maracaibo.	not_entailment
1893	While civilians ran for cover or fled to the countryside, Russian forces were seen edging their artillery guns closer to Grozny, and Chechen fighters were offering little resistance.	Grozny is the capital of Chechnya.	not_entailment
1250	Nicholas Burns stated in an exclusive interview for "Utrinski Vesnik" from Pristina that it would be disgraceful if Athens puts a veto on Macedonia's application for membership in the European Union and NATO.	Greece and Macedonia are in dispute over name.	not_entailment
2025	With the arrival of the torch to Rome, it begins the ritual of the 2006 Winter Olympics of Turin. The torch will travel across Italy transported by more than 10'000 carriers and it will arrive in Turin on February 9, 2006, where the Winter Olympics will be inaugurated, after 11'000 km (6,835 miles) of travel. On November 27 the flame was burned on the altar of Hestia in Olympia, in Greece, and delivered to the first torch carrier, pole vaulter Kostas Fidippidis. The first Italian to carry the olympic flame is the marathoner Stefano Baldini, winner of gold medal at the Olympics in Athens. He received the torch from the President of the Italian Republic Carlo Azeglio Ciampi.	The Winter Olympics will be inaugurated in Turin.	entailment
31	Archaeologists have found approximately 30 beautifully preserved mummies in a 4,000 year old Egyptian necropolis which held 53 tombs. Supervisor of Antiquities for Middle Egypt Dr. Abdel-Rahman El-Ayedi's team established his archaeological site in the Faiyum Oasis near the El-Lahun Egyptian pyramid which is just south of Cairo. Besides the mummies, the team found masks, amulets, clay pots and an offering table located in a funerary chapel. The chapel dates back to about 30 BC to 337 AD.	30 beautifully preserved mummies have been located in the south of Cairo.	entailment
420	The focus on the engines and the fuel, stems from the pilot's radio call, shortly before the crash.	The pilot had been attempting an emergency landing, after both engines failed.	not_entailment
2441	The Australian state of New South Wales (NSW) launched its latest anti-cannabis campaign in Sydney today. The campaign, which specifically targets 14 to 19 year-olds aims to reduce the number of young people experimenting with the drug. The advertisements follow a tightening of cannabis laws in NSW last year. The campaign, which NSW Health has cost at AUD$600,000 will use a variety of print ads placed at bus stops and in youth magazines in addition to  advertisements on websites such as MySpace and MSN. Print ads use a tag line saying "Pot. It mightn't kill you, but it could turn you into a dickhead".	People are likely to start smoking tobacco when young.	not_entailment
1380	Martha Stewart, 64, is back, after serving five months in a West Virginia federal prison for lying about a 2001 stock sale.	Martha Stewart was convicted of lying about a stock trade and served five months in prison.	entailment
136	On December 7, BBC News reported a story about Dr James Anderson, a teacher in the Computer Science department at the University of Reading in the United Kingdom. In the report it was stated that Anderson had "solved a very important problem" that was 1200 years old, the problem of division by zero. According to the BBC, Anderson had created a new number, that he had named "nullity", that lay outside of the real number line. Anderson terms this number a "transreal number", and denotes it with the Greek letter F. He had taught this number to pupils at Highdown School, in Emmer Green, Reading.	Dr James Anderson is an employee at the University of Reading.	entailment
13	Oil prices fall back as Yukos oil threat lifted	Oil prices rise.	not_entailment
925	The beginning of March 2009 marked one year since the election of Dmitry Medvedev as president of Russia. Although he announced from the outset that the fight against corruption would be one of his main priorities, his first year in office has shown that these words—as in the years of presidents Yeltsin and Putin—were nothing more than propaganda. Medvedev occupies the highest post in a state in which corruption is neither a secondary feature nor an aberration, but rather its essence. From top to bottom, corruption in post-Soviet Russia permeates the bureaucratic apparatus, the security structures and big business. Like a virus in the blood of a diseased organism, it is present in all commercial and government relations. For the "system" it is everything—its foundation and true ideology, which can be summarized with the banal formulas: "Everything is for sale" and "Get rich."	Putin is the Prime Minister of Russia.	not_entailment
662	Ostriches put their heads into the sand to avoid the wind.	Ostriches bury their heads in the sand.	entailment
1603	NRDC states its mission as follows: The Natural Resources Defense Council's purpose is to safeguard the Earth: its people, its plants, animals, and the natural systems on which all life depends.	The Natural Resources Defense Council safeguards the Earth.	entailment
2080	In 1955, the Aurora Borealis, a coating applied to crystal stones to produce a "rainbow of colors" effect was introduced.	The Aurora Borealis was discovered in 1995.	not_entailment
1133	The White House failed to act on the domestic threat from al Qaeda prior to September 11, 2001.	White House ignored the threat of attack	entailment
404	Another French daily newspaper talks about PixVillage.	PixVillage is a French newspaper.	not_entailment
2406	According to COPREFA, another soldier was wounded in a guerrilla ambush against the elite Bracamonte Battalion on a highway in central El Salvador.	The Bracamonte Battalion was attacked by guerrillas.	entailment
1318	Mr Green, Marks & Spencer's new owner, has made a lot of money by taking over underperforming businesses.	Mr Green tries to take over Marks & Spencer.	not_entailment
281	Vatican spokesman Joaquin Navarro-Valls announced that Pope John Paul was still in serious condition, but he was not in a coma.	Joaquin Navarro-Valls is the Vatican Spokesman.	entailment
2235	Passions surrounding Germany's final match at the Euro 2004 soccer championships turned violent when a woman stabbed her partner in the head because she didn't want to watch the game on television.	A man was stabbed because of a soccer game.	entailment
2150	One year after shareholders approved a massive expansion in its pool of stock options, eBay is asking for more.	Shareholders approved expansion for one year.	not_entailment
2250	The measures currently in force include a travel ban on senior government figures, but France has invited Mr. Mugabe to a Franco-African summit in Paris next month, angering several countries.	France angered a number of countries, by inviting Mr. Mugabe to attend a Franco-African summit in Paris.	entailment
1181	London Metropolitan Police commissioner Sir Ian Blair has confirmed that there have been three small explosions on tube trains at Warren Street, Oval and Shepherd's Bush stations, and another small explosion on a No. 26 bus on Hackney Road in Bethnal Green. The London Ambulance Service has not found any injured people, but one person has reported themselves to a local hospital. It is not yet known if this is connected with the blasts.	Police report there has been an explosion in the tube station.	entailment
347	It also raised questions about the quality of financial regulation in Singapore, where derivatives losses run up by former trader Nick Leeson led to the 1995 collapse of Barings Plc.	Nick Leeson was arrested for collapse of Barings Bank PLC.	not_entailment
2151	Sara Jane Moore, 77, who tried to assassinate Former United States President Gerald Ford in 1975 was paroled from prison in California this afternoon. Moore tried to assassinate Ford outside of the St. Francis Hotel in downtown San Francisco on January 15, by firing one shot, which missed because a bystander grabbed Moore's arms just seconds before she fired the gun. The bullet missed hitting Ford in the head by inches.	Sara Jane Moore is no longer in prison.	entailment
2290	At least 58 people are now dead as a result of the recent flooding in Yemen, and at least 20,000 in the country have no access to shelter. Five people are also reported missing. The Yemeni government has pledged to send tents to help the homeless. The flooding is caused by the recent heavy rain in Yemen, which came as a shock due to the fact that the country only receives several centimeters of rain per year.	Heavy rain caused flooding in Yemen.	entailment
2258	Confidential scriptural materials allegedly stolen from a church were not "trade secrets" as defined by California statute.	Trade secrets were stolen.	not_entailment
2485	There is none. They found as many weapons in this masjid as they found weapons of mass destruction in Iraq.	Weapons of mass destruction found in Iraq.	not_entailment
1431	Her husband, political novice Juan Carlos Lecompte, scrambles to preserve Betancourt's dream and sustain the Oxygen Green Party, the political party she founded.	Juan Carlos Lecompte is the founder of the Green Oxygen Party.	not_entailment
3	Judie Vivian, chief executive at ProMedica, a medical service company that helps sustain the 2-year-old Vietnam Heart Institute in Ho Chi Minh City (formerly Saigon), said that so far about 1,500 children have received treatment.	The previous name of Ho Chi Minh City was Saigon.	entailment
993	The airline now flew under the name Sabena - Belgian World Airlines.	Sabena is an airline.	entailment
490	March 30, 2009—Researchers may have finally come face-to-face with the real—and wrinkled—Nefertiti, thanks to sophisticated CT scanning technology. A carefully carved limestone face in the inner core of the Egyptian queen's famous bust (above, right) has emerged in new images, a new study says. The object, currently on display in Berlin's Altes Museum, was discovered in 1912 during an excavation of the studio of Egyptian royal sculptor Thutmose. The artist had sculpted Nefertiti—wife of Pharaoh Akhenaten—more than 3,300 years ago.	Nefertiti died in 1912.	not_entailment
245	Madrid: Luis Roldan, the former Spanish chief of police who fled the country 10 months ago after allegedly hiving off millions of pounds from secret government funds, was on his way home to a prison cell last night after being captured in Bangkok.	Luis Roldan was director of police from 1986 to 1993.	not_entailment
1915	Clonaid, which claims to have produced 13 cloned babies worldwide, told the Streats daily newspaper two Singaporean couples had signed deals agreeing to pay $200,000 to conceive children through cloning.	Clonaid has cloned 13 babies.	entailment
521	In Wednesday's filing, Google said it planned to complete the IPO "as soon as practicable."	It's unclear whether Wednesday's twist will affect the timing of Google's initial public offering.	not_entailment
1992	A bouncer at the Irish Pub in Atlantic City, New Jersey was stabbed to death Saturday morning while trying to break up a fight. Luis Martinez, 25, of Newark, was arrested on two charges of aggravated assault for the brawl that left 27-year-old Richard Rivera dead.	Richard Rivera caused the death of Luis Martinez.	not_entailment
1721	An Iraqi official reported today, Saturday, that 68 Iraqi civilians were killed as a result of the American and British bombing on Iraq and that their funerals were held today in Baghdad.	Reports from an Iraqi official today, Saturday, said that the 68 civilians killed as a result of the Anglo-American bombing of Iraq, were buried today in Baghdad .	entailment
495	The Rolling Stones kicked off their latest tour on Sunday with a concert at Boston's Fenway Park.	The Rolling Stones have begun their latest  tour with a concert in Boston.	entailment
273	Rich and poor nations struck a historic deal on Sunday to slash billions of dollars in farm subsidies, create more open industrial markets and revive stalled world trade talks that could boost global growth.	Rich and poor nations crashed into a historic deal on Sunday.	not_entailment
449	But Rajeev Dhawan, director of the Economic Forecasting Center at Georgia State University, says the main issue ahead is higher inflation.	The Economic Forecasting Center is located in Georgia.	entailment
337	In March, Wikinews held an exclusive interview with Max Riekse, one of the candidates for the Constitution Party nomination for the 2008 United States presidential election. With the Constitution Party's national convention underway this weekend, we spoke with him one last time before he either becomes his party's candidate or loses. Riekse is a retired decorated Lieutenant Colonel in the U.S. Army who served in both the Vietnam War and the Iraq War. He is also a former public school teacher and Assistant Professor of Military Science at Western Michigan University. He has a B.A. in Political Science and International Relations from the University of South Florida as well as two M.A.s, one in Political Science and International Relations, the other in Education and History. Both are from Western Michigan University.	The Constitution Party includes Max Riekse among its members.	entailment
1777	AT&T Corp. says it will stop selling traditional local and long-distance residential service in seven states, blaming its move on a court decision that it says will result in higher prices for its use of regional networks.	AT&T blames a court decision that will cause higher prices.	entailment
834	A decision to allow the exiled Italian royal family to return to Italy may be granted amid the discovery that the head of the family, Prince Vittorio Emmanuele, addressed the president of Italy properly. He has called President Ciampi "our president, the president of all Italians".	Italian royal family returns home.	not_entailment
549	Today about 75% of people live in cities or towns. Art and culture are an important part of France.	75 people live in France.	not_entailment
415	The plant, located in Romulus, near Wayne, is about 15 miles southwest of Detroit. Initial reports stated that a single explosion in a chemical tank was the cause of the fire. The cause of this explosion has not yet been determined. Detroit ABC affiliate WXYZ confirmed that all employees made it out of the plant before the explosion occurred, and that HAZMAT teams were on the scene of the fire. Wayne County Sheriff Warren Evans announced that no injuries ere reported in the initial explosion. However, approximately 32 people were treated for breathing problems at nearby Oakwood Annapolis Hospital, due to the subsequent fire.	Romulus is found southwest of Detroit.	entailment
744	The answer to the number one question, "how many continents are there?", is seven.	There are seven continents.	entailment
665	The 84-year-old pope was wheeled to a hospital window, and blessed the crowd by making the sign of the cross in clear gestures, as a Vatican photographer snapped pictures.	The pope made the sign of the cross.	entailment
1860	THE presidents of Honduras and El Salvador were set yesterday to begin two days of talks in San Salvador, amid continuing tension in border areas.	Honduras and El Salvador entered a dispute over their borders.	entailment
809	Vegetables help to preserve your bones, and help fight the bone-thinning disease osteoporosis.	Fruits and vegetables prevent osteoporosis.	not_entailment
1594	WINNENDEN, Germany ―A teenage gunman killed 15 people, most of them female, on Wednesday in a rampage that began at a school near Stuttgart in southern Germany and ended in a nearby town, where he then killed himself after the police wounded him. The attack left Germany, which tightened tough gun controls after a similar attack at a school seven years ago, struggling to understand the carnage that had again befallen it, a country with relatively little violent crime. In 2002, a gunman killed 16 people before killing himself at a school in Erfurt, in eastern Germany.	A teenager shot 15 people in Germany.	entailment
2147	The solar system is much more complicated now, astronomers say, than in 1930 when Clyde Tombaugh added Pluto to the inventory of wandering lights circling the Sun.	Pluto was discovered by Clyde Tombaugh.	entailment
157	Google and NASA announced a working agreement, Wednesday, that could result in the Internet giant building a complex of up to 1 million square feet on NASA-owned property, adjacent to Moffett Field, near Mountain View.	Google may build a campus on NASA property.	entailment
728	A jet filled with tourists returning home to the French Caribbean island of Martinique, crashed Tuesday, in Venezuela.	A plane carrying vacationers home to the island of Martinique crashed, Tuesday, in Venezuela.	entailment
1392	The Mona Lisa, painted by Leonardo da Vinci from 1503-1506, hangs in Paris' Louvre Museum.	The Mona Lisa is in France.	entailment
1727	A report by the AfricanElephant Specialist Group, which is responsible for monitoring the conservation of the elephants,concludes that elephant poaching has increased despite the 1989 international ban on ivory trading	The ban on ivory trade has been effective in protecting the elephant from extinction.	not_entailment
260	There is no way Marlowe could legally leave Italy, especially after an arrest warrant has been issued for him by the authorities. Assisted by Zaleshoff, he succeeds in making his escape from Milan.	Marlowe was arrested by Italian authorities.	not_entailment
1432	The human rights promotion and protection secretariat of the FMLN strongly condemns the massacre of five Spanish-born Jesuit priests, and three Salvadoran citizens, carried out by the Salvadoran Armed Forces Soldiers.	The Salvadoran Armed Forces Soldiers murdered three Salvadoran citizens.	entailment
2092	A small bronze bust of Spencer Tracy sold for £174,000.	A small bronze bust of Spencer Tracy made £180,447.	not_entailment
1890	It was difficult to assess the objectives behind increased militia activity in East Timor, but its intent seemed to be to continue a pattern of violence against civilians and the United Nations Transitional Administration in East Timor (UNTAET) in order to undermine the transition process, Hedi Annabi, Assistant Secretary-General for Peacekeeping Operations, told the Security Council this morning.	Guerrillas increase activity in East Timor.	entailment
1453	At the Amman Summit of Arab Women in Jordan last month, Secretary General of the Arab League Amr Moussa said womens' advancement in the Arab world will be hobbled as long as they are so poorly represented in parliaments.	Women are poorly represented in parliament.	entailment
943	White supported Gough Whitlam's Labor government of 1972 to 1975, and after Whitlam was ousted in the 1975 constitutional crisis, became particularly anti-royalist.	White assisted the Labor government from 1972 to 1975.	entailment
542	The World Health Organization moved Friday, to revise alarming predictions that a pandemic stemming from the bird flu virus ravaging parts of Asia, could kill as many as 150 million people.	The U.N. health agency has distanced itself from a top official's prediction that a global influenza pandemic could kill as many as 150 million people.	not_entailment
1858	Xingwana called on established farmers to form partnerships with new landowners and to transfer skills to new farmers, to ensure productive use of transferred lands. One criticism of the programme is that some of the transferred farms have fallen in production due to the inexperience and lack of capital among the new owners. The government has rejected comparisons of the programme with that initiated in Zimbabwe under President Robert Mugabe.	Robert Mugabe was born in Zimbabwe.	not_entailment
70	In October, however, amid rising tensions between the government and opposition groups, a car bomb seriously injured an opposition politician and killed his driver, in Beirut.	A member of the opposition was injured in a car bomb attack in Beirut.	entailment
285	The new moon, which is only about 25 miles in diameter, was actually photographed 13 years ago by the Voyager 2.	The moon Titan has a diameter of 5100 kilometers.	not_entailment
110	Police say that he was wearing orange overalls, a balaclava and a pistol when he stole $6300 from Cherrywood at about 3:15 p.m. Outside the bank Leatham was trying to hijack a car, he threatened an old man with his pistol, eventually stealing a black Mitsubishi Mirage. The car was later found abandoned around Fairmont Terrace in the Glenn Terrace or Ridge Street area.	Children in New Zealand are forced to wear orange overalls.	not_entailment
265	Witnesses told police a gas canister exploded to start the fire in a multilevel building which houses the Ycua Bolanos supermarket, a food court and a parking garage, causing the bottom floor to collapse.	Television footage showed several levels of the multi-level supermarket covered in soot, including the lower level parking garage.	not_entailment
1786	A member of the Burmese delegation, Thaung Tun, told reporters on the eve of the meeting that his government did not wish to place ASEAN in a difficult position by insisting on assuming the chairmanship.	Thaung Tun is a representative of Burma.	entailment
224	James Kerr had been the foreman for the Deane, Adams and Deane gun factory. Robert Adams, one of the partners and inventor of the Adams revolver, was Kerr's cousin.	Dean invented a revolver.	not_entailment
2326	Police were called to the Highgrove House, the home belonging to Prince Charles and his wife Camilla on Tuesday night after police received a call that there was an intruder on the property. "He was detained within the grounds and did not gain access to any buildings," said a spokesperson for the police, Tony Rymer. A spokesperson for the estate refused to comment to the media calling it "a matter for the police" and that any comments on the intrusion should be given through them. According to a Gloucester Police spokeswoman, a man from Bristol, England was arrested after wielding a pitchfork around the property. The name of the 55-year-old has not been released, but police charged him with trespassing. He was later released after posting bail. Camilla and Charles, who were both present and sleeping on the estate at the time, were not injured.	Prince Charles owns an estate in Bristol.	not_entailment
935	Second-half goals, from Danny Mills and Darius Vassell, lifted Manchester City to a 2-0 victory over Everton.	Manchester was beaten by Everton.	not_entailment
750	The biopic of wannabe actor, Johnny Stompanato, may be directed by Adrian Lyne of "Fatal Attraction" and "Indecent Proposal" fame.	Johnny Stomponato starred in Fatal Attraction.	not_entailment
1734	The Bank of Italy, the ultimate arbiter of Italian banking mergers, has been engulfed by scandal since police wire taps revealed Fazio and his wife advised a local banker in a bid for Bank Antonveneta against Dutch bank ABN AMRO.	A local banker bids for Bank Antonveneta.	entailment
826	Valero Energy Corp., on Monday, said it found "extensive" additional damage at its 250,000-barrel-per-day Port Arthur refinery.	Valero Energy Corp. caused damages to Port Arthur refinery.	not_entailment
315	Only a few Mag-lev trains have been used commercially such as at the Birmingham airport in the UK.	Maglev is commercially used.	entailment
252	"On Feb. 20, Dr. Hunter S. Thompson took his life with a gunshot to the head at his fortified compound in Woody Creek, Colorado. The family will shortly provide more information about memorial service and media contacts. Hunter prized his privacy and we ask that his friends and admirers respect that privacy as well as that of his family," Juan Thompson said in a statement issued to Aspen Daily News. The death was confirmed by Pitkin County Sheriff Bob Braudis. Hunter S. Thompson was best known for his 1972 book "Fear and Loathing in Las Vegas". He was recently married and had emotionally supported his friend John Kerry's candidacy.	John Kerry was friends with Hunter S. Thompson.	entailment
2081	Meanwhile, thousands of soldiers from the first Gulf War are still suffering from severe symptoms that have been linked to what is now known as Gulf War illness, say veterans advocates.	Many US soldiers developed Gulf War illness after the Gulf War.	entailment
2317	China yesterday threw down a challenge to America's 50-year dominance of the global economy as it proposed replacing the dollar as the world's main reserve currency with a new global system under the control of the International Monetary Fund. In a muscle-flexing move that will be seen as an attempt to exploit the big shifts in economic power created by the recession sweeping the West, Beijing said that the dollar's role could eventually be taken over by the IMF's so-called Special Drawing Right (SDR), a quasi-currency that was created in 1969.	The Special Drawing Right is a quasi-currency.	entailment
391	Colin L. Powell and Laura Bush, wife of Gov. George W. Bush, are to speak on the opening night in Philadelphia, while the Democrats have tentative plans to have President Clinton and Hillary Rodham Clinton address the delegates on the first night in Los Angeles.	The name of George W. Bush's wife is Laura.	entailment
